,Sentences,"Scores_a_AGRICULTURE, FORESTRY AND FISHING",Scores_b_MINING AND QUARRYING,Scores_c_MANUFACTURING,"Scores_d_ELECTRICITY, GAS, STEAM AND AIR CONDITIONING SUPPLY","Scores_e_WATER SUPPLY; SEWERAGE, WASTE MANAGEMENT AND REMEDIATION ACTIVITIES",Scores_f_CONSTRUCTION,Scores_g_WHOLESALE AND RETAIL TRADE; REPAIR OF MOTOR VEHICLES AND MOTORCYCLES,Scores_h_TRANSPORTATION AND STORAGE,Scores_i_ACCOMMODATION AND FOOD SERVICE ACTIVITIES,Scores_j_INFORMATION AND COMMUNICATION,Scores_k_FINANCIAL AND INSURANCE ACTIVITIES,Scores_l_REAL ESTATE ACTIVITIES,"Scores_m_PROFESSIONAL, SCIENTIFIC AND TECHNICAL ACTIVITIES",Scores_n_ADMINISTRATIVE AND SUPPORT SERVICE ACTIVITIES,Scores_o_PUBLIC ADMINISTRATION AND DEFENCE; COMPULSORY SOCIAL SECURITY,Scores_p_EDUCATION,Scores_q_HUMAN HEALTH AND SOCIAL WORK ACTIVITIES,"Scores_r_ARTS, ENTERTAINMENT AND RECREATION",Scores_s_OTHER SERVICE ACTIVITIES
77,sustainability management,,,,,0.4273048136159372,,,,,,,,,,,,,,
79,environmental protection and safety,,0.3974866868434704,0.401643470100928,0.3694833174095712,0.4502591058487151,,,0.3932033475729285,,,,,,,,,,,
92,business development by division,,,,,,,,,,,,,,0.4536324493186591,,,,,
112,declaration by corporate management  pursuant to sections f and d of the  german commercial code,,,,,,,0.4858630489292641,,,0.3932011149959027,,,,,0.3886027743679911,,,,
114,disclosures pursuant to sections b  through e and b and c of the german  commercial code,,,,,,,0.4760255641136809,,,0.4165975814265171,,,,,,,,,
121,other liabilities,,,,,,,,,,,0.4606190804976451,,,,,,,,
122,financial instruments,,,,,,,,,,,0.54775603268086,,,,,,,,
123,financial instruments by category,,,,,,,,,,,0.4899587708825084,,,,,,,0.2993558041979836,
126,leases,,,,,,,,,,,,0.3500911785351585,,,,,,,
133,general information,,0.3320911310209014,,,,,,,0.362560423550792,,,,,,,,,0.3115422752952441,
140,discontinued operations assets and liabilities  held for sale and divestments      notes to the income statements,,,,,,,,,,,0.4614908457735162,,,0.426548726825646,,,,,0.3937927773941175
143,other operating expenses,,,,,,,,0.3851170278120193,,,,,,0.4219693472128341,,,,0.2872070867413482,
148,other financial income and expenses,,,,,,,,,,,0.4978319509759632,,,,,,,0.277740412997564,
153,property plant and equipment,0.3941288458867491,0.3279655765037008,0.3781187173755684,0.5016897573384542,0.4368507215811549,0.4438415149528286,,0.4346992012184174,,,,0.4641786906193644,,,,,,,
155,other financial assets,,,,,,,,,,,0.5811666813926011,,,,,,,,
156,inventories,,,,,,,,0.39032527359128,,,,,,,,,,,
158,other receivables,,,,,,,,0.3782682934277186,,,,,,,,,,,0.4257329642476135
161,other provisions,,,,,,,,0.4353716770102983,0.6069379717067661,,,,,,,,,0.2621779976330475,
162,financial liabilities,,,,,,,,,,,0.557418380654619,,,,,,,,
163,trade accounts payable     b  consolidated financial statements d  further information governance bodies     financial calendar and masthead     c  compensation report foreword by the chairman of the supervisory board     overview of compensation in      compensation report,,0.3439437746216631,,,,0.3478952556031509,,0.3898020704119371,0.3950870821860361,0.3512302275624038,,,,,,,,,
206,there is a whole lot of coordination monitoring and supervision going on,,,,,,,,,,,,,0.4051918791856277,,,,,,
291,during  the supervisory board monitored the conduct of the companys business by the board of management on a regular basis with the aid of detaile d written and oral reports received from the board of management and also acted in an advisory capacity,,0.3547480304385964,,,,,,,,0.3438084212735975,,,,,,,,,
293,furthermore the chairman of the supervisory board and the chairman of the audit committee were regularly in direct contact  incl uding outside of the meetings  with the heads of the law patents insurance compliance and data pr ivacy unit internal audit  and the taxes treasury and accounting unit,,,,,,,,,,0.3382085508901396,,,,,,,,,
296,where board of management decisions or actions re quired the approval of the supervisory board whether by law or under the articles of incorporation or the rules of procedure the draft resolutions were inspected by the members at the meetings of the full supervisory board sometimes after preparatory work by the committees or approved on the basis of docu ments circulated to the members,,,,,,,,,,0.3537581988939106,,,,,,,,,
297,the supervisory board was involved in decisions of material importan ce to the company,,0.333780475458119,0.3812272238696276,,,,,,,,,,,,,,,,
299,work of the supervisory board the supervisory board convened eight times in,,,,,,,,,,,,,,,0.3793753460319692,,,,
300,the attendance rate of the individual supervisory board members at the meetings of the supervisory board an d its committees is disclosed at the end of this report,,,,,,,,,,,,,,,,0.3390156378085031,,,
303,each ordinary meeting formally includes an executive session as a separate agenda item during wh ich no board of management members are present,,,,,,,,,,,,,,0.436452149434157,0.4386815749699119,,,,
307,the work of the supervisory board primarily cove red the following focal points with each topic discussed at seve ral meetings firstly the composition of the board of manage ment and especially the change in chairman ceo,,0.3413037764394632,,,,,,,,,,,,,,,,,
311,outside of the meetin gs of the supervisory board and the respective committees these issues were also the  subject of indepth dialogue between the chairman of the  supervisory board and the respect ive chairman of the board of management ceo as well as other members of the board of management,,,,,,,,,,0.3494069302658964,,,,,,,,,
312,at its individual meetings the su pervisory board mainly focused on the following topics and passed the following written resolutions,,,,,,,,,,0.3453324568626822,,,,,0.4117936440685018,0.3446870055487123,0.3375732193055292,,
319,at its ordinary meeting ahead of the annual stockhol ders meeting in april the supervisory board discussed the companys business perf ormance to date,,0.3268018800001706,,,,,,,,,,,,,,,,,
340,in addition the superv isory board addressed in detail the strategies of the group and the three divisi ons each as a separate agenda item,,,,,,,,,,,,,,,,,0.316951018075954,0.2661395922512464,
342,the presidial committee was authorized to approve the indi vidual measures under the program,,,,,,,,,,,,,,,,0.3358755875390373,,,
358,it resolved the regular d eclaration of compliance with the german corporate governance code and discussed th e planned modifications to the board of management compensation system which is to be presented to the  annual stockholders meeting,,,,,,,,,,0.3429576195592381,,,,,,,,,
367,it has the task of submitting proposals to the supervisory board on the appointment of members of the board of management if the necessary twothirds majority is not achieved in the first vote at a full supervisory board meeting,,,,,,,,,,,,0.3509794309754552,,,,,,,
368,in addition certain deci sionmaking powers in connection wi th capital measures including the power to amend the articles of in corporation accordingly have been delegated to this committee,,,,,,,,,,0.4143275551546184,,0.3492037433560265,,,0.4451201151883484,,,,
369,the  supervisory board can also delegate certain responsi bilities to the presidial committee on a casebycase basis,,,,,,,,,,0.3451569407339633,,,,,0.3891508729481349,,,,
370,furthermore the presidial committee may undertake preparatory work for meetings of the full  supervisory board,,,,,,,,,0.3580010963338741,,,,,,0.3718197520259997,,,,
377,other members of the commi ttee also have expertise in these areas,,,,,,,,,,,,,0.5211290346229158,,,,,,
379,its tasks include in particular examining the financ ial reporting and monitoring  the financial reporting  process the effectiveness and approp riateness of the internal control system and the risk management system the effectiveness of the intern al audit system the compliance syst em and the audit of the financial statements,,0.3584807323354847,,,,,,,,,0.5240555326054704,,,,,,,,
382,further tasks include holding discussions with  the board of management on the halfyear financial reports and any quarterly reports or quarterly statements to be issu ed prior to their publication,,0.3564162013088461,,,0.4044277124076548,,,0.3787964772588615,0.3595070053357856,,0.5280757778770422,0.4064163967603496,0.4092219180392656,0.4581949210720967,,,0.3725909537115791,0.2693588897733106,
384,it also prepares the agreem ents with the auditor dealing in particular with the awarding of the audit contract the determination of the main areas of focus fo r the audit and the audit fee agreement and takes appropriate measures to dete rmine and monitor the auditors independence,,0.3271227764416899,,,,0.3876456888630232,,,0.3643389924270037,,,,,,0.3875763614954212,,,,
389,it resolves on behalf of the supervisory board on the approval of relatedparty transactions pursuant to sections a to c and section  of the stock corporation act where su ch transactions require su pervisory board approval and the supervisory board has n ot entrusted the approval decision to any other committee,,,,0.359214491373593,,,,0.3934639354167695,,0.384973978740484,,0.3845677947850716,,,0.4029142745148067,,,,
408,at an extraordinary meeting in october which wa s attended by all committee members as well as most of the other supervisory board members as guests the committee discussed the assessment of possible measures to change the grou ps structure,,,,,,,,,,,,,,0.4208995460352652,,,,,
412,other topics included  the provisional audit planning of internal audit as well as the  audit budget of the auditor for,,,,,,0.3509747518843259,,,,,,,,,,,,,
423,to our stockholdersreport of the supervisory boardbayer annual report  the human resources and compensation committee co nvened for six meetings,,,,,,,,,,,,,,,,,,,0.3931308769807951
427,nomination committee  this committee carries out preparatory work when an election of stockholder  representatives to the supervisory board is to be held,,,,,,,,,,,,0.338424083914068,,,,,,,
439,within its area of  responsibility the committee advises and oversees  the management and prepares any supervisory board decisions to be  made,,,,0.3520271749668021,,,,,,0.3425940818225828,,0.3396203655252047,,,0.4131483542394849,,,,
451,this mainly pertains to  the way sustainability is incorporated into the business strategy th e establishment of sustainability ta rgets nonmandatory esg reporting and the auditing thereof if applicable opportunities and risks and organizational  structures and processes in esg areas provided the audit committee is not alr eady responsible for these ma tters,,,,,0.4128155858680469,,,,,,,,,,,,,,
452,within its area  of responsibility the co mmittee advises and oversees management and prepares any supervisory board  decisions to be made,,,,,,,,,,,,,,,0.3739983337827421,,,,
465,the topics included board of management compensation the composition of the supervisory board and other governancerelated matters,,,,,,,,,,,,,,0.4148697351960033,,,,,
473,the participation of the individual  supervisory board members in the meetings of the supervisory board and its committees is shown below   supervisoryboard of which held in personauditcommittee of which held in personhuman resources and compensation committee of which  held in personinnovation committee of which  held in personesg committee  of which  held in person nomination committee of which  held in person number of meetingsparticipation rate   number   number   number   number   number   number prof,,,,,,,,,,,,,,,,0.3397819593758106,,,
486,the applicable fu rther requirements of section a of the german commercial code were also taken into account,,,0.4333433245477419,0.3933305944581347,,0.4207660544900988,0.5302288431899399,0.3986144258307732,,0.4588932569672342,,,,,0.3822741341275938,0.3418796259592922,,,
635,in addition to bilateral investor conversations con ferences and roadshows we also hosted two webinars during which we provided informatio n on current topics,,,,,,,,,,,,,,,,,,0.270593397418488,
636,here we feel it  is important to bring in experts from the divisions and central func tions as this helps give capital market participants a deeper understanding of the various topics while also prov iding a direct channel for investors to communicate their needs to the company,,,,,,,,,,,,,0.4715251758589838,,,,,,
670,the company plans to mainly use the proceeds to repay financial liabilities due in,,,,,,,,,,,0.465103997792617,,,,,,,,
674,our aim is to elucidate the interactions between fina ncial ecological and societal factors and underline their influence on our companys longterm success,0.3918443759923292,,,,,,,,,,,,,,,,,,
675,all information required by commercial law is combined and referenced in our nonfin ancial statement,,,,,,,0.4431627796432364,,,0.3651398946840495,,,,,,,,,
686,the legality accuracy and expediency of the nonf inancial statement have been veri fied by the supervisory board,,,,,,,,,,0.3560444379031989,,,,,0.3802860285390279,,,,
688,furthermore contents subject to the statutory disclosure requirement are published in the federal gazette under consideration of the specifications of the european single electronic format esef regulation,,,,,,,,,,0.4621294823314785,,,,,,0.3828784770712893,,,
689,data collection and reporting thresholds in accordance with ifrs  noncurrent assets held  for sale and discontinued operations financial indicators are given for continuing operations unless oth erwise explicitly indicated,,,,,,,0.4196816669821081,,,,0.4562063561520366,,,,,,,,
690,the same logic applies principally to hr procurement and hse health safet y and environment inform ation and to our social data,,,,,,,,,,,,,0.4441535311314832,,,,,,
693,environmental indicators are measured at all environmentally relevant prod uction research and administration sites,,,,,0.3957953992991015,,,,,,,,,,,,,,
695,the audit which is conducted to obtain reasonable a ssurance also includes the disclosures pertaining to the nonfinancial statement in the management report,,,,,,,,,,,0.4575761417638363,,,,,,,,
696,exempted from this are table a,,,,,,,,,0.3663899794851797,,,,,,,,,,
698,and the subsequent passages pertaining to the nonfinancial group targets in chapter,,,,,,,,,,,,,,,0.3736395919996896,,,,
703,which were reviewed on a limited assurance basis in,,,,,,,,,,,,,,,0.3877385677428388,,,,
717,our work helps prevent alleviate and treat diseases empowers pe ople to take better care of their own health needs and also plays a part in ensuring that enough agricultural products are produced while respecting our planets natural resources,,,,,,,,,,,,,,,,,0.3744008598899181,,
718,our activ ities are systematically guided by our mission health for all hunger for none,,,,,,,,,,,,,,,,,0.3368278165913385,,
724,this mainly comprises the groups strategic alignment resource allocation and the manage ment of financial affairs and managerial staff along with the management of the groupwide operationa l business of the crop sc ience pharmaceuticals and consumer health divisions,0.3870574928842846,0.3382793465653727,,0.36515419742996,,,,,0.3611648059060493,,,,,0.4174688981622547,,,,,
725,the enabling functions support the operational business,,,,0.3829808598047101,,,,,,,0.461608772282735,,0.4459198790435713,0.4990693290364057,,,,,
736,our divisions are active in the following areas crop science  is the worlds leading agricult ure enterprise by sales with businesses in crop protection seeds and traits,0.4124676428917108,,,,,,,,,,,,,,,,,,
738,we market these products  primarily via wholesalers and retailers or directly to farmers,0.3682380476833595,,,,,,,,,,,,,,,,,,
744,the division also comprises the radiology business which markets diag nostic imaging equipment and digital solutions together with the necessary cont rast agents,,,,,,,,,,0.3997818738821023,,,0.4439189831151861,,,,,,
750,the enabling functions  such as group finance human resources  and information te chnology serve as groupwide competence centers and bundle business su pport processes and servic es for the divisions,,0.3754729099585964,,0.4237361467555008,,,0.4328059385992334,,0.3723962284909777,0.3713073284741714,0.5194579515259823,0.3571418670578377,0.4886977685079171,0.5483237139848053,0.3839324689749295,,0.4070907557524603,0.3364248683237975,0.486209413456634
753,corporate profile and structure more information on the divisions products and activities is contained in  the following table a,,0.3990522646466863,,,,,0.4839143558228152,,,0.3655966718938693,,,,0.4594446809607082,,,0.3193645898020559,0.317989349013647,0.4031914061312177
755,products and activities of the divisions indicationapplicationbusiness  core activit ies and markets  main products and brands crop science   herbicides chemical crop protection products to control weeds adengo alion atlantis conviso harness laudis roundup sakura xtendimax corn seed  traits seeds and traits for co rn dekalb rib complete smartstax vitala vt double pro vt triple pro vtpro soybean seed  traits seeds and traits for soybeans asgrow intacta rrpro intacta  xtend monsoy roundup ready  xtend xtendflex fungicides biological and chemical products to protect crop plants against fungal diseases ambition antracol delaro complete fox infinito luna nativo prosaro serenade xivana xpro insecticides biological and chemical products to protect crop plants from harmful insects and their larvae confidor curbix flipper movento sivanto vayego velumverango vynyty citrus cotton seeds and traits fo r cotton bollgard  xtendflex deltapine thryvon vegetable seeds vegetable seeds deruiter seminis digital agriculture digital applications fo r agriculture climate fieldview forground other seeds and traits for oilseed rapecanola rice wheat and other crops,0.4440728946615312,,,,,,,,,,,,,,,,,,
756,products for consumer lawn and garden use and forestry golf courses railway tracks and landscape applications,0.3753313666824641,,,,,,,,,,,,,,,,,,
768,strategy and targets  group strategy a growing and aging world population and the increasing strain on natures ecosystems are among the major challenges facing humanity,0.363664132615465,,,,,,,,,,,,,,,,,,
779,activities are prioritized on  the basis of their contribution to the mission and progress is measured in short day cycles giving us  much greater agility,,,,,,,,,,,,,0.4153476471729135,0.4177908905638579,,,,0.2630753070415116,
780,it al so enables us to eliminate coordination work and reduce management layers,,,,,,,,,,,,,0.4112743206703224,0.4324837774607389,,,,,
781,strategies of the divisions crop science the landscape is changing in agri culture increased pressures due to climate change combined with a growing population have created a pivotal moment in how our customers provide food fuel and textile fibers for a world that needs to lear n to live within planetary boundarie s,0.4370724025811582,,,,,,,,,,,,,,,,,,
786,an additional concept we are involved in is covercress for biofuels which encompasses an oilseed for biofuels that of fers covercrop benefits for the ecosystem,0.4326711397357032,,,,,,,,,,,,,,,,,,
788,in addition we generate value in the businesstobusiness area through a variety of digital platforms e,,,,,,,,,,,,,,,,,,0.3298954319138957,
793,strategy and management our mission is to transform the agricu ltural sector at scale on the basi s of regenerative farming and to create a more sustainable food production system,0.4607009876319504,,,,,,,,,,,,,,,,,,
794,fo r us regenerative agriculture is an outcomebased production model based on two key building blocks productivity which focuses on helping farms to produce more with less and regeneration which focu ses on delivering a positive impact on nature,0.4146390423763493,,,,,,,,,,,,,,,,,,
795,our central objectives are to increase ag ricultural yields and thereby im prove the economic and social wellbeing of farmers while at the same time ensuring a positive impact on the environment for example by improving soil health reducing greenhouse gas emissi ons and increasing carbon sequestration to halt the advance of climate change protecting and promoting  biodiversity and conser ving water resources,0.4968163879049341,,,,,,,,,,,,,,,,,,
796,as part of our commitment to sustainable agriculture  we are pursuing ambitiou s sustainability targets for,0.3752931899823853,,,,,,,,,,,,,,,,,,
799,we also aim to reduce the environmental impact of our global cr op protection portfolio pe r hectare by  against a  average baseline,0.3755738828994265,,,,,,,,,,,,,,,,,,
811,furthermore we own the full global marketing rights for the abovementioned products,,,,,,,,,,0.3499302860638175,,,,,,,,,
829,another focus is on improving womens health and strengthening their ro le in society by helping to pr omote gender equality and womens economic participation,,,,,,,,,,,,,,,,,0.4476929764066968,0.2694023403824052,
831,our partnerships with organiza tions such as unfpa usaid the bill  melinda gates foundation and the red cross as  well as digital partnerships with your life life yangu unfpa india and zuri health support this  goal,,,,,,,,,,,,,,,,,0.336954821021953,,
835,we provide consumers with products services and information that empower them to improve their everyday health,,,,,,,,,,,,,,,,,0.3265497535570357,,
843,by  we aim to expand  access to selfcare for  million people in economically or medically  underserved communities,,,,,,,,,,,,,,,,,0.3984922921521491,,
852,this will involv e a variety of measures such as switching to renewable sources for  of the electricity we purchase,,,,0.4696920019523877,,,,,,,,,,,,,,,
858,as a sciencebased company we place particular emphasis on our inno vation capabilities in all divisions,,,,,,,,,,,,,0.4974121356100907,,,,,,
862,this involves our company purchasing certificates from certified climate pr otection projects that satisfy externa lly recognized quality standards,,,,,,0.393663868340272,,,,,,,,,,,,,
885,economically or medically  covering scope  and  emissions marketbased of sites that have an energy consumption in excess of,,,,0.3604978435724936,,,,,,,,,,,,,,,
887,c above preindustrial level  corresponding to the sustainability target of limiting global temperature rise to below c above preindustrial level  by the end of   in accordance with the criteria set out by the science based targets initiative sbti the scope  categories relevant for ou r goal include emissions in the following categories  purchased goods and services  capital goods  fuel and energyrelated activi ties  upstream transportation and distribution and  business travel,,,,0.3514282247258553,,,,,,,,,,,,,,,
890,to be offset by purchasing certificates from verified climate protection projects primarily in forestry and agriculture  in our crop science  division we support smallholder farmers by supplying highquality seeds and crop protection products technologies and services,0.3770246242507775,,,,,,,,,,,,,,,,,,
900,in our consumer health  division we advance access to everyday  health for people in underserved communities,,,,,,,,,0.3648584774126197,,,,,,,,0.4482874715194169,,
909,in the scope  science based targets sbt categories that are relevant for our company our em issions fell by,,,,,,,,,,,,,0.4054404608811417,,,,,,
913,and the associated logistics operations scope,,0.4376020965066145,0.4235692113205453,0.3972293270240709,,0.3872126658368868,0.5179876327697011,0.5857709594667915,0.3677054749828336,,,,,0.4712791438824354,0.3849965600959682,,,,
919,management systems planning and steering economic planning and steering are conducted in line with the frameworks that are set for the group and the divisions by the board of management in the co urse of the strategic planning process and are translated into specific targets du ring operational planning,,0.3546677711810021,,,,,,,,,,,,,,,,,
920,the planning and steering process is complemented by the continuous monitoring of business developments with key financial and nonfinancial management and performance indi cators being updated regularly,,0.3437892934390235,,,,,,,,,,,,,,,,,
923,in order to reflect the operational business development of the group and the divisions,,0.3452669579032412,,0.3523869572781719,,,0.4323632181933175,,,,,,,0.4914569961427525,,,,0.2673326205410682,
942,this is achieved through internal regulations and a pplicable processes involving clear roles and responsibilities,,0.335424478404596,,0.3507514096124913,,,,,,0.4017072550827993,,0.3344370231124843,0.4250312390886024,,0.4493359695453199,,0.3389938553023661,,
946,our activities focus on innovative products based on our research and developm ent rd competencies supplemented by new approaches in our process servi ce and business models,,0.3266428703470718,,,,,,,,,,,0.4835738617724758,0.4338211487076424,,,,,
947,we are also committed to social innovation to improve living conditions for people in developing countries and disadvan taged individuals in our society,,,,,,,,,,,,,,,,,0.3460708494471226,,
955,focus on innovation excellence in research and development the activities we pursue are aligned with the innovati on strategies of our divisions and are aimed at improving human and plant health and sustainably safeguarding stable harv ests in agriculture in line with our mission health for all hunger for none,0.3747522232877923,,,,,,,,,,,,,,,,,,
960,with our investments in research and development we have developed cuttingedge technologies and innovations which are designed  to increase our customers productivity and thus enhance food security and help farmers further redu ce the environmental cost of agriculture,0.3687046637814808,,,,,,,,,,,,,,,,,,
961,some of these innovations were presented to the public in  at the inaugural crop science innovation summit with the concept of regenerative agriculture taking cen ter stage,0.3978842495578772,,,,,,,,,,,,,,,,,,
