4901,this included the development of a comprehensive specification document that aimed to achieve a full rollout of paper shipping bags while eliminating plastic shipping bags,,,,,,,,0.4017965954307873,,,,,,,,,,,
4907,mechanical recyclability documentation  upon written request suppliers shall provide documentation on mechanical recyclability of products e,,,0.5526727523525633,,,,0.4697819508248962,,,,,,,,,,,,
4914,come from responsibly managed forests supporting our circularity policy by reducing waste and enhancing material reuse,0.3894451855996333,,,,,,,,,,,,,,,,,,
4916,launched in  this process was applied to our mediumsized boxes covering some fulfilment centres for lounge by zalando and return centres avoiding the use of  metric tons of new boxes in that year,,,,,,0.3871198610423251,,,,,,,,,,,,,
4922,the full implementation is expected to be completed by  in  fulfilment and return  centres with plans for future expansion,,,,,,0.4295427648681501,,0.4304328587560427,,,,,,,,,,,
4931,market scope is differentiated by i the number of markets in which customers can sell back to us tradein in  live in at de dk nl se and ii the number of markets in which customers can purchase second hand clothing preowned in  live in  markets at be cz de dk companycombined managementreport consolidated financialstatements other informationand service zalando se annual report   unaudited,,,,,,,0.5568657967842108,,,,,,,,,,,,
4935,in   locations carried a dedicated preowned space offering women and men preowned clothing dresden düsseldorf frankfurt hamburg hannover cologne leipzig mannheim münster stuttgart ulm,,,,,,,,,,,,,,,,,,0.305570498780154,
4940,additionally we are incorporating materials produced using lower environmental impact and processing techniques,,0.3534509575125721,0.4998317880189749,,,,,,,,,,,,,,,,
4947,we will source preferred material options including recycled for polyester and organic regenerative and recycled for cotton among others,,,0.4186738809940331,,,,,,,,,,,,,,,,
4958,the scope includes both our own operations and upstream sourcing with a global reach,,,,,,,,,,,,,,0.4429135096777258,,,,,
4963,for recycled content only the percentage of recycled material within the primary component is counted as sustainably sourced,,,0.4881917953857171,,,,,,,,,,,,,,,,
4971,resource inflowsat zalando resource inflows include all products and materials that enter our facilities including packaging,0.3487532951501812,,,,,,,0.4750313841321587,,,,,,,,,,,
4972,this encompasses items from various businesses our bc segment fashion including retail and partner business as well as all product categories such as private labels  lounge by zalando  zalando outlets  and  recommerce in addition to our bb segment with zeos fulfilment including zfs and our multichannel fulfilment offering,,,,,,,0.4985403630135417,,,,,,,,,,,0.3636709778844696,0.4333535889374666
4975,the resource inflow metrics refer to all products and materials used for the production of products and packaging,,0.3732936789213919,0.4731954050048916,,,,,,,,,,,,,,,,
4977,the resource inflow metrics were calculated using all available article and packaging data including weight material composition and sustainab ly sourced  and recycled  materials data,,0.3538354614403322,,,,,,,,,,,,,,,,,
4978,this includes materials adhering to thirdparty certifications or licensed or trademarked standards such as the global recycle stan dard  and the global organic textile standard,,,0.5289511407416824,,,,,,,,,,,,,,,,
4981,additionally a binary classification system is applied to distinguish between technical and biological materials,,0.4468400117797464,0.529805522719412,,,,,,,,,,0.439354710874992,,,,,,
4988,companycombined managementreport consolidated financialstatements other informationand service zalando se annual report  resource inflowsoverall total weight of technical and biological materials used during the reporting period in tons,,0.3645743926738535,,,,,,,,,,,,,,,,,
4991,percentage of biological materials that is sustainably sourced,0.3845607586687751,,,,,,,,,,,,,,,,,,
4994,the absolute weight of secondary reused or recycled components secondary intermediary products and secondary materials used to manufacture the undertakings products and services in tons,,0.3757379214317725,0.4964298260019494,,0.4833727020729017,0.408006472783028,,,,,,,,,,,,,
4997,percentage of secondary reused or recycled components secondary intermediary products and packaging and secondary materials,,,0.4844133591514084,,,,,,,,,,,,,,,,
5002,further analysis will be conducted to incorporate any future sectorspecific requirements for reporting,,0.3763222751698712,,,,0.3781145151969153,,,,,,,0.46317751453933,,,,,,
5007,the regulation is expected to influence how repairability is addressed although it will still vary based on the specific damage and product involved,,,0.4182535237570187,,,,,,,,,,,,,,,,
5012,companycombined managementreport consolidated financialstatements other informationand service zalando se annual report  recyclable content in products  current reporting guidelines do not yet define how to assess the recyclable content of fashion products,,,0.412311777321136,,,,0.448474110183793,,,,,,,,,,,,
5013,after thoroughly analysing existing industry standards and regulations related to recyclability and metric methodologies we explored the possibility of establishing an internal metric for product recyclability,,,0.4718904603871365,,,,,,,,,,,,,,,,
5018,recyclable content in product packaging  our current methodology considers product packaging recyclable if the material making up   of the product packaging meets specific criteria for recycling processes,,,0.4974606791688715,,,,,,,,,,,,,,,,
5019,according to the minimum standard defined by the central agency packaging register zentrale stelle verpackungsregister mechanically recyclable  means that the packaging can be sorted and processed using available industrial recycling technologies to produce highquality recyclates,,,0.4708208109845643,,,,,,,,,,,,,,,,
5020,this involves assessing the material composition of the packaging the presence of appropriate sorting and recycling infrastructure and ensuring the packaging can substitute virgin material in typical applications after recycling,,,0.5136672003834853,,,,,,,,,,,,,,,,
5021,we consider a material as recyclable when we have self declarations from suppliers or when the specifications of the material indicate that it is paper paperboard or cardboard and aligns with the definition of fibrous material in the standard mentioned above,,,0.4476515527640652,,,,,,,,,,,,,,,,
5022,the rate of recyclable content in products packaging in  is,,,0.4379418540853342,,,,,,,,,,,,,,,,
5024,waste  in the fashion ecommerce sector waste generation primarily comes from two sources packaging and textile waste,,,0.4752888801094358,,,,,,,,,,,,,,,,
5036,as a result of the above textile waste accounts only for,,,0.4492591147958007,,0.4885343115454076,,,,,,,,,,,,,,
5041,is disposed by landfilling,,,,,0.5529546893011801,,,,,,,,,,,,,,
5042,waste categorisation and data collection our waste is categorised as either hazardous or nonhazardous with key examples of each as follows nonhazardous waste,,0.4124080014120654,0.5056203160111347,,0.6153580782561189,,,,,,,,,,,,,,
5043,of total waste generated includes paper cardboard metals plastic packaging biodegradable kitchen waste and nondangerous electronic waste,,,0.5486966647671944,,0.5930952832933668,,,,,,,,,,,,,,
5044,hazardous waste,,,,,0.5473103103531722,,,,,,,,,,,,,,
5045,of total waste generated includes certain beauty products dangerous ewaste and packaging materials containing chemicals,,0.3564245243762488,0.4976449421438194,,0.6062956474898022,,,,,,,,,,,,,,
5046,waste data is collected at the site level where waste quantities and treatment routes are documented by our waste service providers,,0.4193781568051402,0.4124961553676692,,0.6332000893914846,,,,,,,,,,,,,,
5050,extended producer responsibility epr as part of our commitment to responsible waste management we participate in epr programmes,,0.3551550391033519,0.4390824577237132,,0.5012150460197875,,,,,,,,,,,,,,
5052,this collaboration ensures compliance with epr regulations and supports recycling infrastructure,,,0.4185212239400789,,,,,,,,,,,,,,,,
5053,to meet our epr obligations we submit detailed reports to authorities and pros enhancing transparency in our waste management processes,,,,,0.5044772577350816,,,,,,,,,,,,,,
5054,additionally we contribute financially through epr fees helping to support efficient product disposal and recycling,,,,,,,,,,,,,,,,,,,0.3970543677327062
5055,companycombined managementreport consolidated financialstatements other informationand service zalando se annual report  resource outflows  wastetotal waste generated in tons,,0.397998673095198,,,0.541051794661484,,,,,,,,,,,,,,
5056,total hazardous waste generated,,,,,0.4659206492329492,,,,,,,,,,,,,,
5057,total nonhazardous waste generated,,,,,0.5377071318228678,,,,,,,,,,,,,,
5058,nonhazardous waste diverted from disposal in tons,,,,,0.545680384365678,,,,,,,,,,,,,,
5059,nonhazardous waste diverted from disposal due to preparation for reuse,,,,,0.592168056426859,,,,,,,,,,,,,,
5060,nonhazardous waste diverted from disposal due to recycling,,,,,0.5612764060746683,,,,,,,,,,,,,,
5061,nonhazardous waste diverted from disposal due to other recovery operations,,,,,0.6291516416378298,,,,,,,,,,,,,,
5062,nonhazardous waste directed to disposal in tons,,,,,0.5967047831414596,,,,,,,,,,,,,,
5063,nonhazardous waste directed to disposal by incineration,,,,,0.6094033350151649,,,,,,,,,,,,,,
5064,nonhazardous waste directed to disposal by landfilling,,,,,0.6196344999379466,,,,,,,,,,,,,,
5065,nonhazardous waste directed to disposal by other disposal operations,,,,,0.6910831462746431,,,,,,,,,,,,,,
5066,nonrecycled waste in tons,,,,,0.491006303712496,,,,,,,,,,,,,,
5070,social informationesrs  s own workforcematerial iros and their interaction with strategy and business model  and interests and views of stakeholdersour workforce encompasses a diverse array of job families and capabilities and comprises employees in overhead functions such as finance human resources it marketing overhead employees nonoverhead employees working in our logistic centres outlet stores or customers care centres and nonemployees individuals working at thirdparty contractors who a re materially impacted by our own operations,,,,,,,,,,,,,,,,,0.3544982941549613,,
5077,in this section we cover the following subtopics   freedom of association collective bargaining and collective agreements  works councils  consultation and participation rights of workers secure employment social protection  worklife balance working time health and safety gender equality and equal pay for work of equal value adequate wages employment and inclusion of persons with disabilities diversity elimination of discrimination training and skills development prevention of c hild labour and forced labourthe actual and potential material impacts on our own workforce identified in our dma are described in impacts risks and opportunities  of section,,,,,,,,,,,,,,,,,0.3406218229210894,,
5079,general information,,,,,,,,,,,,,,,,,,0.3115422752952441,
5083,these encompass fair labour standards wages working time job security workplace safety and wellbeing social benefits inclusive approaches regarding diversity nondiscrimination disability inclusion gender equality and employee satisfaction,,,,,,,,,,,,,,,,,0.4030178931177414,,
5088,the qualification and training of employees,,,,,,,,,,,,,0.4800326361405145,,,0.451858076422723,,,
5089,please also refer to impacts risks and opportunities  in section,0.4251641398967861,0.4003657371290823,,0.398073107177328,,0.4057575818984634,,,,,,,,,,,,,
5091,general information for a comprehensive list,,,,,,,,,,,,,,,,,,0.3849687540658241,
5092,we aim to adhere strictly to laws and regulations pertaining to human rights as well as the prohibition of forced  and child labour,,,,,,,,,,,,,,,0.4727903998843231,,,,
5117,the definitions of permanent temporary nonguaranteed hours  and fulltime and parttime employees differ between countries,,,,,,,,,,,,,,,0.3888299300418721,,,,
5118,countrylevel data is calculated using the definitions as per the national laws of the countries where the employees are based,,,,,,,,,,,,,,,,0.3735960118252276,,,
5119,employees with nonguaranteed hours are employed without a guarantee of a minimum or fixed number of working hours,,,,,,,,,,,,,,,0.3980204558915748,,,,
5188,furthermore representation through works councils is highly regulated by the german works constitution act betriebsverfassungsgesetz,,,,,,,,,,,,,,,0.4080300675299286,,,,
5189,these legal foundations ensure that our employees have the right and the means to organise and represent themselves and participate in decisionmaking processes within zalando,,,,,,,,,,,,,,,0.3943972202249478,,,,
5193,we have defined own regulations and these have been agreed to by the management board,,,,,,,,,,0.3569619699083242,,,,,,,,,
5203,secure employment  we aim to fully comply with the local legislation relevant to secure employment  in the countries in which we operate,,,,,,,,,,,,,,,0.4657234106541242,,,,
5204,we take  two approaches  to ensuring secure employment differentiating between overhead functions embodied by approximately half of our employees and nonoverhead functions primarily logistics and customerfacing functions embodied by the remaining employees,,,,,,,,,,,,,,0.4542978449338969,,,,,
5216,worklife balance to facilitat e a smooth return to work we offer job security childcare support and returntowork programmes,,,,,,,,,,,,,,,,,0.3999504389637968,,
5218,additionally all our employees have access to the worklife balance service provided by the fürstenberg institute offering up to five days of emergency childcare annually,,,,,,,,,,,,,,,,,0.3962704291714509,,
5233,our approach to worklife balance is similar to the secure employment approach differentiating between overhead and nonoverhead functions,,,,,,,,,,,,,,,,,0.4207078337100741,,
5235,this approach empowers employees to take ownership of their tasks responsibilities and working hours promoting greater autonomy with the goal of improving both job satisfaction and productivity,,,,,,,,,,,,,,,,,0.3388962493007079,,
5239,we offer parental shifts and flexible arrangements to support the worklife balance,,,,,,,,,0.3720144130052147,,,,,,,,0.3531989490269606,,
5241,these regulations subject to approval by works councils and local authorities prioritise employee wellbeing and prevent overtime,,,,,,,,,,,,,,,0.4709734074734848,,,,
5246,additionally employees with disabilities are offered enhanced flexibility with the option to work from home up to five days per week depending on the nature of their role,,,,,,,,,,,,,,,,,0.3962116593097593,,
5248,the health safety security and environment policy  applicable to our zalando logistics premises complies with the requirements of the eu directive eec the international organization for standardization and the transported asset protection association and sets out a general approach to health and safety security and environment in order to protect people suppliers and business partners as well as to prevent accidents to the same,,,,,,,,0.4183866208005052,,,,,,,,,,,
5249,the policy was authorised by the director of warehouse operation and director of logistics warehouses with consultation from the legal compliance and governance and risk teams,,,,,,,0.4429132970561106,,,,,,,,,,,,
5251,the following table  presents the health  and safety management system information for our employees,,,,,,,,,,,,,,,,,0.4020535610191212,,
5253,health and safety management for employeescategory coverage percentagehealth and safety coverage in,,,,,,,,,,,,,,,,,0.3729411838407196,,
5256,where required employees can also consult our works council members who can provide employees with the relevant information,,,,,,,,,,,,,0.4678962345539533,,,,0.3693934126420864,,
5264,for this we take into account all payments made to employees including the base salary guaranteed shortterm nonvariable cash compensation plus any variable cash payments and benefits in kind e,,,,,,,,,0.4409233991383793,,,,,,,,,,
5266,cash allowances bonuses commissions profitsharing company cars insurances as well as annual longterm incentives e,,,,,,,,,0.3762257680048921,,,,,,,,,,0.4146734730625335
5303,employment and inclusion of persons with disabilities  we aim to create an inclusive workplace for employees with disabilities regardless of their official status,,,,,,,,,,,,,,,,,0.3979332662874576,,
5304,to improve disability inclusion we implemented an action plan in  for our berlinbased offices and employees,,,,,,,,,,,,,,,,,0.3701645838408336,,
5331,traini ng and skills development  we offer  an annual training budget to support individual development for our employees with the exception of temporary workers e,,,,,,,,,,,,,0.4357873177527756,,,0.3875836036994355,,,
5341,prevention of child and forced labour  we aim to adhere strictly to laws and regulations pertaining to human right s,,,,,,,,,,,,,,,0.4622968792638184,,0.3518941160772135,,
5345,for detailed information please refer to esrs g business conduct  in section,,,,,,0.4075592868196654,0.464042285736765,,,0.3891516974567188,0.472689345652022,0.3806827314386739,,0.4430578435778269,0.4292244449126559,,,,
5348,processes  for engaging with own workforce and interests and views of stakeholderswe maintain a robust engagement framework that includes entitywide  crossfunctional and business unit meetings  at various levels as well as other formats like employee assemblies in codetermined entities,,,,,,,,,,,,,,,,,0.3518583769344977,0.333272368583713,
5349,these meetings serve as platforms for sharing updates gathering feedback and fostering a sense of community,,,,,,,,,,,,,,,,,,0.3271370752954037,
5364,for more information please refer to freedom of association  in this chapter,,,,,,,,,,,,,,,0.4076076851056291,,,,
5365,for more information on our human rights strategy that applies to all employees and complements our code of ethics please refer to section esrs s workers in the value chain,,,,,,,,,,,,,,,,,0.3390255315585557,,
5374,employe es are provided with additional ways of raising concerns through various feedback sessions surveys works councils and departmentwide  meetings,,,,,,,,,,,,,,,,,0.3359453336991834,,
5377,business unit nature of the issue or the location among others,,,,,,,,,,,,,,0.4256377513600629,,,,,
5382,for more information please refer to esrs g business conduct  policies related to business conduct  in section,,,,,,0.3854670922137367,0.4434540013549224,,,0.3781663900861576,,0.3812543533253421,,0.4434370923807761,0.4053450826181896,,,,
5385,action s and resources related to own workforcethe following paragraphs contain a summarised description of our actions,,0.3698614009186085,,0.3718427994942331,,,,,0.3773816624110672,,,,0.4477032600871827,0.4343182072996174,,,0.452921137748961,,0.4134223037417058
5386,these actions are associated with reducing material impacts outlined in impacts risks and opportunities  in section,,0.3967818765243968,0.466787508446192,0.374980198358154,0.5226852106376859,0.3993285176397145,,,,,,,,,,,,,
5389,general infor mation,,0.3693562881107953,,,,,,,,,,,,,,,,,
5393,general information for further information,,0.3701048998800401,,,,,,,0.3846304612899932,,,,,,,0.3651400642368728,,,
5396,a dedicated team is working on the project which is scheduled for completion in,,,,,,0.3853436142833432,,,,,,,,,,,,,
5400,they ensure compliance with our obligation to support and develop employees with severe disabilities,,,,,,,,,,,,,,,,,0.3996009746557907,,
5401,to support a work environment of psychological safety  we c ontinu ed a training progra mme for leaders called lets talk about wellbeing focused on duty of care the general data protection regulation  gdpr  and active listening and aimed at enhancing our leaders knowledge and empathy when addressing employees wellbeing concerns,,,,,,,,,,,,,,,,,0.3533708553503206,,
5402,additionally to create a network of employees which proactively promote a healthy work environment and provide immediate support when needed we established a network of mental health first aiders and wellbeing ambassadors at our sites in germany helsinki and dublin in,,,,,,,,,,,,,,,,,0.4871366518458762,,
5405,this includes our fulfilment return and refurbishment centres operated by or on behalf of ourselves,,,0.4379931209543904,0.4051557568754121,,0.4592259818648169,0.4705562438166479,0.4909139903883066,0.4712579171831444,,0.4935837514864248,0.4502563278199717,,0.4640439452138619,,,0.355222943480218,,0.5605757381014563
5406,the aim is to provide an overview of health and safety incidents in our logistics network as well as actions taken to avoid health safety and environmental incidents and impacts as well as the control measures implemented after such incidents take place,,,,,,,,0.4297564154400375,,,,,,,,,,,
5408,our learning and developmen t team has centralised the  learning and development catalogue  which is accessible to overhead employees and provides a wide range of courses aligned with our business objectives,,,,,,,,,,,,,0.5099095524898632,0.439443309908673,,0.353720669546975,,,
5419,this comprehensive service provides confidential multilingual psychosocial counselling to our employees their close relatives and their friends,,,,,,,,,,,,,,,,,0.3839387226845057,,
5420,the external eap supports individuals in addressing a wide range of personal and workrelated challenges including mental health concerns e,,,,,,,,,,,,,,,,,0.3905646893115074,,
5438,for information on how we manage iros related to these subtopics please refer to policies and practices related to own workforce  processes for engaging with own workforce  and processes to raise concerns  above,,,,,,,,,,,,,0.4224348845147903,,,,0.3419472327223206,,
5456,we will also focus on three key areas for which we have defined set working groups hiring and attraction internal development and culture and engagement,,,,,,,,,,,,,0.4188320033636774,0.4270541987666618,,,0.3496517091320368,,
5477,to support worklife int egration we provide flexible working companycombined managementreport consolidated financialstatements other informationand service zalando se annual report  models and family counselling,,,,,,,,,,,,,,,,,0.3546136951793937,,
5486,this ensures that we meet the required standards and effectively protect workers rights,,,,,,,,,,,,,,,0.3932057973897733,,,,
5489,companycombined managementreport consolidated financialstatements other informationand service zalando se annual report    sgb ix duty of employers to employ severely disabled persons  sgb ix pflicht der arbeitgeber zur beschäftigung schwerbehinderter menschen,,,,,,,,,,,,,,,,0.3564983532136518,,,
5502,in addition to our own risk assessments industry reports indicate the following areas of potential concern cotton production  there is an elevated risk of forced labour in cotton harvesting particularly in certain regions of central asia,0.3980876241682836,,,,,,,,,,,,,,,,,,
5505,accessories manufacturing  the production of accessories like bags and jewellery in some developing countries may involve risks of child labour in informal workshops,,,0.433608834743209,,,,,,,,,,,,,,,,
5513,our approach to identifying material  iros  for workers in our value chain is described in impacts risks and opportunities  in section,,0.3557602814783648,0.480778789228467,,,,,,,,,,,,,,,,
5515,general information,,,,,,,,,,,,,,,,,,0.3115422752952441,
5525,it covers human rights labour rights environmental protection fair and ethical business practices and monitoring and complaints,,,,,,,,,,,,,,,0.4413312319768955,,0.3872870508665503,,0.4031168209896699
5530,additionally the policy specifies expectations and requirements for all our b usiness partners  within the supply chain encompassing suppliers service pro viders platform partners distributors consultants agents and subcontractors,,,,,,,0.4966577391343453,,,,,,,,,,,,
5531,our human rights officer monitors the ongoing activities described in the policy and reports to the management board,,,,,,,,,,,,,,,0.4279435508583887,,0.3879084801013008,,
5533,to this end we use the databases in place to document our risk mitigating measures such as audits business partner checks and investigations and their results in order to assess them against their appropriateness for risk mitigation in the concrete area,,,,,,0.3910134633338868,,,,,,,,,,,,,
5538,the policy also covers topics such as working hours health and safety measures and access to child care services and education,,,,,,,,,0.41762285928686,,,,,,0.4653256919435415,0.3925060739334664,0.5189616263751372,,
5539,the im plementation of processes described therein is with the responsibility of our private label team overseen at the vp level,,,,,,,,,,,,,0.4164356762888914,,,,,,
5543,the programme is implemented through four cyclical steps analyse  the first step in the cycle is an annual review of our direct contractors to determine their exposure to human rights risks categorised as low medium high or very high risk,,,,,,0.4237527582240553,,,,,,,,,,,,,
5548,report  reporting of the processes and results of each years cycle is conducted in adherence to the german supply chain due diligence act and the guidance of the competent authority federal office for economic affairs and export control bundesamt für wirtschaft und ausfuhrkontrolle bafa,,,0.4664604906500078,,,,0.4624047016364556,,,,,,,,,,,,
