6222,indicator no  table  annex regulation eu  annex ii  regulation eu  art  not material not applicableesrs spara,,,,,,,,,,,,,,,0.4220177284746699,0.3832479030396901,,,
6226,aindicator no  table  annex regulation eu  annex iimaterial esrs gpara,,,,,,,,,,,,,,,,0.3495108765163446,,,
6329,property plant and equipment,0.3941288458867491,,,0.5016897573384542,,0.4438415149528286,,0.4346992012184174,,,,0.4641786906193644,,,,,,,
6335,financial assets,,,,,,,,,,,0.5646191301472581,,,,,,,,
6352,trade and other receivables,,,,,,,0.4840777496262862,0.4732574974835862,,,,,,,,,,,
6355,other financial assets,,,,,,,,,,,0.5811666813926011,,,,,,,,
6390,other financial liabilities,,,,,,,,,,,0.5607342712721186,,,,,,,,
6392,other nonfinancial liabilities,,,,,,,,,,,,,,,,,,,0.3947724767195326
6416,other financial liabilities,,,,,,,,,,,0.5607342712721186,,,,,,,,
6419,other nonfinancial liabilities,,,,,,,,,,,,,,,,,,,0.3947725102648554
6587,depreciation of property plant and equipment rightofuse assetsand amortisation of intangible assets,0.340512997036052,,,0.3947737078335391,,0.394692511168342,,,,,,0.4327806031119064,,,,,,,
6597,increasedecrease in provisions,,,,,,,,,0.4359646144239427,,,,,,,,,,
6619,cash received from sales of property plant and equipment intangibles and other longterm assets,,,,,,,,,,,,0.3604603150357505,,,,,,,
6675,nature of operating activitieszalando is a european online fashion and lifestyle platform,,,,,,,,,,,,,,,,,,0.3056243942892119,
6683,in addition the provisions of section e  of the hgb german commercial code have been taken into account,,,,,,,0.468333852915891,,,0.4308941426569981,,,,,,,,,
6688,assets and liabilities are classified and presented as current and noncurrent in the statement of financial position,,,,,,,,,,,0.5016148272805809,,,,,,,,
6706,it also clarifies the assessment of contractual cash flows for example to assess whether instruments with esglinked features meet the sppi criteria,,,,0.3738585157861911,,,,,0.3701052608152071,,0.4855551355469724,,,,,,,,
6708,amendments to ifrs  ifrs  ifrs  ifrs  and ias ifrs accounting standards annual improvements volume includes minor changes related to the application of hedge accounting for ifrs firsttime adopters disclosure of gain or loss on derecognition of financial assets with continuing involvement recognition of any difference from derecognition of lease liabilities in profit or loss and clarifies the definition of a de facto agent,,,,,,,,,,,,0.3822523392371212,,,,,,,
6709,ifrs  presentation and disclosure in financial statementssets out requirements for the presentation and disclosure of information in financial statements,,,,,,,,,,0.3532175924974942,,,,,,,,,
6710,this includes requirements regarding the statement of financial performance the statement of financial position and the statement of cash flows,,,,,,,,,,0.3721173018527818,0.491350218302726,,,,,,,,
6712,the standard supersedes ias,,,,,,,,,,,,,,,,0.3734169090134697,,,
6715,amendments to ifrs  andifrs contracts referencing naturedependent electricityclarifies that the ownuseexception is applicable to contracts referencing naturedependent electricity if the entity has been and expects to be a net purchaser of electricity for the contract period,,,,0.3945104253765952,,,,,,,,,,,,,,,
6716,the amendments also permit the designation of a variable nominal amount of forecast electricity transactions as hedged item if that amount is aligned with the variable amount of nature dependent electricity expected to be delivered by the generation facility as referenced in the hedging instrument because such forecast transactions are presumed to be highly probable by ifrs,,,,0.4655518489244786,,,,,,,,,,,,,,,
6717,contracts referencing naturedependent electricity shall be disclosed in a single note in the financial statements according to ifrs,,,,0.4836206482535831,,,,,,,,,,,,,,,
6724,the standard first defines the operating category that will include all items of income or expense that are not classified in one of the other four categories,,,,,,,0.4708517991092077,,,,,,,,0.3893064114062159,,,,0.3952587891324379
6725,the majority of items currently included in our ebit will be allocated to this operating category,,,,,,,0.4628392965919233,0.4116168479817045,0.4220548210321676,,0.4755805820306236,,,0.4982427321924171,,,,0.3307600893721519,0.4694824632053456
6726,the investing category will mainly include income and expenses from investments accounted for using the equity method as well as from cash and cash equivalents,,,,,,,,,,,0.4816599338055027,,,,,,,,
6727,those items are currently presented within our financial result and will be moved to the investing category,,,,,,,,,,,0.4840193251706691,,,0.4907581797247067,,,,,0.4474043492335568
6728,income and expenses that arise from transactions that involve only the raising of finance or items that arise from transactions that do not involve only the raising of finance but are identified by other ifrs will be classified in the financing category,,,,,,,0.4768892014458477,,0.385610427498686,,0.5027928503088522,0.4025576851918949,,0.4410542062264469,,,,,0.432432514853968
6729,this will mainly include items that are currently presented in our financial result e,,,,,,,,0.4125804786979212,0.4133415759949723,,0.5147313994569725,,,0.433907142754414,,,,0.3141529302177318,
6732,items that do not fulfil these criteria shall be classified under other categories,,,0.4668764405161828,,,,0.478805366093546,,,,,,,0.4431771777768297,,,,,0.532351353491158
6733,for example income and expenses from hedging relationships shall be moved to the operating category,,,0.448265559494223,,,,0.5202086082432118,0.4382137670458526,,,0.554441030150723,0.4003154552409864,,0.5465979128711278,0.3934739062421669,,,,0.465879040530772
6735,however foreign exchange differences related to cash and cash equivalents will be presented in the investing category and foreign exchange differences related to trade receivables or trade payables will be classified in the operating category,,,,,,,0.4598718949302404,,,,,,,0.4378237384044379,,,,,
6739,the operating profit or loss shall comprise all income and expenses classified in the operating category,,0.3587854422216667,0.4660016897470335,,,,0.531706384602065,,,0.3735680971209781,,,,,,,,,
6741,this is not equivalent to our ebit due to the items that will be moved from the financial result into the operating or investing category,,,,,,,,,,,,,,0.4497075370087525,,,,,
6745,in addition interests paid and received that are currently only presented in the cash flow from operating activities will be classified as cash flow from financing activities interest paid or cash flow from investing activities interests and dividends received,,,,,,,,,,,0.521957802124817,0.3562622376030716,,0.4485205763861407,,,,,
6748,most relevant for zalando this requires information on expenses by nature if the function of expenses method is used as well as disclosures for managementdefined performance measures that are companyspecific subtotals of income and expenses like ebit or adjusted ebit,,,,,,,,,0.3755603090503993,,,,,,,,,,
6775,the company eliminates intercompany profits or losses from intercompany supplies and services and recognises deferred tax benefits and expenses from consolidation entries through profit or loss,,,,,,,0.4473664217387906,,,,,,,,,,,,0.3947199305978163
6840,amortisation is presented within the functional area to which it relates,,,,,,,,,,,0.4670661372588675,,,,,,,,
6848,capitalised development costs are amortised over an anticipated useful life of an average of about three years,,,,,,0.4261602076536382,,,,,,,,,,,,,
6865,property plant and equipmentproperty plant and equipment are recogni sed at cost and depreciated in accordance with their expected useful life using the straightline method,,,,0.4222240280613499,,0.3737175725381944,,,,,,,,,,,,,
6867,the following useful lives are applieduseful livesyearsleasehold improvements   plant and machinery   other equipment furniture and fixtures   an item of property plant and equipment is derecognised upon disposal or when no further economic benefits are expected from its use or disposal,0.414072360923964,0.3859327423352982,0.493130144336918,0.4705549410093189,0.5638670586136734,0.417325601018118,,,,,,0.3686484841054339,,,,,,,0.4897163526913441
6869,the residual values useful lives and methods of depreciation of property plant and equipment are reviewed at the end of each financial year and adjusted prospectively if appropriate,,,,,0.491152386712223,,,,,,,,,,,,,,0.4170443657427369
6876,all other liabilities are classified as noncurrent,,,,0.3692702286116535,,,,,,,,,,,,,,,
6878,leasesthe group as lesseeat the commencement date of a lease zalando recognises a rightofuse asset and a lease liability for all leases except for shortterm leases i,,,,,,,,,,,,0.4536726925621949,,,,,,,
6883,a change in variable payments related to a change in the underlying index or rate will lead to a remeasurement of the lease liability at the point in time this change is effective,,,,,,,,,,,,0.3669307406468644,,,,,,,
6886,periods covered by an option to extend or terminate the lease are only included in the lease term if it is reasonably certain that such an option will be exercised or will not be exercised in the case of a termination option,,,,,,,,,,,,0.3687087881773114,,,,,,,
6889,initially rightofuse assets are recognised at the amount of the corresponding lease liability plus initial direct costs as well as less any lease incentives received,,,,,,,,,,,,0.4283886639321644,,,,,,,
6890,costs of dismantling and removal are considered if they relate to the lease asset,,,,,,0.3953000042883333,,,,,,0.3812659219545899,,,,,,,
6891,rightofuse assets are subsequently companycombined managementreport consolidated financialstatements other informationand service zalando se annual report  depreciated over the underlying lease term between one and  years using the straightline method,,,,,,,,,,,,0.4010171252022163,,,,,,,
6892,depreciation of rightofuse assets is presented within the functional area to which it relates,0.3543527729729985,,,,,,,,,,0.4690103802976781,0.4124828613437372,,,,,,,
6893,interest expenses on lease liabilities are shown as interest and similar expenses,,,,,,,,,,,,0.3854072326767131,,,,,,,
6894,they are also included in cash flow from operating activities whereas cash payments for the principal portion of lease liabilities are presented as a separate line item in the cash flow from financing activities,,,,,,,,,,,,0.3634011877854466,,,,,,,
6895,subleasesa lessor shall classify each lease  including each sublease  as an operating lease or a finance lease,,,,,,,,,,,,0.559529657079391,,,,,,,
6896,a lease is classified as a finance lease if all of the risks and rewards incidental to the ownership of an underlying asset have been substantially transferred to the lessee,,,,,,,,,,,,0.4234028849314711,,,,,,,
6897,otherwise it is classified as an operating lease,,,,,,,,,,,,0.4882104236137951,,,,,,,
6898,zalando classifies subleases by reference to the rightofuse asset arising from the head lease,,,,,,,,,,,,0.5400051740037283,,,,,,,
6899,typically this assessment is based on the lease term of the sublease compared to the remaining lease term of the head lease,,,,,,,,,,,,0.443664237927553,,,,,,,
6900,whenever the lease term of the sublease is at least  of the remaining lease term of the head lease zalando classifies those leases as finance subleases otherwise they are classified as operating subleases,,,,,,,,,,,,0.45899628925595,,,,,,,
6901,for operating subleases the accounting for the head lease remains unchanged and lease payments from the sublease are recognised as income when incurred,,,,,,,,,,,,0.4361508750374156,,,,,,,
6902,for finance subleases the corresponding rightofuse asset is derecognised and a receivable of an amount equal to the net investment in the sublease is presented,,,,,,,,,,,,0.4769903418473552,,,,,,,
6904,to measure the net investment in the sublease zalando uses the  riskadjusted  discount rate used for the head lease,,,,,,,,,,,,0.3994869120023109,,,,,,,
6908,management regularly prepares tax returns paying close attention to matters open to interpretation and recognises provisions based on the amounts that are expected to be payable to the tax authorities,,,,,,,,,0.4006413088488125,,,,,,0.3899691298941665,,,,
6912,this does not apply to tax law s enacted or substantively enacted to implement the companycombined managementreport consolidated financialstatements other informationand service zalando se annual report  pillar two model rules published by the oecd,,,,,,,,,,,,,,,0.4041064403252689,,,,
6918,inventoriesmerchandise accounted for as inventories is recogni sed at cost pursuant to ias,,,0.41920689027131,,,,0.5024991641661526,0.4484812431862606,,,,,,,,,,,
6919,the cost of inventories comprises all costs of purchase purchase price import duties and other taxes as well as costs for transport handling and other costs incurred in bringing the inventories to their present location and condition,,,,,,,0.4453796277404901,0.4662447716011667,,,,,,,,,,,
6920,this also includes a systematic allocation of labour and overhead costs,,,,,,0.3881960000986078,,,0.3842041765002599,,,,,,,,,,
6922,supplier payments that are to be classified as a reduction of cost reduce the carrying amount of inventories,,,,,,,,0.4302697391937829,,,,,,,,,,,
6929,financial assets and financial liabilities are disclosed in the consolidated statement of financial position when zalando becomes a contractual party to a financial instrument,,,,,,,,,,,0.4772890840529801,,,,,,,,
6932,th e date on which an asset is delivered to or by the entity,,,,,,,,0.4414763610362141,,,,,,,,,,,
6935,companycombined managementreport consolidated financialstatements other informationand service zalando se annual report  financial instruments classified as financial assets and financial liabilities are generally not netted they are only netted if the group has a legally enforceable right to set off and intends to settle the amounts on a net basis,,,,,,,,,,,0.4943647245897137,,,,,,,,
6945,financial assetsfinancial assets are classified as one of the following categories for the purpose of subsequent measurement amortised cost fair value through other comprehensive income or fair value through profit or loss,0.3371009326364287,,,,,,,,,,0.5346700364088158,,,,,,,,
6948,the allocation to the aforementioned categories determines the subsequent measurement of financial assets,,,,,,,,,,,0.539370043114592,,,,,,,,
6950,financial assets measured at amortised cost are those which are held in a business model whose objective is to hold the financial asset in order to collect contractual cash flows and for which the contractual terms give rise on specific dates to cash flows that are solely payments of principal and interest on the principal amount outstanding sppi criterion,,,,,,,,,,,0.4783969980855179,,,,,,,,
6951,this measurement category is used for trade and other receivables other financial assets cash and cash equivalents and shortterm deposits,,,,0.3796398612827434,,,0.4508110041528428,0.4504942036626135,,,0.498984004588578,,,,,,,,0.4105104086132697
6952,companycombined managementreport consolidated financialstatements other informationand service zalando se annual report  the category of financial assets at fair value through other comprehensive income relates to financial assets that are held within a business model whose objective is achieved by both collecting contractual cash flows and selling financial assets,,,,,,,,,,,0.4912158795648141,,,,,,,,
6958,hence they are held within a business model whose objective is not to hold the financial asset to collect contractual cash flows or where cash flows are not solely payments of principal and interest on the principal amount outstanding,,,,,,,,,,,0.5302827752202848,,,,,,,,
6959,derivative financial instruments that are not effective hedging instruments  as well as corporate investments are allocated to this category,,,,,,,,,,,0.498814310110742,,,,,,,,
6966,trade receivables  typically resulting from the use of deferred payment methods e,,,,,,,0.4555345433577013,0.4300466398188077,,,,,,,,,,,
6969,for other receivables  resulting from the purchase of receivables due from customers of our partners for sales concluded on the  zalando platform   zalando applies the general approach of ifrs,,,,,,,0.4512293807588901,,,,,,,,,,,,
6975,zalando allocates financial liabilities to one of the following categories upon initial recognition fair value through profit or loss or amortised cost,,,,,,,,,,,,0.3585589280543936,,,,,,,
6977,in particular these include derivative financial instruments that are not designated as hedging instruments,,,,,,,,,,,0.4936021951884718,,,,,,,,
6980,compound financial instrumentsat issue of a nonderivative financial instrument zalando evaluates whether it contains both a liability and an equity component,,,,,,,,,,,0.4676501359082234,,,,,,,,
6998,another portion of the forward exchange contracts is used to hedge goods sold in foreign currency and the resulting trade receivables,,,,,,,,0.4040550340476547,,,,,,,,,,,
7008,in the case of contractual merchandise sourcing transactions the amount of other comprehensive income is included in the initial cost of inventories,,,,,,,0.4712149573477124,,,,,,,,,,,,
7009,the share of other comprehensive income that is attributabl e to hed ged revenue is posted via revenue to profit or loss,,,,,,,,,,0.3562309428229774,,,,,,,,,
7016,provisionsgeneral informationprovisions are recognised in accordance with ias  when the group has a present obligation legal or constructive as a result of a past event it is probable that an outflow of resources embodying economic benefits will be required to settle the obligation and a reliable estimate of the amount of the obligation can be made,,,,,,,,,,0.3796776617001303,,,,,0.399562135932012,,,,
7020,dismantling obligationsthe group recogni ses provisions for dismantling obligations for leasehold improvements in the leased fulfilment centres office buildings and outlets,,,,0.3903593293702672,,0.437072242208017,,,,,,0.4353203833441355,,,,,,,0.4016920572904783
7022,the dismantling obligations are recognised as part of the cost of leasehold improvements for the corresponding amount,,,,,,0.4447197181530465,,,,,,0.4421848622274612,,,,,,,
7028,expense recognition and the addition to the capital reserves are performed over the contractually agreed vesting period,,,,,,,,,0.3802339443810346,,,,,,,,,,
7029,the vesting period is the period in which the performance and service conditions must be  fulfi lled,,,,,,0.3854104064926734,,,,,,,,,,,,,
7045,companycombined managementreport consolidated financialstatements other informationand service zalando se annual report   retail business formerly known as wholesale and offprice business,,,,,,,0.4800841387484709,,,,,,,,,,,,
7048,revenue is recogni sed in accordance with the provisions of ifrs  when the goods or services promised are transferred to the customer,,,,,,,0.4768638645408509,,0.3755758927787118,,,,,,,,,,
7051,for our retail business we conclude that zalando is the principal in these revenue arrangements because we control the goods before transferring them to the customer,,,,,,,0.4826401083153663,,,,,,,,,,,,
7060,the identified performance obligation,,,,,,,,,,,,,,,0.4646491641119623,,,,
7061,in contrast services promised to our partners partner business zeos fulfilment or zms are separately identifiable performance obligations,,,,,,,,,,,,,,0.4461497278976233,,,,,
7062,when selling merchandise to customers zalando transfers control over the promised goods and service s at a  specific po int in time,,,,,,,0.4441823829338071,,,,,,,,,,,,
7064,for services rendered to our partners partner business zeos fulfilment or zms revenue is also recognised at the point in time the underlying performance obligations towards our partners are satisfied,,,,,,,,,0.3939227936235602,,,,,,,,,,
7075,in this context a right to recover goods from expected returns is recognised in other nonfinancial assets,0.3485937892254078,,,,,,,,,,,,,,,,,,
7077,trade receivables for which delivered goods are expected to be returned are also derecognised,,,,,,,,0.4380210250498452,,,,,,,,,,,
7079,customer options for additional goods or servicesin  we evolved the zalando plus programme introducing a pointsbased system to reward customer loyalty,,,,,,,,,0.3752880118751626,,,,,,,,,,
7080,the new programme grants options to our customers for acquiring additional goods or services at a discount or for free in the form of level and countryspecific awards,,,,,,,,,0.4497458390005857,,,,,,,,,,0.3974269668447732
7081,these awards create a distinct bundle of goods or services and therefore a separate performance obligation that provides a material right to our customers,,,,,,,,,0.4224248121193538,,,,,0.4495342826307462,,,,,0.4550146299713536
7102,inventories  and,,,,,,,0.4847398953249047,0.4387655244410517,,,,,,,,,,,
7105,trade and other receivables,,,,,,,0.4840777496262862,0.4732574974835862,,,,,,,,,,,
7109,the determination of the useful life of items of property plant and equipment and of intangible assets as well as the determination of development costs of internally generated intangible assets see sections,0.4274111961314462,0.3991331089053394,0.4557851031086808,0.4729214793239093,0.4983172687053339,0.4745870046665196,,0.3988284447052759,,,0.4725252433931537,0.4082633339673011,,,,,,,
7115,property plant and equipment  and,0.4257683865752849,0.3578239786425154,,0.5189518013938846,,0.4647246344445704,,0.488176784568142,0.3716785176802239,,,0.5116559100952224,,,,,,,0.408717319020847
7118,the measurement of rightofuseassets in particular the identification of impairment losses as well as the determination of lease terms and corresponding discount rates see sections,,0.3627028262196666,,0.4692411457462523,,0.4786563802227876,,0.4007113350133561,,,,0.4899382692489843,,,,,,,
7121,rightofuse assets and lease liabilities  and,,,,,,,,,,,,0.4704400904088111,,,,,,,
7130,financial instruments,,,,,,,,,,,0.54775603268086,,,,,,,,
7138,the estimation of standalone selling prices for options to acquire additional goods or services see section,,,,,,,,,0.3707258186594147,,,,,,,,,,
7147,the assessment of whether liabilities that are part of a reverse factoring arrangement have a similar nature and function to trade payables see comments in section,,,,,,,,,,,,,,,,,,,0.3959637182448338
7151,the assessment of whether purchased partner receivables have a similar nature and function to trade receivables see comments in section,,,,,,,0.4527849483404909,,,,,,,,,,,,
7154,trade and other receivables the assessment of whether it is reasonably certain that an option to extend a lease will be exercised or an option to terminate a lease will not be exercised see commen ts in section,,,,,,,,0.463421702488865,,,,0.4326638595878808,,,,,,,
7160,revenuerevenuein m eur  revenue from the sale of merchandise,,,,,,,0.4766375888757621,,,,,,,,,,,,
7166,revenue from the sale of merchandise comprised sales of merchandise to our customers within the retail business and is therefore entirely allocated to the bc segment,,,,,,,0.5176725226236489,,,,,,,,,,,0.3058445909340718,
7169,further information on revenue can be found in section,,,,,,,,,,,,,,,,,,0.3203001525881891,
7190,thereof fulfilment services,,,,,,,,0.5237048240566081,0.4889429798898097,,0.49988509946761,,0.4148006928105646,,,,,,0.5006310621129421
7198,selling and distribution costsselling and distribution costsin m eur  nonpersonnel costs,,,,,,,0.4670816837738778,,,,,,,,,,,,
7204,selling and distribution costs comprised fulfilment costs of,,,,,,,0.4746610083669707,0.4376837902312686,,,,,,,,,,,
7209,the nonpersonnel costs consist of predominately logistic outbound and marketing expenses as well as the depreciation of fixed assets and rightofuse assets,,,,,,,,0.4467714340431455,,,,,,,,,,,
7214,administrative expensesadministrative expensesin m eur  nonpersonnel costs,,,,,,,,,0.3747089121342997,,,,,,,,,,
7220,the nonpersonnel costs included predominately itrelated costs office expenses depreciation and impairments for rightofuse assets as well as legal and advisory expenses,,,,,,,,,,,,0.365278712722416,,,,,,,
7230,these other operating expenses relate to disposals of assets refer to sections,,0.3569406419561267,0.4541286702219158,,0.5490704491330639,0.4098446697767911,0.4786968444463599,0.485389944900946,0.4065326633583506,0.3538683498334037,0.562484675652145,0.4386016511534406,,0.545866535322132,0.3982240052691018,,0.3343946647852893,0.3443755127982978,0.4885359847443266
7233,property plant and equipment,0.3941288458867491,,,0.5016897573384542,,0.4438415149528286,,0.4346992012184174,,,,0.4641786906193644,,,,,,,
7240,in the prior year other operating expenses mainly comprised severa nce and garden leave expenses relating to our reshaping programme  of,,,,,,0.4015261586835996,,,0.3768488750874756,,,,,,,,,,0.4277858968780385
7247,thereof from trade and other receivables,,,,,,,0.5195029986213341,0.5125811055282201,0.3807022859541614,,,,,,,,,,0.4124910826270047
7253,thereof from other financial instruments,,,,,,,,,,,0.5338663874336118,,,,,,,,
7378,personnel expensespersonnel expensesin m eur  wages and salaries,,,,,,,,,0.3869705654415183,,,,,,,,,,
7390,personnel expenses are reduced by the capitali sed development costs,,,,,,0.3962133005843829,,,,,,,,,,,,,
7396,intangible assetsstatement of movement of intangible assets in m eurcapitalised developmentcostsindustrialrights similarrights andassets as wellas licenses goodwillprepayments and assetsunderdevelopment totalhistorical costas of  jan,0.3426955288724466,,,,,,,,,,,,,,,,,,
7406,disposals,,,,,0.5139194532823576,,,,,,,,,,,,,,
7436,disposals,,,,,0.5139194532823576,,,,,,,,,,,,,,
7476,disposals,,,,,0.5139194532823576,,,,,,,,,,,,,,
7506,disposals,,,,,0.5139194532823576,,,,,,,,,,,,,,
