1083,Regulatory capital elements of TLACMREL Common Equity Tier capital CET Additional Tier AT capital instruments eligible under TLACMREL Tier T capital instruments eligible under TLACMREL Tier T capital instruments before TLACMREL adjustments Tier T capital instruments adjustments for TLACMREL Tier T capital instruments eligible under TLACMREL Total regulatory capital elements of TLACMREL Other elements of TLACMREL Senior nonpreferred plain vanilla Holdings of eligible liabilities instruments of other GSIIs TLAC only Total Loss Absorbing Capacity TLAC Add back of holdings of eligible liabilities instruments of other GSIIs TLAC only Available Own Funds and subordinated Eligible Liabilities subordinated MREL Senior preferred plain vanilla Senior preferred structured products Available Minimum Own Funds and Eligible Liabilities MREL Risk Weighted Assets RWA Leverage Ratio Exposure LRE TLAC ratio TLAC ratio as percentage of RWA . . TLAC requirement as percentage of RWA . . TLAC ratio as percentage of Leverage Exposure . . TLAC requirement as percentage of Leverage Exposure . . TLAC surplus over RWA requirement TLAC surplus over LRE requirement MREL subordination MREL subordination ratio as percentage of RWA . . MREL subordination requirement as percentage of RWA . . Surplus over MREL subordination requirement MREL ratio MREL ratio as percentage of RWA . . MREL requirement as percentage of RWA . . MREL surplus over requirement ,,,0.33374088964225246,,,0.3700740267685221,0.4257574387449951,,0.33846989426401825,0.3765151049103408,,,,,,0.3605160882518302,,,
1089,The maximum exposure to credit risk table shows the direct exposure before consideration of associated collateral held and other credit enhancements netting and hedges that do not qualify for offset in the financial statements for the periods specified. The netting credit enhancement component includes the effects of legally enforceable netting agreements as well as the offset of negative marktomarkets from derivatives against pledged cash collateral. The collateral credit enhancement component mainly includes real estate collateral in the form of cash as well as securitiesrelated collateral. In relation to collateral the Group applies internally determined haircuts and additionally cap all collateral values at the level of the respective collateralized exposure. ,,,,,,,,,,,,0.40844972031491394,,,,,,,
1093,Financial assets at amortized cost Cash and central bank balances Interbank balances wo central banks Central bank funds sold and securities purchased under resale agreements Securities borrowed Loans Other assets subject to credit risk,,,,,,,,,,,0.5212353377688461,,,,,,,,
1095,Trading assets Positive market values from derivative financial instruments Nontrading financial assets mandatory at fair value through profit or loss Of which Securities purchased under resale agreement Securities borrowed Loans Financial assets designated at fair value through profit or loss Total financial assets at fair value through profit or loss Financial assets at fair value through OCI Of which Securities purchased under resale agreement Securities borrowed Loans Total financial assets at fair value through OCI Financial guarantees and other credit related contingent liabilities Revocable and irrevocable lending commitments and other credit related commitments Total offbalance sheet Maximum exposure to credit risk ,0.3074966586670983,,0.3484102380486189,0.38093891461039553,0.33807265958310584,0.32941007509211745,0.4598145029456881,0.4155728981362779,0.3464926672567379,0.36154639978545633,0.557961942949721,0.4209046715008708,0.35015441504888734,0.4153779251044181,0.34556310623538705,,0.25045574573367324,0.2746236502139595,0.4191341224944381
1101, Excludes equities other equity interests and commodities ,0.3288500327832345,,,,,,,,,,,,,,,,,0.28697061800778695,
1104, Total financial assets at amortized cost Financial assets at fair value through profit or loss Trading assets Positive market values from derivative financial instruments Nontrading financial assets mandatory at fair value through profit or loss Of which Securities purchased under resale agreement Securities borrowed Loans Financial assets designated at fair value through profit or loss Total financial assets at fair value through profit or loss Financial assets at fair value through OCI Of which Securities purchased under resale agreement Securities borrowed Loans Total financial assets at fair value through OCI Financial guarantees and other credit related contingent liabilities Revocable and irrevocable lending commitments and other credit related commitments Total offbalance sheet Maximum exposure to credit risk ,0.28362346339922695,,,0.36213511581385305,,0.3229293919636024,0.4277945537612655,,,0.33062204201234063,0.532249755729158,0.4133357454424724,,,,,,,0.40853743914960067
1107,The tables in this section show details about several of Deutsche Banks main credit exposure categories namely Loans Revocable and Irrevocable Lending Commitments Contingent Liabilities OverTheCounter OTC Derivatives Debt Securities and Repo and repostyle transactions Loans are gross loans as reported on our balance sheet at amortized cost loans at fair value through profit and loss and loans at fair value through other comprehensive income before deduction of allowance for credit losses this includes Traded loans that are bought and held for the purpose of selling them in the near term or the material risks of which have all been hedged or sold from a regulatory perspective the latter category principally covers trading book positions Revocable and irrevocable lending commitments consist of the undrawn portion of revocable and irrevocable lendingrelated commitments Contingent liabilities consist of financial and performance guarantees standby letters of credit and other similar arrangements mainly indemnity agreements OTC derivatives are the banks credit exposures from overthecounter derivative transactions that the Group has entered into after netting and cash collateral received on the banks balance sheet these are included in financial assets at fair value through profit or loss or for derivatives qualifying for hedge accounting in other assets in either case only applying cash collateral received and netting eligible under IFRS Debt securities include debentures bonds deposits notes or commercial paper which are issued for a fixed term and redeemable by the issuer as reported on our balance sheet within accounting categories at amortized cost and at fair value through other comprehensive income before deduction of allowance for credit losses it also includes category at fair value through profit and loss this includes Traded bonds which are bonds deposits notes or commercial paper that are bought and held for the purpose of selling them in the near term from a regulatory perspective the latter category principally covers trading book positions Repo and repostyle transactions consist of reverse repurchase transactions as well as securities or commodities borrowing transactions only applying collateral received and netting eligible under IFRS. Although considered in the monitoring of maximum credit exposures the following are not included in the details of the Groups main credit exposure brokerage and securities related receivables cash and central bank balances interbank balances without central banks assets held for sale accrued interest receivables traditional securitization positions. Unless stated otherwise the tables below reflect credit exposure before the consideration of collateral and risk mitigation or structural enhancements except for OTC derivatives wherein they are post credit enhancements ,,,,0.32961808014678046,,,0.4065178164987843,,,,,,,,,,,,
1117,Before reflection of collateral and limited to securities purchased under resale agreements and securities borrowed ,,,,,,,,,,,,0.37693287808146997,,,,,,,
1118,Credit Risk Exposure Dec Loans Offbalance sheet OTC derivatives in m. at amortized cost trading at fair value through PL Designated mandatory at fair value through PL at fair value through OCI Revocable and irrevocable lending commitments Contingent liabilities at fair value through PL ,,,0.3175529240586064,0.3246854303317107,,,0.4183393742247202,0.3726667695486908,,,,0.3713233622614072,,,,,,,0.39496979796517023
1119,Corporate Bank Investment Bank Private Bank Asset Management Corporate Other ,,,,,,,,,,,,,,,,,,0.29007140444742846,
1126,Includes exposure to Corporates including Holding Companies of billion AssetBacked Securities of billion Banks of billion Insurance of billion Financial Intermediaries of billion and Public Sector of billion all based on internal client classification ,,,,0.33897099579168627,,,,,,,0.4986260430733527,,,,,,,,
1128,The portfolio is subject to the same credit underwriting requirements stipulated in the banks Principles for Managing Credit Risk including various controls according to single name country industry and productasset classspecific concentration. Material transactions such as loans underwritten with the intention to sell down or distribute part of the risk to third parties are subject to review and approval by senior credit risk management professionals and depending upon size an underwriting committee andor the Management Board. High emphasis is placed on structuring and pricing such transactions so that derisking can be achieved in a timely manner and where Deutsche Bank takes market price risk to mitigate such market risk. The Groups amortized cost loan exposure within above categories is mostly to good quality borrowers. Moreover with the focus on the Corporate Bank and Investment Bank loan exposure is subject to further risk mitigation through the banks e.g. Strategic Corporate Lending unit. Deutsche Banks household loan exposure is principally associated with Private Bank portfolios. ,,,,,,,,,,,,0.35124870895890753,,,,,,,
1129,The banks amortized cost loan exposure of . billion to Real Estate activities as reported above is based on NACE code classification and comprises of recourse and nonrecourse financing across various parts of the group and client segment. This includes . billion of loans which is based on Deutsch Banks definition of nonrecourse CRE loans. For more information on nonrecourse CRE loans see section Focus areas in in the chapter IFRS Impairment. The Groups commercial real estate loans primarily originated in the U.S. and Europe are generally secured by first mortgages on the underlying real estate property. Deutsche Bank originates fixed and floating rate loans and selectively acquires generally at substantial discount sub nonperforming loans sold by financial institutions. The underwriting process is stringent and the exposure is managed under separate portfolio limits. Credit underwriting policy guidelines provide that LTV ratios of generally less than are adhered to at loan origination. Additionally given the significance of the underlying collateral independent external appraisals are commissioned for all secured loans by a valuation team part of the independent Credit Risk Management function which is also responsible for reviewing and challenging the reported real estate values regularly. Deutsche Bank originates loans for distribution in the banking market or via securitization. In this context Deutsche Bank frequently retains a portion of the syndicated loans while securitized positions may be entirely sold except where regulation requires retention of economic risk. Mezzanine or other junior tranches of debt are retained only in exceptional cases. The bank also participates in conservatively underwritten unsecured lines of credit to wellcapitalized real estate investment trusts and other real estate operating companies. Commercial real estate property valuations and rental incomes can be significantly impacted by macroeconomic conditions and idiosyncratic events affecting the underlying properties. Accordingly the portfolio is categorized as higher risk and hence subject to the aforementioned tight restrictions on concentration. The Groups credit exposure to ten largest counterparties accounted for of the banks aggregated total credit exposure in these categories as of December compared with as of December . The top ten counterparty exposures were wellrated counterparties or otherwise related to structured trades which show high levels of risk mitigation. Deutsche Banks exposure to Financial and Insurance Activities is . billion as of December which also includes exposures to Asset Backed Securities Banks Insurance Financial intermediaries Public Sector as well as to Corporates including Holding Companies. Exposures are managed using bespoke risk management frameworks tradebytrade approvals and relevant risk appetite metrics.Total loans across all applicable measurement categories amounted to . billion total repo and repo style transactions across all applicable measurement categories amounted to . billion and offbalance sheet activities amounted to . billion as of December and were principally associated with Investment Bank and Corporate Bank portfolios which were majorly held in North America and Europe. ,,,,,,0.3231040423249542,,,,,,0.4697256782868167,,,,,,,
1137,Credit Risk Exposure Dec Loans Offbalance sheet OTC derivatives in m. at amortized cost trading at fair value through PL Designated mandatory at fair value through PL at fair value through OCI Revocable and irrevo cable lending commitments Contingent liabilities at fair value through PL ,,,,0.33109779925066507,,,0.4195577058436872,0.37526703787078625,,0.3239757697113728,,0.37652640486312905,,,,,,,0.39831268380145374
1145,at amortized cost trading at fair value through PL Designated mandatory at fair value through PL at fair value through OCI Revocable and irrevo cable lending commitments Contingent liabilities at fair value through PL,,,,0.33681450446216094,,0.3274472770095861,0.40675318660391147,,,0.3271177555243701,,0.3791677246970383,,,,,,,
1146,iAAAiAA . . iA . . iBBB . . iBB . . iB . . iCCC and below . Total ,,,,,,,,,,,,,,,,0.35159882307045476,,,
1150,Includes the effect of netting agreements and cash collateral received where applicable ,,,,,,,,,,,,0.37908717091869226,,,,,,,
1152,at amortized cost trading at fair value through PL Designated mandatory at fair value through PL at fair value through OCI Revocable and irrevo cable lending commitments Contingent liabilities at fair value through PL ,,,,0.33681450446216094,,0.3274472770095861,0.40675318660391147,,,0.3271177555243701,,0.3791677246970383,,,,,,,
1158,Strategic Corporate Lending SCL unit helps to mitigate the risk of the banks corporate credit exposures. The notional amount of SCLs risk reduction activities increased from . billion as of December to . billion as of December . As of yearend SCL mitigated the credit risk of . billion of loans and lendingrelated commitments through synthetic collateralized loan obligations supported predominantly by financial guarantees. This position totaled . billion as of December . SCL also held credit derivatives with an underlying notional amount of . billion as of December . The position totaled . billion as of December . The credit derivatives used for the banks portfolio management activities are accounted for at fair value. The bank makes use of hedging also in other businesses to reduce single name concentration risks and utilizes private risk insurance and export credit agency cover to manage noncollateralized exposures. ,,,,,,,,,,,0.5005946670333375,,,,,,,,
1165,Mortgage business is the financing of residential properties primarily owneroccupied sold by various business channels in Europe primarily in Germany but also in Spain and Italy. The level of credit risk of the mortgage loan portfolio is determined by assessing the quality of the client and the underlying collateral. The loan amounts are generally larger than Consumer Finance loans and they are extended for longer time horizons. Based on the banks underwriting criteria and processes and the diversified portfolio customersproperties with respective collateralization the mortgage portfolio is categorized as lower risk while consumer finance is categorized as high risk. Business Finance represents credit products for small businesses SME up to large corporates. Products range from current accounts and credit lines to investment loans or revolving facilities factoring leasing and derivatives. Clients are located primarily in Italy and Spain but credit can also be extended to subsidiaries abroad mostly in Europe. Wealth Management offers customized wealth management solutions and private banking services including discretionary portfolio management and traditional and alternative investment solutions complemented by structured risk management wealth planning lending and family office services for wealth highnetworth HNW and ultrahighnetworth UHNW individuals and family offices. Wealth Managements total exposure is divided into Lombard Lending against readily marketable liquid collateral securities and Structured Lending against less liquid collateral. While the level of credit risk for the Lombard portfolio is determined by assessing the quality of the underlying collateral the level of credit risk for the structured portfolio is determined by assessing both the quality of the client and the collateral. Products range from secured Lombard and mortgage loans to current accounts Europe only credit lines and other loans to a lesser extent derivatives and contingencies. Clients are located globally. ,,,,,,,,,,,,0.37247020737931885,,,,,,,
1168,When assigning the exposure to the corresponding LTV buckets the exposure amounts are distributed according to their relative share of the underlying assessed real estate value ,,,,,,,,,,,,0.38840072927340485,,,,,,,
1169,The LTV expresses the amount of exposure as a percentage of the underlying real estate value. The Groups LTV ratios are calculated using the total exposure divided by the current determined value of the respective properties. These values are monitored and updated if necessary on a regular basis. The exposure of transactions that are additionally backed by liquid collateral is reduced by the respective collateral values whereas any prior charges increase the corresponding total exposure. The LTV calculation includes exposure which is secured by real estate collateral. Any mortgage lending exposure that is collateralized exclusively by any other type of collateral is not included in the LTV calculation. The creditors creditworthiness the LTV and the quality of collateral is an integral part of the Groups risk management when originating loans and when monitoring and steering the Groups credit risks. In general the Group is willing to accept higher LTVs the better the creditors creditworthiness is. Nevertheless restrictions of LTV apply e.g. for countries with negative economic outlook or expected declines of real estate values. As of December of the Groups exposure related to the mortgage lending portfolio had an LTV ratio below or equal to compared to as on December . ,,,,,,,,,,,,0.4306628872890523,,,,,,,
1174,Interest rate related OTC Bilateral Amt CCP Amt Exchangetraded Total Interest rate related Currency related OTC Bilateral Amt CCP Amt Exchangetraded Total Currency related Equityindex related OTC Bilateral Amt CCP Amt Exchangetraded Total Equityindex related Credit derivatives related OTC Bilateral Amt CCP Amt Exchangetraded Total Credit derivatives related Commodity related OTC Bilateral Amt CCP Amt Exchangetraded Total Commodity related Other OTC Bilateral Amt CCP Amt Exchangetraded Total Other Total OTC business Total bilateral business Total CCP business Total exchangetraded business Total Positive market values after netting and cash collateral received ,,,,,,,0.4405924843955603,0.37546559569873367,,,,,,,,,,,
1190,Includes valueatrisk from gold and other precious metal positions ,0.31204258514656374,0.286817587725847,,,,,,,,,,,,,,,,,
1202,Business line breakdowns have been updated for reporting to better reflect the current business structure ,,,,,,,,,,,,,,0.4039564260664823,,,,,
1208,Buyandhold income of Trading UnitsActual income of Trading units,0.3526076002016465,0.29245624842776635,,,,,0.46352385590373135,0.3702358883658712,,,,0.37232523508221615,,0.39762119819787795,,,,,
1238,Clients Products and Business Practices External Fraud Execution Delivery and Process Management Others Natural Disasters and Public Safety Internal Fraud Group ,,,,,,,,,,,,,0.35491637025067624,,,,,,0.3853576920629897
1252,Other Customers includes fiduciary deposits Xmarkets notes and marginPrime Brokerage cash balances shown on a net basis Reference Reconciliation to total balance sheet of . billion . billion Derivatives settlement balances . billion . billion addback for netting effect for marginPrime Brokerage cash balances shown on a net basis . billion . billion other nonfunding liabilities . billion . billion for December and December respectively ,,,,,,,,,0.3341948919441253,,,,,,,,,,
1255,Deposits from banks Deposits from other wholesale customers CDs and CP ABCP Senior nonpreferred plain vanilla Senior preferred plain vanilla Senior structured Covered bondsABS Subordinated liabilities Other Total Of which Secured Unsecured ,,,,,,,0.43398466703905947,0.39419486358245515,0.3538028243239859,,,,,,,0.29368388431311465,,,0.4096536303192372
1256, Includes additional Tier notes reported as additional equity components in the financial statements. Liabilities with call features are shown at earliest legally exercisable call date. No assumption is made as to whether such calls would be exercised Secured funding volume reported post own debt elimination ,,,,,,,,,0.3439575671879945,,,,,,,,,,
1263,Deposits from banks Deposits from other whole sale customers CDs and CP ABCP Senior nonpreferred plain vanilla Senior preferred plain vanilla Senior structured Covered bonds ABS Subordinated liabilities Other Total Of which Secured Unsecured ,,,,,,,,,,,,,,,,,,0.249273929005775,0.3818360635956373
1302,Dec Carrying value Unencumbered assets in bn. unless stated otherwise Assets Encumbered assets Readily available Other ,,,,,,,,0.41557104477321044,,,,,,,,,,,
1303,Debt securities Equity instruments Other assets Cash and due from banks Interest earning deposits with Banks Securities borrowed or purchased under resale agreements Financial assets at fair value through profit and loss Trading assets Positive market value from derivative financial instruments Securities borrowed or purchased under resale agreements Other financial assets at fair value through profit or loss Financial assets at fair value through other comprehensive income Loans Other assets Total ,0.333866568203625,,,0.33639190565050375,0.3444344162949002,,,0.3921654358265343,,,0.5263309810313554,,,,,,,0.2836086147256503,0.3873855171322528
1305,Excludes Debt securities and Equity instruments separately disclosed above Dec Fair value of collateral received Unencumbered assets in bn. unless stated otherwise Assets Encumbered assets Readily available Other ,0.28408336187618993,,,,,,,0.38160940828264184,,,,0.35631089013895045,,,,,,,0.4010625105216086
1306,Collateral received Debt securities Equity instruments Other collateral received ,,,,,,,,0.442594393971483,0.37159592896497967,,,,,,,,,,0.41061163783094246
1307,Liquidity Risk Exposure Dec Carrying value Unencumbered assets in bn. unless stated otherwise Assets Encumbered assets Readily available Other ,,,,0.3195960693482591,,,,0.39117900714425136,0.34262158865851866,,,,,,,,,,
1313,Cash and central bank balances Interbank balances wo central banks Central bank funds sold Securities purchased under resale agreements With banks With customers Securities borrowed With banks With customers Financial assets at fair value through profit or loss Trading assets Fixedincome securities and loans Equities and other variable income securities Other trading assets Positive market values from derivative financial instruments Nontrading financial assets mandatory at fair value through profit or loss Securities purchased under resale agreements Securities borrowed Fixedincome securities and loans Other nontrading financial assets mandatory at fair value through profit or loss Financial assets designated at fair value through profit or loss Positive market values from derivative financial instruments qualifying for hedge accounting Financial assets at fair value through other comprehensive income Securities purchased under resale agreements Securities borrowed Debt securities Loans Other Loans To banks To customers Retail Corporates and other customers Other financial assets Total financial assets Other assets Total assets ,,,,,,,,,,,,,,,0.3545036344890449,,,,
1324,Policies and Commitments ,,,,,,,,,,,,,,,0.3455944139376055,,0.24880860341517708,,
