1667,On January the Group adopted amendments to IAS Income Taxes. These amendments changed the deferred tax treatment related to assets and liabilities in a single transaction such that they introduce an exemption from the initial recognition exemption provided in IAS .b and IAS .. Accordingly the initial recognition exemption does not apply to transactions in which both deductible and taxable temporary differences arise on initial recognition that result in the recognition of equal deferred tax assets and liabilities. Neither of these amendments had a material impact on the Groups consolidated financial statements. In December the Organization for Economic CoOperation and Development OECD issued Global AntiBase Erosion and Profit Shifting BEPS Rules under the Pillar Framework. In May the IASB issued amendments to IAS Income Taxes to introduce a mandatory temporary exception to the accounting for deferred taxes arising from the implementation of Pillar model rules and disclosure requirements. The application of the exception outlined above had to be applied immediately with the disclosure requirements to be effective for annual periods beginning on or after January . The mandatory temporary exception has been applied and there has been no impact on the Groups consolidated financial statements. ,,,0.31916326552432867,,,,0.417003800494191,,,0.3335748407231639,,,,,0.34586100282952326,0.3189146018878538,,,
1669,On January the Group adopted amendments to IAS and IFRS Practice Statement that are intended to provide guidance on deciding which accounting policies to disclose in financial statements. Accordingly an entity is now required to disclose its material accounting policies instead of its significant accounting policies. The amendments did not have an impact on the Groups consolidated financial statements. ,,,0.3299287975773412,,,,,,,,,,,,,,,,
1672,IFRS Leases ,,,,,,,,,,,,0.37614855092436855,,,,,,,
1673,In September the IASB issued amendments to IFRS Leases that clarify how a sellerlessee subsequently measures sale and leaseback transactions that satisfy the IFRS requirements to be accounted for as a sale. The amendments are effective for annual periods beginning on or after January with early adoption permitted. The amendment is not expected to have a material impact on the Groups consolidated financial statements. ,,,,,,,,,,,,0.43235071601176184,,,,,,,
1674,In January and July the IASB issued amendments to IAS Presentation of Financial Statements Classification of Liabilities as Current or NonCurrent. The amendments clarify that the classification of liabilities as current or noncurrent should be based on rights that are in existence at the end of the reporting period. The amendments also clarify that the classification is unaffected by expectations about whether an entity will exercise its right to defer settlement of a liability and make clear that settlement refers to the transfer to the counterparty of cash equity instruments other assets or services. The amendments are effective for annual periods beginning on or after January with early adoption permitted. They will not have a material impact on the Groups consolidated financial statements. In October the IASB issued a further amendment to IAS that modifies the requirements described above on how an entity classifies debt and other financial liabilities as current or noncurrent in particular circumstances. Accordingly it clarifies that only covenants with which an entity is required to comply on or before the reporting date affect the classification of a liability as current or noncurrent. In line with the previous amendments the new amendments are effective for annual periods beginning on or after January with early adoption permitted. The amendments will not have a material impact on the Groups consolidated financial statements. ,,,0.3389205149037029,,,0.34050433313735085,0.4305537258009009,,,0.3599732463623333,,,,,0.35374847952395966,0.35162286948222,,,
1683,Interbank balances wo central banks Securities borrowed Financial assets at fair value through profit or loss Property and equipment Other intangible assets All other assets Total assets acquired Financial liabilities at fair value through profit or loss All other liabilities Total liabilities assumed Total identifiable net assets Goodwill Total identifiable net assets and goodwill acquired ,,,,0.3389363816597034,,,,,,,,,,,,,,,
1686,Dispositions ,,,,,0.34732249756318895,,,,,,,,,,,,,,
1688,Cash and cash equivalents All remaining assets Total assets disposed Total liabilities disposed ,,,,,0.37888310412021936,,,,,,,,,,,,,,
1689, Business segments and related information ,,0.31903942785908906,,,,,0.4909342359248249,,,,,,0.3471800742591964,0.4747296976250012,,,0.25167371738255095,0.3449501646148388,
1690,Deutsche Banks segmental information has been prepared in accordance with the management approach which requires presentation of the segments on the basis of the internal management reports of the entity which are regularly reviewed by the chief operating decision maker which is the Deutsche Bank Management Board in order to assess the financial performance of the business segments and for allocating resources to the business segments. ,,0.3008239300400327,,,,,,,,,,,,,,,,,
1691,Business segments ,,,,,,,0.4466394331894647,,,,,,0.37841407102798297,0.511161675287331,,,0.26428463461892093,0.3784965881770655,0.41441878598168025
1692,Deutsche Banks segment reporting follows the organizational structure as reflected in the Groups internal management reporting systems which are the basis for assessing the financial performance of the business segments and for allocating resources to them. The banks business operations are organized under the divisional structure comprising the following corporate divisions Corporate Bank Investment Bank Private Bank Asset Management Corporate Other The Group consists of the following reportable segments Corporate Bank Investment Bank Private Bank Asset Management and Corporate Other. Corporate Bank reports revenues in the categories Corporate Treasury Services Institutional Client Services and Business Banking. Investment Bank reports revenues in the categories Fixed Income Currency Sales Trading and Origination Advisory as well as Other. Private Bank reports revenues in the categories Private Bank Germany and International Private Bank. Within International Private Bank revenues are reported in the categories Wealth Management Bank for Entrepreneurs and Premium Banking. By year end International Private Bank materially completed the winddown of the majority of legacy assets and liabilities associated with Sal. Oppenheim. Remaining assets or liabilities are not expected to have material financial impacts going forward and will be included in the normal course of the client segment Wealth Management Bank for Entrepreneurs. The associated disclosure of specific revenues items was discontinued starting in the first quarter of . Asset Management reports revenues in the categories Management Fees Performance and Transaction Fees and Other. Corporate Other includes revenues costs and resources held centrally that are not allocated to the individual business segments as well as valuation and timing differences that arise on derivatives used to hedge the Groups balance sheet. These are accounting impacts and valuation losses are expected to be recovered over time as the underlying instruments approach maturity. In addition Corporate Other contains financial impacts of legacy portfolios previously reported as the Capital Release Unit. As announced in the Annual Report having fulfilled the Capital Release Units derisking and cost reduction mandate from through year end the Capital Release Unit ceased to be reported as a separate segment with effect from the first quarter of . The remaining portfolio resources and employees are reported within the Corporate Other segment. In line with the change the Core Bank which previously represented the Group excluding the Capital Release Unit ceased to be reported as of the first quarter of . In addition based on management decisions during the reporting period further divisional changes were introduced. The prior years segmental information is presented in the current structure. ,,0.28448120988006176,,,,,0.4133536550026137,,,,,,,0.4107793457682362,,,,,
1694,Segment reporting requires a presentation of the segment results based on management reporting methods including a reconciliation between the results of the business segments and the consolidated financial statements which is presented in the Segment results of operations section within this note. The information provided about each segment is based on internal management reporting about segment profit or loss assets and other information which is regularly reviewed by the chief operating decision maker. ,,0.34685639801400703,,,,,,,,0.3280817050282928,,,,,,,,,
1695,Segment assets are presented in the Groups internal management reporting based on a consolidated view i.e. the amounts do not include intersegment balances. The Groups internal management reporting does not consider segment liabilities or interest expense separately. Similarly depreciation and amortization tax expenses and other comprehensive income are not presented separately internally and are therefore not disclosed here. NonIFRS compliant accounting methods used in the Groups management reporting represent either valuation or classification differences. The largest valuation differences relate to measurement at fair value in management reporting versus measurement at amortized cost under IFRS and to the recognition of trading results from own shares in revenues in management reporting in Investment Bank and in equity under IFRS. The major classification difference relates to noncontrolling interest which represents the net share of minority shareholders in revenues provision for credit losses noninterest expenses and income tax expenses. Noncontrolling interest is reported as a component of the profit before tax of the businesses in management reporting with a reversal in Corporate Other and a component of net income appropriation under IFRS. Since the Groups business activities are diverse in nature and its operations are integrated certain estimates and judgments have been made to apportion revenue and expense items among the business segments. The management reporting systems allocate the Groups external net interest income according to the value of funding consumed or provided by each business segments activities in accordance with the banks internal funds transfer pricing framework. Furthermore to retain comparability with those competitors that have legally independent units with their own equity funding the Group allocates a net notional interest benefit on its consolidated capital in line with each segments proportion of average shareholders equity. Management uses certain measures for equity and related ratios as part of its internal reporting system because it believes that these measures provide it with a useful indication of the financial performance of the business segments. The Group discloses such measures to provide investors and analysts with further insight into how management operates the Groups businesses and to enable them to better understand the Groups results. ,0.28249895646735795,0.3260925646084175,,0.3328523194627623,0.3673595072885797,,0.46549996284944367,,,0.3286232303001376,,,,0.44340928547238895,,,,,
1697,Shareholders equity is fully allocated to the Groups segments based on the regulatory capital demand of each segment. Regulatory capital demand reflects the combined contribution of each segment to the Groups Common Equity Tier CET ratio the Groups leverage ratio and the Groups capital loss under stress. Contributions in each of the three dimensions are weighted to reflect their relative importance and level of constraint for the Group. Contributions to the CET ratio and the leverage ratio are measured through riskweighted assets and leverage ratio exposure. The Groups capital loss under stress is a measure of the Groups overall economic risk exposure under a defined stress scenario. Goodwill and other intangible assets are directly attributed to the Groups segments in order to allow the determination of allocated tangible shareholders equity and the respective returns. Shareholders equity and tangible shareholders equity is allocated on a monthly basis and averaged across quarters and for the full year. ,,,,0.3341962340645036,,,,,,,,,,,,,,,
1699,As disclosed in the Annual Report the Group implemented the DriverBased Cost Management allocations from the first quarter of . The new methodology aims to provide greater transparency over the drivers of infrastructure costs and links costs more closely to service consumption by segments. This change did not affect the Groups costincome ratio and return on tangible equity metrics but does impact these per business segment. Therefore priorperiod information is presented in the current structure resulting in an increase in noninterest expenses corresponding decrease in profit before tax for Corporate Bank of million for Investment Bank of million for Private Bank of million for Asset Management of million with a corresponding decrease in noninterest expenses corresponding reduction in loss before tax for Corporate Other of million for the full year . ,,0.30688869164392557,,0.38462659952315825,,0.42996170517988713,,0.46236779242526876,,,,,,,,,,,
1705,In the third quarter of approximately FTEs moved from Corporate Other to the operating business segments driven by the banks decision that the Chief Operating Office will no longer be a separate Management Board function. Accordingly businessrelated parts of Chief Operating Office that support the Investment Bank and the Corporate Bank which were previously run in Infrastructure moved to those divisions. Comparative segmental financial information is presented accordingly. This change did not result in a material financial impact at a segment level as costs are allocated from Corporate Other to the operating business segments that are using the service of the respective infrastructure functions and with this move the costs are directly incurred by the divisions rather than being charged to Corporate Other. ,,0.32526513185904543,,0.39786633472263205,0.35495528344680893,0.3281546866561311,0.4448490714760397,0.3943694878879567,,,0.5312540316424732,,,0.5247356941482333,,,,0.2583793891771028,0.38259816189606
1707,The following tables present the results of the Groups business segments including the reconciliation to the consolidated results of operations under IFRS. ,,0.2978300464878457,,,,,,,,,,,,,,,,0.275898289469811,
1709, Business segments and related information in m. unless stated otherwise Corporate Bank Investment Bank Private Bank Asset Manage ment Corporate Other Total Consolidated ,,0.3036553334739772,,0.32105597441703176,,,0.4395203474071959,,,,0.5261973908773007,,,0.4950085628545698,,,,0.2955133754501823,
1712, Segment assets are presented on a consolidated basis i.e. the amounts do not include intersegment balances ,,,,0.31916580469543826,,,,,,,,,,,,,,,
1714,Segment assets are presented on a consolidated basis i.e. the amounts do not include intersegment balances ,,,,0.31916580469543826,,,,,,,,,,,,,,,
1716,The Groups entitywide disclosures include net revenues from internal and external counterparties. Excluding revenues from internal counterparties would require disproportionate IT investment and is not in line with the Banks management approach. For details of the net revenue components please see Management Report Operating and Financial Review Results of Operations Corporate Divisions. The following table presents total net revenues before provision for credit losses by geographic area for the years ended December and respectively. The information presented for Corporate Bank Investment Bank Private Bank and Asset Management has been classified based primarily on the location of the Groups office in which the revenues are recorded. The information for Corporate Other is presented on a global level only as management responsibility for Corporate Other is held centrally. ,,,,,,,0.4067343313757418,,,0.32660479836479595,,,,0.41037083119007917,,,,,
1718,Consolidated net revenues comprise interest and similar income interest expenses and total noninterest income including net commission and fee income revenues are attributed to countries based on the location in which the Groups booking office is located the location of a transaction on the Groups books is sometimes different from the location of the headquarters or other offices of a customer and different from the location of the Groups personnel who entered into or facilitated the transaction where the Group records a transaction involving its staff and customers and other third parties in different locations frequently depends on other considerations such as the nature of the transaction regulatory considerations and transaction processing considerations ,,,,,,,0.43215869339593954,,0.3984986604973516,0.32530464467734654,,,,0.4223728211237565,,,,0.2734755343066297,
1720, Net interest income and net gains losses on financial assetsliabilities at fair value through profit or loss ,0.30373971391075616,,,,,,,,,,,,,,,,,,
1721,Interest and similar income Interest income on cash and central bank balances Interest income on interbank balances wo central banks Central bank funds sold and securities purchased under resale agreements Loans Other Total Interest and similar income from assets measured at amortized cost Interest income on financial assets at fair value through other comprehensive income Total interest and similar income calculated using the effective interest method Financial assets at fair value through profit or loss Total interest and similar income Thereof negative interest expense on financial liabilities Interest expense Interestbearing deposits Central bank funds purchased and securities sold under repurchase agreements Other shortterm borrowings Longterm debt Trust preferred securities Other Total interest expense measured at amortized cost Financial liabilities at fair value through profit or loss Total interest expense Thereof negative interest income on financial assets Net interest income ,0.31333510550278953,,,0.331624954283731,0.3561147329059308,,0.4155458171130101,,,0.355087305833799,0.5288779101663238,,,,0.3679513124057993,,,0.2519035716965327,
1724,Trading Income FIC Sales and Trading Other trading income loss Total trading income loss Net gains losses on nontrading financial assets mandatory at fair value through profit or loss Breakdown by financial assets category Debt Securities Equity Securities Loans and loan commitments Deposits Others nontrading financial assets mandatory at fair value through profit and loss Total net gains losses on nontrading financial assets mandatory at fair value through profit or loss Net gains losses on financial assetsliabilities designated at fair value through profit or loss Breakdown by financial assetliability category Loans and loan commitments Deposits Longterm debt Other financial assetsliabilities designated at fair value through profit or loss Total net gains losses on financial assetsliabilities designated at fair value through profit or loss Total net gains losses on financial assetsliabilities at fair value through profit or loss ,0.3042038897063165,0.3025723301409025,0.3956349361440061,,0.34836851869559426,0.3217176371165034,0.521985433517718,0.38702259805135275,,0.3821829382771972,0.5121990904597071,0.3922013025622118,,0.44578579858352274,,,0.2457782841296482,0.27006584053612015,0.4170688550423005
1727, Net gains losses on nontrading financial assets mandatory at fair value through profit or loss Net gains losses on financial assetsliabilities designated at fair value through profit or loss Total net gains losses on financial assetsliabilities at fair value through profit or loss Total net interest income and net gains losses on financial assetsliabilities at fair value through profit or loss,0.2976914116393001,,0.35115821830184113,,,,0.44932363872963643,,,0.3411337426444817,,0.36986792370357413,,,0.3494739836457887,,,,
1728, Corporate Treasury Services Institutional Client Services Business Banking Corporate Bank FIC Sales Trading Remaining Products Investment Bank Private Bank Germany International Private Bank Private Bank Asset Management Corporate Other Total net interest income and net gains losses on financial assetsliabilities at fair value through profit or loss ,0.2883434111558415,0.28463049906964155,,0.335907463677479,,,,,,,0.5803382551923292,0.35520346711468587,,0.45618923194684236,0.3709105042389504,,0.3001158003297055,0.29979118589365494,0.4088403630667757
1730,The Groups trading and risk management businesses include significant activities in interest rate instruments and related derivatives. Under IFRS interest and similar income earned from trading instruments and financial instruments designated at fair value through profit or loss i.e. coupon and dividend income and the costs of funding net trading positions are part of net interest income. The Groups trading activities can periodically shift income to either net interest income or to net gains losses of financial assetsliabilities at fair value through profit or loss depending on a variety of factors including risk management strategies. The above table combines net interest income and net gains losses of financial assetsliabilities at fair value through profit or loss by business division. ,0.2997555511573899,0.3163050702024796,0.32720580405384136,,,,0.4414062605389626,,,,0.5705387200042762,0.38210232165086866,0.33269000318892206,0.45912689787452,,,0.24341989144021242,0.2796029006356451,
1732,in m. Commission and fee income and expense Commission and fee income Commission and fee expense Net commissions and fee income ,0.3261001875048,,,0.32200334269769315,,0.32854096019108203,0.4502071650051152,0.41349636888196767,0.3784996736087228,0.35603935505657586,,0.4549819075702601,,0.45464586008043933,0.35098212192998357,,,0.33837692677229914,
1735,Major type of services Commissions for administration Commissions for assets under management Commissions for other securities Underwriting and advisory fees Brokerage fees Commissions for local payments Commissions for foreign commercial business Commissions for foreign currencyexchange business Commissions for loan processing and guarantees Intermediary fees Fees for sundry other customer services Total fee and commissions income Gross expense Net fees and commissions ,,,,0.34868170910663054,0.33703200297290775,0.3274402010812148,0.43326577081777057,0.4173933678976207,0.37383333367834226,,0.5694114753323241,0.43000279705783256,0.37203971091457855,0.48694798254062,,,0.31353430690806733,0.34588806950749107,0.39575445620695365
1737,Revenue is recognized when performance obligations are satisfied. Performance obligation is satisfied by fund performance exceeding a hurdle rate an agreed minimum annual return provided to investors. As of December there were performance obligations to be satisfied of million with a time band of three years from to as of December million with a time band of three years from to from Alternative funds. The decrease of performance obligations to be satisfied was mainly driven by decline in the real estate valuations due to market conditions. As of December and December the Groups balance of receivables from commission and fee income was million and million respectively. As of December and December the Groups balance of contract liabilities associated to commission and fee income was million and million respectively. Contract liabilities arise from the Groups obligation to provide future services to a customer for which it has received consideration from the customer prior to completion of the services. The balances of receivables and contract liabilities do not vary significantly from period to period reflecting the fact that they predominately relate to recurring service contracts with service periods of less than one year such as monthly current account services and quarterly asset management services. As a result prior period balances of contract liabilities are generally recognized in revenue in the subsequent period. Customer payment in exchange for services provided are generally subject to performance by the Group over the specific service period such that the Groups right to payment arises at the end of the service period when its performance obligations are fully completed. Therefore no material balance of contract asset is reported. ,,0.29363455766687824,,0.37240350629728636,0.3932754595521751,0.38279127809596286,0.42874901626928286,0.42609357549391297,0.4008312599114002,,0.5863518926281154,0.44006700965637563,0.3346661864921434,0.43664831351920863,,,,,0.42158935315609825
1744,Includes net gains losses of million million and million for the years ended December and respectively that are related to noncurrent assets and disposal groups held for sale,,0.30149540096254007,,,0.3602921683015678,,,,,,,0.3747001216154397,,,,,,,
1745, General and administrative expenses ,,,,,,,,,,,,,,,0.35978898964487827,,,,
1746,General and administrative expenses Information Technology Occupancy furniture and equipment expenses Regulatory Tax Insurance,,,,,,0.3282721178403292,,,0.37158568599542147,,,0.3615639745177335,,0.39772640667982345,0.3736639349551576,,0.26008136667472465,0.27641475738625926,0.4376666826498147
1747, Professional services Banking Services and outsourced operations Market Data and Research Services Travel expenses Marketing expenses Other expenses,0.28652634838494523,,,,,,,0.4237008802122456,0.3753623855862119,,,,0.39234377417656036,0.43470976108748083,,,0.29643260600029897,0.2806380202672897,0.3946114740396806
