,Sentences,"Scores_a_AGRICULTURE, FORESTRY AND FISHING",Scores_b_MINING AND QUARRYING,Scores_c_MANUFACTURING,"Scores_d_ELECTRICITY, GAS, STEAM AND AIR CONDITIONING SUPPLY","Scores_e_WATER SUPPLY; SEWERAGE, WASTE MANAGEMENT AND REMEDIATION ACTIVITIES",Scores_f_CONSTRUCTION,Scores_g_WHOLESALE AND RETAIL TRADE; REPAIR OF MOTOR VEHICLES AND MOTORCYCLES,Scores_h_TRANSPORTATION AND STORAGE,Scores_i_ACCOMMODATION AND FOOD SERVICE ACTIVITIES,Scores_j_INFORMATION AND COMMUNICATION,Scores_k_FINANCIAL AND INSURANCE ACTIVITIES,Scores_l_REAL ESTATE ACTIVITIES,"Scores_m_PROFESSIONAL, SCIENTIFIC AND TECHNICAL ACTIVITIES",Scores_n_ADMINISTRATIVE AND SUPPORT SERVICE ACTIVITIES,Scores_o_PUBLIC ADMINISTRATION AND DEFENCE; COMPULSORY SOCIAL SECURITY,Scores_p_EDUCATION,Scores_q_HUMAN HEALTH AND SOCIAL WORK ACTIVITIES,"Scores_r_ARTS, ENTERTAINMENT AND RECREATION",Scores_s_OTHER SERVICE ACTIVITIES
8,. . Common Equity Tier capital ratio . . Statement of Income Total net revenues in bn . . Provision for credit losses in bn . . Total noninterest expenses in bn . . Nonoperating costs in bn . . Adjusted costs in bn,,0.28502179878431466,0.3166267036583533,,,0.32991767689748464,,,,0.3658839288632679,,,,,,,,,
10,. . Profit loss before tax in bn . . Profit loss before tax excluding nonoperating costs in bn . . Profit loss in bn . . Profit loss attributable to Deutsche Bank shareholders in bn . . Balance Sheet,,0.29818867027856794,,,,,,,,0.34657772330642067,,,,,,,,,
23,For further information please refer to Supplementary Information Unaudited NonGAAP Financial Measures of this report ,0.2981632666720824,0.31578470752296345,,,0.33448125920720784,,,,0.35350093131745236,,,,,,,,,,
30,II Letter from the Chief Executive OfficerV	Management BoardVI 	Letter from the Chairman of the Supervisory BoardVIII	Report of the Supervisory Board XVII	Supervisory BoardXVIII 	CommitteesXXI	Strategy,,0.3517458720469862,,0.3315654509251342,0.35993039686828004,0.35941270367023953,0.433366892692968,0.3758952624581184,0.337606583768879,0.40015698039514025,,,0.36573733395664215,0.41341110355269184,0.33106283758012406,0.3739310406656463,,,
37,	 	 Corporate Governance Statement according to Sections  f and  d of the German Commercial Code  Corporate Governance Report,,,,,,,0.4160984822116189,,,0.35459783056340977,,,,,,,,,
39,	 	 Supplementary Information Unaudited,,,,,,,,,0.34693414085176766,,,,,,,,,,
41,II Letter from the Chief Executive OfficerV	Management BoardVI	Letter from the Chairman of the Supervisory BoardVIII	Report of the Supervisory Board XVII	 Supervisory BoardXVIII	 CommitteesXXI	Strategy,,0.3517458720469862,,0.3315654509251342,0.35993039686828004,0.35941270367023953,0.433366892692968,0.3758952624581184,0.337606583768879,0.40015698039514025,,,0.36573733395664215,0.41341110355269184,0.33106283758012406,0.3739310406656463,,,
52,As a result we have established a strong market position in all four business divisions. And we see potential to expand it further. That is why we made more investments in to accelerate our growth trajectory and take advantage of market opportunities. To this end we have driven product innovations and hired personnel in some key areas to improve our market coverage especially in areas where we can score points with clients with our highquality expertise and advice. This includes our Wealth Management business Client Coverage in the Corporate Bank and Origination Advisory in the Investment Bank. We have decisively strengthened the latter with the acquisition of the leading British corporate broker Numis. At the same time we have continued to invest in technology stringent processes and platforms and our controls. In recent years we have focused our investments here in order to meet the regulatory requirements and to effectively protect the bank. After investing more than billion again in improvements to our controls in we now assume that the remediation work on our most important regulatory programmes is now nearing completion. In terms of costs we are also at a turning point. In we deliberately put some major cost items behind us. In addition to investments in business technology and controls this included restructuring and severance costs related to the transformation strategy and extraordinary items such as amortization of goodwill at Numis. A large part of these costs will not repeat from which is why noninterest expenses should have reached their peak last year at . billion. ,,,,,,,,,,,0.4980358037935922,,,,,,,,
62,President Chief Financial Officer and responsible for the Asset Managementsince July ,,,,,,,,,,,,0.35351331260558777,,,,,,,
67,Chief Technology Data and Innovation Officer,,,,,,,,,,,,,0.3342761504324829,,,,,,
85,Risk Officer,,,,,,,,,,,,,0.40406301078990514,,,,0.29062604292580413,,
96,Report of the Supervisory Board ,,0.2842057450550427,,,,,,,,,,,,,,,,,
109,Participation in meetings ,,,,,,,,,,,,,,,,,0.32396200300491523,0.2728218390974489,
110,During the reporting period the Supervisory Board members participated in the meetings of the Supervisory Board and of the committees in which they were members as shown in the following. Participation was either in person or per video conference. There was no case of participation by telephone. ,,,,,,,,,,,,,,,,,0.2701236535057338,,
140,Supervisory BoardChairmans CommitteeRisk CommitteeAudit CommitteeNomination Committee,,,,,,,,,,0.32638121934225145,,,,,0.35772957295546987,0.2954798553454853,,,
145,Training and further education measures ,,,,,,,,,,,,,0.39686782508411594,,,0.5170402502090203,0.2667703452385519,,
146,We held several training sessions in as in prior years. They were conducted in most cases by external subject matter experts but also by internal experts. The training focused on topics such as artificial intelligence climate and environmental risks as well as macroeconomic developments and their effects on the bank. Furthermore we received an outlook for the global and regulatory environment in the financial services sector for the year including topic areas such as geopolitics and regulatory fragmentation economic conditions and impacts on clients digital assets the digitalization of financial services Environmental Social and Governance ESG issues combating financial crime strategic agility and operational resilience and regulatory requirements. For the new members that joined the Supervisory Board extensive induction courses tailored to them individually were developed and carried out to facilitate their induction into office. ,,,,,,,,,,,,,0.36529708035753533,,,,,,
149,We continually strive to identify and prevent potential conflicts of interest on the part of our members as early as possible and arrange for their mitigation. Following the election of the employee representatives to the Supervisory Board on April Ms. Gerlinde Siebert informed us that her role as Global Head of Governance may overlap with tasks of the Regulatory Oversight Committee. Through indepth discussions the Supervisory Board was able to ensure itself that any resulting conflict of interest does not stand in the way of an unrestricted participation on the Supervisory Board. Ms. Gerlinde Siebert did not become a member of the Regulatory Oversight Committee so no potential conflict of interest exists. Also the performance of external mandates by our Supervisory Board members at other companies and management bodies is regularly reviewed for potential conflicts of interest. ,,,,,,,,,,,,,,,0.32842280589912043,,,,
151,EY GmbH Co. KG Wirtschaftsprüfungsgesellschaft EY audited the Annual Financial Statements including the accounting and the Combined Management Report for the Annual Financial Statements and Consolidated Financial Statements for the financial year and issued in each case an unqualified audit opinion on March . The Auditors Reports were signed jointly by the Auditors Mr. Mai and Mr. Lösken. Furthermore EY performed a limited assurance review in the context of the combined separate NonFinancial Report as well as the NonFinancial Statement NonFinancial Reporting and in each case issued an unqualified opinion. EY issued a separate unqualified opinion for the Compensation Report. The Audit Committee examined the documents for the Annual Financial Statements and Consolidated Financial Statements as well as the NonFinancial Reporting at its meeting on March . Representatives of EY provided the final report on the audit results. The Chairman of the Audit Committee reported to us on this at the meeting of the Supervisory Board. Based on the recommendation of the Audit Committee and after inspecting the Annual Financial Statements and Consolidated Financial Statements documents as well as the documents for the NonFinancial Reporting and following an extensive discussion on the Supervisory Board as well as with the representatives of the auditor we noted the results of the audits with approval. We determined that also based on the final results of our inspections there are no objections to be raised. Today we approved the Annual Financial Statements and Consolidated Financial Statements prepared by the Management Board. The Annual Financial Statements are thus established. We agree to the proposal for the appropriation of distributable profit. ,,0.3169940882135885,,,,,,,,,,,,,,,,,
153,The term of office of Ms. Mayree Clark Mr. John Thain Ms. Michele Trogni and Professor Dr. Norbert Winkeljohann ended as scheduled with the conclusion of the General Meeting on May . In accordance with our proposal the General Meeting reelected all four of these shareholder representatives to the Supervisory Board in each case for a term of office of around four years. With the conclusion of the General Meeting on May the term of office of the employee representatives on the Supervisory Board came to an end. Mr. Jan Duscheck Ms. Manja Eifert and Mr. Timo Heider were reelected to the Supervisory Board. Newly elected as employee representatives to the Supervisory Board were Ms. Susanne Bleidt Ms. Claudia Fieber Ms. Birgit Laumen Ms. Gerlinde Siebert Mr. Frank Schulze Mr. Stephan Szukalski elected for the third time to the Supervisory Board and Mr. Jürgen Tögel. Ms. Birgit Laumen stepped down from her office with effect from January . Mr. Florian Haggenmiller was appointed by the court as her successor with effect from January . ,,0.28529597964153497,,,,,,,,,,,,,,,,,
253,Strategy and Sustainability Committee,0.29693468434282244,,,,0.35913908668065925,,,,,,,,,,,,,,
257,Technology Data and Innovation Committee ,,,,,,,,,,,,,0.4115764095771124,,,,,,
269,between and Invested in to further develop the banks franchise to drive business growth strengthen controls and improve operational efficiency expect forward quarterly runrate of bn of adjusted costs from onwards Continued increase in Sustainable Finance volumes by bn in to bn total cumulative since ,0.2971016143180901,,,0.32430187795710197,,,,,,,,,,,,,,,
307,Sustainability ,0.35593328042634365,,,,0.36391490104576785,,,,,,,,,,,,,,
312, Investing into feegenerating payment platforms and enhanced industry coverage teams Expansion of feebased institutional business and increasing intensity in crossdivisional solutions Accelerated development of new business with future revenue potential including Merchant Solutions and Digital Asset CustodyFY Investments and selective hiring in Origination Advisory to drive future revenue growth as industry recovers Completed the acquisition of Numis to create a leading corporate broker in the UK Consolidation of performance in FIC Sales Trading in with deeper client penetration and focused product diversification expected to drive revenue growth in and beyond Strong stepoff for future growth with year end assets under management of bn up year on year Growing Xtrackers through product innovation and regional expansion Focus on Alternatives Credit Europe and Real Estate Debt in the US Strengthening Fixed Income and Multi Asset capabilities to increase potential for scaling,,,,,,,,,,,0.5072695891423503,,0.34663105558283397,,,,,,
313,Corporate BankNoninterest expensesProfit before taxNet revenuesAsset ManagementInvestment Bank,,,,,,,,,,,,,,,0.3299615116266674,,,,
316,Corporate BankInvestment BankPrivate BankAsset Management,,,,,,,,,,,0.49831408465210525,,,,,,,,
321,Deutsche Bank Business segments ,,,,,,,,,,,,,,0.4129776185663168,,,,,
326,The Investment Bank is a key pillar of Deutsche Banks business. Across FIC and Origination and Advisory corporate and institutional clients access a comprehensive range of services encompassing financing market makingliquidity provision risk management solutions advisory and debt and equity issuance. The segment regionally encompasses EMEA Americas and APAC across both Investment Bank businesses and client footprint. In underlying markets were less conducive to client flows versus a very strong and the resulting uncertainty continued to depress levels of capital market and advisory activity. Despite this the Investment Bank continued to execute against its strategic priorities delivering an enhanced service offering to its clients and building on the progress made since the formation of the business in . The development of the Investment Banks FIC business has been pronounced with the longterm growth in revenue and market share reflecting the successful delivery against strategic objectives across multiple areas of the business. This success has been driven by a wide range of factors. A strong and stable management team is in place with the segment demonstrating its ability to attract leading talent via a number of specific and targeted senior hires into subbusiness leadership positions through . A defined technology strategy is delivering simplified and sustainable capability with over applications decommissioned in the past two years and investment into areas across the business is enabling product enhancements and the development of new capability for the divisions clients. This has been demonstrated by workflow solutions which provide clients access to Deutsche Banks product suite in a simplified and operationally efficient manner. The continued focus on the divisions clients has been enhanced via the creation of dedicated relationship management and client enablement functions within the Institutional Coverage Group. This ensures deeper strategic relationships with clients whilst providing them with the most efficient ways of working with Deutsche Bank. This is further enhanced by the significant increase in client engagement following the recent rating upgrades. The continued success has also been recognized externally. As an example Euromoney recognized Deutsche Bank as the leading global FX provider for a second year in a row. In an environment where fee pools continued to be restricted the focus of Origination Advisory has been building the platform to ensure the business is positioned to benefit when activity is expected to return in . A significant number of targeted senior hires have been made with a focus upon sectors and regions where Deutsche Bank is able to compete but is currently underweight. Alongside this organic growth the acquisition of Numis will further enhance Origination Advisorys depth of offering in the UK the largest EMEA fee pool whilst also enabling the crosssell of other segmental products into the client base. To ensure that strong relationships are maintained with clients the business has established a Client Strategy and Analytics team which will drive the depth of relationships with its client base and ensure close monitoring of performance at the most granular level. In the strategy of the Investment Bank is focused on working towards its vision of being the leading nonU.S. global investment bank and delivering upon the segments growth and return targets. This is aimed to be achieved via targeted growth investments and the continued development of its client strategy combined with a focus on technology data enabled capability capital efficiency and control. The investments made into the Origination Advisory franchise are expected to increase the weighting of strategic advisory revenues as a percentage of total revenues over time. Within FIC investment into existing businesses in areas where the division has a competitive advantage will continue. This will be complemented by the expansion into a small number of adjacent businesses where the existing platform and client base can be leveraged to enable growth at low marginal costs. The result of each of these will be a further diversification of revenue streams whilst also ensuring an enhanced and relevant product offering for the client base. Finally ESG remains a priority across the Investment Bank as the segment continues supporting its clients globally. Deutsche Bank held its second Sustainability Deep Dive in March providing insight into the different approaches that the bank has developed with clients across the globe. From a transaction perspective there were a number of key events in including completing a bespoke dealcontingent interest rate hedge and a tailored financing for Hai Long Taiwans largest offshore wind project to date and acting as global coordinator and joint active bookrunner on Air FranceKLMs billion inaugural sustainabilitylinked long year and long year bond offering. ,,,,,,,,,,,,,0.3259702178253246,,,,,,
331,Asset Management ,0.2850020936937973,,,,0.3543640589202105,,,,,,,,0.3427528536186327,,,,,,
341,The following discussion and analysis should be read in conjunction with the consolidated financial statements and the related notes. Deutsche Banks Operating and financial review includes qualitative and quantitative disclosures on Segment results of operations and entitywide disclosures on net revenue components as required by International Financial Reporting Standard IFRS Operating Segments. For additional business segment disclosure under IFRS please refer to Note Business Segments and related information of the consolidated financial statements. Forwardlooking statements are disclosed in the section Outlook in this report. ,,0.29070524407191206,,,,,0.41138140228180287,,,0.334541310247369,,,,,,,,,
350,Banking Industry ,,,,,,,,,,,,,0.3379153626616733,,,,,,
355,In Commercial Real Estate CRE markets continued to face headwinds due to the impacts of higher interest rates decreasing market liquidity combined with tightened lending conditions and structural changes in the office sector. The market stress has been more pronounced in the U.S. where property price indices point to a greater decline of CRE asset values from recent peaks compared to Europe and APAC. Especially within the office segment the market weakness is most evident in the U.S. reflected in subdued leasing activity and higher vacancy rates compared to Europe. The global Origination Advisory industry fee pool in fell a further following a drop in from record highs in driven by a subdued Mergers Acquisitions market challenging primary credit markets and largely inactive sponsors. Mergers Acquisitions in fell but was still higher than the preCOVID pandemic fee pool of billion while the fourth quarter had strong volumes. Equity Capital Markets issuance increased in as equity markets bounced back and volatility was low. The high yield market was up over from a decadelong low while leveraged loan issuance fell with sponsors choosing to continue their pause on acquisitions. The investment grade bond market remained relatively robust with issuance down in and has had a strong start to . Within Fixed Income revenue pools remained at elevated levels compared to historical averages although below the levels seen in . Foreign exchange activity decreased across the ten most traded currencies globally with Rates and Emerging Markets each declining from strong levels in the prior year. Conversely within Credit an increase year on year was driven by a more favorable environment for secondary trading with the general trend of tightening spreads while in Financing client demand remained stable and broadly aligned to prior year. ,,,,,,,,,,,,0.3871584622529383,,,,,,,
365,Noninterest expenses as a percentage of total net revenues which are defined as net interest income before provision for credit losses plus noninterest income ,0.28470710505681734,,,,,,,,,,,,,,,,,,
375,Management Structure ,,,,,,,,,,,,,,,,,0.24442918354669488,,
381,Infrastructure ,,,,0.4340675378369119,,,,0.3748070517256562,,,,,,,,,,,
382,The Infrastructure functions perform control and service activities for the businesses including tasks relating to Groupwide crossdivisional resourceplanning steering and control as well as tasks relating to risk liquidity and capital management. The Infrastructure functions are organized into the following areas of responsibility linked to a dedicated member of the Management Board Chief Executive Office Chief Financial Office Chief Risk Office Chief Administration Office Technology Data and Innovation Chief Operating Office CB IB Operations and Controls Infrastructure also includes Communications Corporate Social Responsibility Chief Sustainability Office Regional Management Group Audit Legal Business Selection and Conflicts Office Compliance Anti Financial Crime Global Procurement Global Real Estate and Human Resources. For and costs relating to Infrastructure functions were allocated using an actual to plan approach. From the first quarter of the bank introduced a DriverBased Cost Management methodology for the allocation of costs originated in applicable Infrastructure functions. The new approach aims to provide transparency over the drivers of Infrastructure costs and links costs closely to service consumption by segments. Whilst in the allocations to the corporate divisions continued to be based on planned allocations except for technology development costs which are charged to divisions based on actual expenditures from Infrastructure costs will all be charged to divisions based on actual costs and service consumption in support of the banks continued focus on cost discipline. ,,0.3284977730068065,,0.5030745078694374,0.38206180410148066,0.44991383334254587,,0.49062362153527783,,,0.5023766048630274,,0.3504000275860437,0.4742685716678462,0.3368933267481347,,,0.25222555928239926,
385,Results of operations ,,0.3232137000804401,,,0.3686701631249445,,,,,,,,,,,,,,
392,For further details please refer to Note Material accounting policies and critical accounting estimates of this report ,0.32469518328172076,0.36693941729998486,0.3659404526826853,,0.3679842322122696,0.36084271851496236,0.414803014979173,,0.3763649156055411,,,,,,,,,,
395,Total interest and similar income Total interest expenses Net interest income Average interestearning assets,,,,,,,,,,,,,,,,,,0.27695580653726865,
409,Net gains losses on financial assetsliabilities at fair value through profit or loss ,0.2818096329307015,,,,,,,,,,,,,,,,,,
410,Trading income Net gains losses on nontrading financial assets mandatory at fair value through profit or loss NM NM Net gains losses on financial assetsliabilities designated at fair value through profit or loss NM NM Total net gains losses on financial assetsliabilities at fair value through profit or loss ,0.30282787254254134,,0.3717371463423878,,,,0.4479447528369789,,,0.32751601937557695,,,,0.4165887161485355,,,,,
412,Net interest income and net gains losses on financial assetsliabilities at fair value through profit or loss ,0.30373971391075616,,,,,,,,,,,,,,,,,,
413,The banks trading and risk management activities include interest rate instruments and related derivatives. Under IFRS interest and similar income earned from trading instruments and financial instruments at fair value through profit or loss i.e. coupon and dividend income and the costs of funding net trading positions are part of net interest income. The banks trading activities can periodically shift income between net interest income and net gains losses on financial assetsliabilities at fair value through profit or loss depending on a variety of factors including risk management strategies. In order to provide a more business focused discussion the following table presents net interest income and net gains losses on financial assetsliabilities at fair value through profit or loss by corporate division. ,,,,,,,,,,,0.5216421985067049,,,,,,,,
414,Net interest income Total net gains losses on financial assetsliabilities at fair value through profit or loss Total net interest income and net gains losses on financial assetsliabilities at fair value through profit or loss Breakdown by corporate division,0.2906731178593723,,,,,,,,,0.3262753258310211,,,,,,,,0.26233092590926665,
415,Corporate Bank Investment Bank Private Bank Asset Management NM Corporate Other NM Total net interest income and net gains losses on financial assetsliabilities at fair value through profit or loss ,0.31692143338675033,,,,,,,,,,0.5302210655151032,,,0.44628143485201577,0.3612185422789844,,0.2515461952595632,0.30238373705124755,
417,This breakdown reflects net interest income and net gains losses on financial assetsliabilities at fair value through profit or loss for a discussion of the corporate divisions total revenues by product please refer to Note Business Segments and related information of this report ,,,,,,,0.47997623765324277,,,0.33177340725362287,,,,,,,,0.2535381280704258,
