2146,Outstanding at beginning of year . . Granted Issued or Exercised . . Forfeited . . Expired . . Other Movements . . Outstanding at end of year . . Of which exercisable . . ,,,,,,,,,,,,,,,0.3279083286410897,,,,
2157,Defined benefit obligation related to Active plan participants Participants in deferred status Participants in payment status Total defined benefit obligation Fair value of plan assets Funding ratio in ,,,,,,,,,,,,,,,,,0.30041269627502,,
2175,Discount rate in . . . . . . . . Rate of price inflation in . . . . . . . . Rate of nominal increase in future compensation levels in . . . . . . . . Rate of nominal increase for pensions in payment in . . . . . . . . Assumed life expectancy at age For a male aged at measurement date . . . . . . . . For a female aged at measurement date . . . . . . . . For a male aged at measurement date . . . . . . . . For a female aged at measurement date . . . . . . . . Mortality tables applied Modified Richttafeln Heubeck G SAPS S Light Very Light with CMI projections PRI with MP projection Country specific tables Modified Richttafeln Heubeck G SAPS S Light Very Light with CMI projections PRI with MP projection Country specific tables ,,,,,,,,,,,,,,,,0.2991719486491053,,,
2180,Change in the present value of the defined benefit obligation Balance beginning of year Defined benefit cost recognized in Profit Loss Current service cost Interest cost Past service cost and gain or loss arising from settlements Defined benefit cost recognized in Other Comprehensive Income Actuarial gain or loss arising from changes in financial assumptions Actuarial gain or loss arising from changes in demographic assumptions Actuarial gain or loss arising from experience Cash flow and other changes Contributions by plan participants Benefits paid Payments in respect to settlements AcquisitionsDivestitures Exchange rate changes Other Balance end of year thereof Unfunded Funded Change in fair value of plan assets Balance beginning of year Defined benefit cost recognized in Profit Loss Interest income Defined benefit cost recognized in Other Comprehensive Income Return from plan assets less interest income Cash flow and other changes Contributions by plan participants Contributions by the employer,,,,,,,,,,,,,,,,,0.25132520952999904,,
2182, Payments in respect to settlements AcquisitionsDivestitures Exchange rate changes Other Plan administration costs Balance end of year Funded status end of year Change in irrecoverable surplus asset ceiling Balance beginning of year Interest cost Changes in irrecoverable surplus Exchange rate changes Balance end of year Net asset liability recognized ,,,,,0.34302912726996804,0.3498374124839168,,0.3896340860406936,0.3402419913130426,,0.503843186228488,,,0.40754935133403336,,,,,
2188,Change in the present value of the defined benefit obligation Balance beginning of year Defined benefit cost recognized in Profit Loss Current service cost Interest cost Past service cost and gain or loss arising from settlements Defined benefit cost recognized in Other Comprehensive Income Actuarial gain or loss arising from changes in financial assumptions Actuarial gain or loss arising from changes in demographic assumptions Actuarial gain or loss arising from experience Cash flow and other changes Contributions by plan participants Benefits paid,,,,,,,,,,,,,,,,,0.24082401326073025,,
2189, Payments in respect to settlements AcquisitionsDivestitures Exchange rate changes Other Balance end of year thereof Unfunded Funded Change in fair value of plan assets Balance beginning of year Defined benefit cost recognized in Profit Loss Interest income Defined benefit cost recognized in Other Comprehensive Income Return from plan assets less interest income Cash flow and other changes Contributions by plan participants Contributions by the employer,,,,,,,,,,,,,,,,,0.2630149794860349,,
2200,Government Nongovernment bonds Noninvestmentgrade bonds Government Nongovernment bonds Securitized and other Debt Investments Insurance Alternatives Real estate Commodities Private equity Other,,,,,,,,,,,,,,,,,,0.2922450829050116,
2207,Government Nongovernment bonds Noninvestmentgrade bonds Government Nongovernment bonds Securitized and other Debt Investments Insurance Alternatives Real estate Commodities Private equity Other Derivatives Market Value Interest rate Credit Inflation Foreign exchange Other Total fair value of quoted plan assets ,0.3077193948294759,,,,,,,,,,,,,,,,,0.3063052497148915,
2210,Cash and cash equivalents Equity instruments Government bonds investmentgrade and above Government bonds noninvestmentgrade Nongovernment bonds investmentgrade and above Nongovernment bonds noninvestmentgrade Securitized and other Debt Investments Subtotal Share in Other asset categories Fair value of plan assets ,0.2896588075217177,,,0.32331450020805313,0.33396584749575225,,,0.3709157298394892,0.34117896935729375,,0.5387219765548029,,,,,,,0.3013888073528142,0.3996442383027386
2231,Expected contributions to Defined benefit plan assets BVV Other defined contribution plans Expected benefit payments for unfunded defined benefit plans Expected total cash flow related to postemployment benefits ,,,,,,,,,,,,,,,,,0.25589970972132636,,
2233,The following table presents a breakdown of specific expenses according to the requirements of IAS and IFRS . ,,0.2843438277208475,0.34656968645630726,,,0.3610293955385965,,0.3708301106783428,0.4165137071526933,,,,0.3391874251155895,,,0.3419059007739999,0.26739942581277193,,
2235, Net interest cost income Total expenses defined benefit plans Expenses for defined contribution plans BVV Other defined contribution plans Total expenses for defined contribution plans Total expenses for postemployment benefit plans Employer contributions to statemandated pension plans Pensions related payments social security in Germany Contributions to pension fund for Postbanks postal civil servants Further pension related statemandated benefit plans Total employer contributions to statemandated benefit plans Expenses for sharebased payments Expenses for sharebased payments equity settled,,,,,,,,,,,,,,,,0.3070626139833241,0.2698606987170939,,
2239,Severance related items under Service Costs are reclassified to Expenses for Severance payments ,,,,,,,,,,,,,,,,,,,0.4367209659256983
2240,Including expenses for new hire awards and the acceleration of expenses not yet amortized due to the discontinuation of employment including those amounts which are recognized as part of the Groups restructuring expenses ,,,0.32455066130440063,,,,,,,,,,,,0.33424414920497747,,,,0.4082057136184808
2241,Excluding the acceleration of expenses for deferred compensation awards not yet amortized. Severance related items under Service Costs were reclassified to Expense for Severance payments ,,,,,,,,,,,,,,,,,,,0.4313059721944312
2255,Deferred tax assets Unused tax losses Unused tax credits Deductible temporary differences Trading activities including derivatives Employee benefits including equity settled share based payments Accrued interest expense Loans and borrowings including allowance for loans Leases Intangible Assets Fair value OCI IFRS Other assets Other provisions Other liabilities Total deferred tax assets pre offsetting Deferred tax liabilities Taxable temporary differences Trading activities including derivatives Employee benefits including equity settled share based payments Loans and borrowings including allowance for loans Leases Intangible Assets Fair value OCI IFRS Other assets Other provisions Other liabilities Total deferred tax liabilities pre offsetting ,,,,,,,,0.37669518445868033,0.33488255891466695,,,,,,,,,0.2555085130212046,0.4182100425119451
2265,Derivative financial instruments and hedging activities ,,,,,,,,,,,0.5098710066690063,,,,,,,,
2266,Derivative contracts used by the Group include swaps futures forwards options and other similar types of contracts. In the normal course of business the Group enters into a variety of derivative transactions for sales marketmaking and risk management purposes. The Groups objectives in using derivative instruments are to meet customers risk management needs and to manage the Groups exposure to risks. In accordance with the Groups accounting policy relating to derivatives and hedge accounting as described in Note Material Accounting Policies and Critical Accounting Estimates all derivatives are carried at fair value in the balance sheet regardless of whether they are held for trading or nontrading purposes. ,,0.29123761020813255,,,0.33698247978049223,,0.42940408656000956,0.3705021229279014,0.36313831180931966,,,,0.3446631460433267,0.39720557903930803,,,,,
2269,The majority of the Groups derivatives transactions relate to sales and marketmaking activities. Sales activities include the structuring and marketing of derivative products to customers to enable them to take transfer modify or reduce current or expected risks. Marketmaking involves quoting bid and offer prices to other market participants enabling revenue to be generated based on spreads and volume. ,,0.3412037478744607,0.36430190517263206,,,,0.49766811856594734,0.3867159421888297,,,0.5047440303242997,0.3984777418191172,0.39264143553291886,0.5576623090230037,,,0.3469729056263347,0.3588788438015049,
2270,Risk management ,,,,,,,,,,,,,0.39230963137250585,,,,,,
2288,Dec Carrying amount of Financial instruments designated as fair value hedges Accumulated amount of fair value hedge adjustments Total Accumulated amount of fair value hedge adjustments Terminated hedge relationships Fair Value changes used for hedge effectiveness in m. Assets Liabilities Assets Liabilities Assets Liabilities ,,,,,,,,0.39267436500124503,,,,,,,,,,,
2295, thereof relates to terminated programs Gains losses posted to equity for the year ended Gains losses removed from equity for the year ended thereof relates to terminated programs Changes of hedged items value used for hedge effectiveness Ineffectiveness recorded within PL ,,,0.3392395810272262,0.3373724730923127,0.3651307881972101,,,,,,,0.3658549668413583,,,,,,,
2319, Other credit risk related transactions Allowance for loan losses Provision for loan losses Guarantees and commitments ,,,,,,,,,0.3449809443546586,,0.49782298645896494,0.4016264010069629,,,,,,,0.406509735943531
2324,Trading assets and positive market values from derivative financial transactions with associated companies amounted to million as of December and million as of December . Trading liabilities and negative market values from derivative financial transactions with associated companies amounted to million as of December and million as of December . Other assets related to transactions with associated companies amounted to million as of December and million as of December . Other liabilities related to transactions with associated companies were million as of December and million as of December . ,,,,,,,0.4064953955841732,0.39231033372548574,,,0.5118316759033299,,,,,,,,
2328,Equity shares issued by the Group held in plan assets Other assets Fees paid from plan assets to asset managers of the Group Market value of derivatives with a counterparty of the Group Notional amount of derivatives with a counterparty of the Group ,,,,,,,,,0.3357569149032552,,0.5027845028435236,,,,,,,,
2335,Net income attributable to noncontrolling interests Accumulated noncontrolling interests of the subsidiary Dividends paid to noncontrolling interests Summarized financial information Total assets Total liabilities Total net revenues Net income loss Total comprehensive income loss net of tax ,,0.29374892935314106,,,,,,,,0.3622761943672411,,,,,,,,,
2337,Statutory contractual or regulatory requirements as well as protective rights of noncontrolling interests might restrict the ability of the Group to access and transfer assets freely to or from other entities within the Group and to settle liabilities of the Group. The following contractual restrictions impact the Groups ability to use assets and the table below reflects the volume of those restricted assets The Group has pledged assets to collateralize its obligations under repurchase agreements securities financing transactions collateralized loan obligations and for margining purposes for OTC derivative liabilities The assets of consolidated structured entities are held for the benefit of the parties that have bought the notes issued by these entities ,0.3092627178633471,,0.3174451044014697,0.3539574334728547,,,0.4181700876178384,0.391487920696672,0.3344957276952951,0.38020922338205054,0.5557542412495966,0.4247744830209973,,0.41893190295925575,0.36203862157612476,,,0.267746937512032,0.4048831114130443
2338,Restricted assets ,,,,,,,,,,0.34717704274844063,,,,,,,,,
2340,Interestearning deposits with banks Financial assets at fair value through profit or loss Financial assets at fair value through other comprehensive income Loans at amortized cost Other Total ,0.3256560829995595,,,,0.33643373251934083,,,,,,0.5524702933679135,,,,,,,,
2343,Nature purpose and extent of the Groups interests in structured entities ,,,,,,,,,,,,,,,,,,0.3290316921843092,
2344,The Group engages in various business activities with structured entities which are designed to achieve a specific business purpose. A structured entity is one that has been set up so that any voting rights or similar rights are not the dominant factor in deciding who controls the entity. An example is when voting rights relate only to administrative tasks and the relevant activities are directed by contractual arrangements. A structured entity often has some or all of the following features or attributes Restricted activities A narrow and welldefined objective Insufficient equity to permit the structured entity to finance its activities without subordinated financial support Financing in the form of multiple contractually linked instruments to investors that create concentrations of credit or other risks tranches The principal uses of structured entities are to provide clients with access to specific portfolios of assets and to provide market liquidity for clients through securitizing financial assets. Structured entities may be established as corporations trusts or partnerships. Structured entities generally finance the purchase of assets by issuing debt and equity securities that are collateralized by andor indexed to the assets held by the structured entities. The debt and equity securities issued by structured entities may include tranches with varying levels of subordination. Structured entities are consolidated when the substance of the relationship between the Group and the structured entities indicate that the structured entities are controlled by the Group as discussed in Note Material Accounting Policies and Critical Accounting Estimates. ,,,,0.3224223275142551,,,,,,,,0.3539045630873252,,,,,,,
2349,Third party funding entities The Group provides funding to structured entities that hold a variety of assets. These entities may take the form of funding entities trusts and private investment companies. The funding is collateralized by the asset in the structured entities. The groups involvement involves predominantly both lending and loan commitments. The vehicles used in these transactions are controlled by the borrowers where the borrowers have the ability to decide whether to post additional margin or collateral in respect of the financing. In such cases where borrowers can decide to continue or terminate the financing the borrowers will consolidate the vehicle. Securitization Vehicles The Group establishes securitization vehicles which purchase diversified pools of assets including fixed income securities corporate loans and assetbacked securities predominantly commercial and residential mortgagebacked securities and credit card receivables. The vehicles fund these purchases by issuing multiple tranches of debt and equity securities the repayment of which is linked to the performance of the assets in the vehicles. The Group may transfer assets to these securitization vehicles and provides financial support to these entities in the form of liquidity facilities. The Group also invests and provides liquidity facilities to third party sponsored securitization vehicles. The securitization vehicles that are not consolidated into the Group are those where the Group does not hold the power or ability to unilaterally remove the servicer or special servicer who has been delegated power over the activities of the entity. Funds The Group establishes structured entities to accommodate client requirements to hold investments in specific assets. The Group also invests in funds that are sponsored by third parties or the bank may act as fund manager custodian or some other capacity and provide funding and liquidity facilities to both bank sponsored and third party funds. The funding provided is collateralized by the underlying assets held by the fund. The Group does not consolidate funds when Deutsche Bank is deemed agent or when another third party investor has the ability to direct the activities of the fund. Other These are Deutsche Bank sponsored or third party structured entities that do not fall into any criteria above. These entities are not consolidated by the Group when the bank does not hold power over the decision making of these entities. Income derived from involvement with structured entities The Group earns management fees and occasionally performancebased fees for its investment management service in relation to funds. Interest income is recognized on the funding provided to structured entities. Any trading revenue as a result of derivatives with structured entities and from the movements in the value of notes held in these entities is recognized in Net gainslosses on financial assetsliabilities held at fair value through profit and loss. Interests in unconsolidated structured entities The Groups interests in unconsolidated structured entities refer to contractual and noncontractual involvement that exposes the bank to variability of returns from the performance of the structured entities. Examples of interests in unconsolidated structured entities include debt or equity investments liquidity facilities guarantees and certain derivative instruments in which the Group is absorbing variability of returns from the structured entities. Interests in unconsolidated structured entities exclude instruments which introduce variability of returns into the structured entities. For example when the bank purchases credit protection from an unconsolidated structured entity whose purpose and design is to pass through credit risk to investors the bank is providing the variability of returns to the entity rather than absorbing variability. The purchased credit protection is therefore not considered as an interest for the purpose of the table below. Maximum exposure to unconsolidated structured entities The maximum exposure to loss is determined by considering the nature of the interest in the unconsolidated structured entity. The maximum exposure for loans and trading instruments is reflected by their carrying amounts in the consolidated balance sheet. The maximum exposure for derivatives and offbalance sheet commitments such as guarantees liquidity facilities and loan commitments under IFRS as interpreted by Deutsche Bank is reflected by the notional amounts. Such amounts or its development do not reflect the economic risks faced by the Group because it does not take into account the effects of collateral or hedges nor the probability of such losses being incurred. At December the notional related to the positive and negative replacement values of derivatives and off balance sheet commitments were billion billion and billion respectively. At December the notional related to the positive and negative replacement values of derivatives and off balance sheet commitments were billion billion and billion respectively. ,,,,0.3667866380399117,,,,0.3729292071263257,0.3439824439380776,,0.5469665012376935,0.38133139386437365,,,,,,,
2351,The Group provides a different measure for size of structured entities depending on their type. The following measures have been considered as appropriate indicators for evaluating the size of structured entities Funds Net asset value or assets under management where the bank holds fund units and notional of derivatives when the banks interest comprises of derivatives Securitizations notional of notes in issue excluding interest only and excess notes where applicable when the Group derives its interests through notes its holds and notional of derivatives when the banks interests is in the form of derivatives Third party funding entities Total assets in entities Repackaging and investment entities Fair value of notes in issue For third party funding entities size information is not publicly available therefore the Group has disclosed the greater of the collateral receivedpledged or the notional of the exposure the bank has to the entity. Based on the above definitions the total size of structured entities is billion of which the majority of billion is from Funds. In it was billion and billion respectively. The following table shows by type of structured entity the carrying amounts of the Groups interests recognized in the consolidated statement of financial position as well as the maximum exposure to loss resulting from these interests. The carrying amounts presented below do not reflect the true variability of returns faced by the Group because they do not take into account the effects of collateral or hedges. ,,,,,,,,,,,0.5099801438203029,,,,,,,,
2354,Assets Cash and central bank balances Interbank balances wo central banks Central bank funds sold and securities purchased under resale agreements Securities Borrowed Total financial assets at fair value through profit or loss Trading assets Positive market values derivative financial instruments Nontrading financial assets mandatory at fair value through profit or loss Financial assets designated at fair value through profit or loss Financial assets at fair value through other comprehensive income Loans at amortized cost Other assets Total assets Liabilities Total financial liabilities at fair value through profit or loss Negative market values derivative financial instruments Other shortterm borrowings Other liabilities Total liabilities Offbalance sheet exposure Total ,0.29203105121810624,,,0.3423312585965259,,,0.42015795844996645,0.3717770272463611,,0.33490450697271934,0.5250854198138599,,,,0.33575530465610964,,,,0.37816974110161716
2356,Total trading assets as of December and December of . billion and . billion are comprised primarily of . billion and . billion in securitizations and . billion and . billion in funds structured entities respectively. The Groups interests in securitizations are collateralized by the assets contained in these entities. Where the Group holds fund units these are typically in regard to market making in funds or otherwise serve as hedges for notes issued to clients. Moreover the credit risk arising from loans made to third party funding structured entities is mitigated by the collateral received. Nontrading financial assets mandatory at fair value through profit or loss includes reverse repurchase agreements to funds which comprise the majority of the interests in this category and are collateralized by the underlying securities. Loans as of December and December consist of . billion and . billion investment in securitization tranches and financing to third party funding entities. The Groups financing to third party funding entities is collateralized by the assets in those structured entities. Other assets as of December and December of . billion and . billion respectively consist primarily of cash margin balances. Pending Receivable balances are not included in this disclosure note due to the fact that these balances arise from typical customer supplier relationships out of e.g. brokerage type activities and their inherent volatility would not provide users of the financial statements with effective information about Deutsche Banks exposures to structured entities. ,,,,0.33123636472402873,,,0.4288983528623026,0.3802921628281201,,,0.5534811483510477,,,0.4013373742404622,,,,,
2359, Current and noncurrent assets and liabilities ,,,,0.32187955982582844,,,,,,,,,,,,,,,
2360,Sponsored unconsolidated structured entities where the Group has no interest as of December and December . ,,,,,,,,,,,,,,,,,,,0.3979776933646932
2365,Cash and central bank balances Interbank balances wo central banks Central bank funds sold and securities purchased under resale agreements Securities borrowed Financial assets at fair value through profit or loss Financial assets at fair value through other comprehensive income Equity method investments Loans at amortized cost Property and equipment Goodwill and other intangible assets Other assets Assets for current tax Total assets before deferred tax assets Deferred tax assets Total assets ,0.30158968794067564,,,0.32233435351616513,0.33453747038795284,,,,,,0.5012768354542044,,,,0.3345544173333603,,,,
2367,Liability items as of December ,,,,,,,,,,,,,,,,,,,0.42077384141061835
2368,Deposits Central bank funds purchased and securities sold under repurchase agreements Securities loaned Financial liabilities at fair value through profit or loss Other shortterm borrowings Other liabilities Provisions Liabilities for current tax Longterm debt Trust preferred securities Total liabilities before deferred tax liabilities Deferred tax liabilities Total liabilities ,,,,0.3328494783348885,0.3380090318176605,,,0.3874037149489848,,,0.5621555391077312,,,,,,,,0.4040939714485384
