3190,g .  consumer data employee data product data and systems could lead to reputational damage regulatory penalties  or the inability to perform key business processes.  key business process es including product marketing order management warehouse management invoice processing customer support  and financial reporting are all dependent on it systems.  significant outages application failures  or cybersecurity threats to our infrastructu re or that of our business partners could therefore result in reputational damage regulatory penalties  or cause considerable business disruption or impact to businesscritical data,,,,0.3571013477912201,,,,,,,,,0.3795669658763471,,,,,,0.4093850264141122
3195,information security architecture design application security  governance data security employee awareness programs  and a x incident response  help us to adequately protect the company.  we have also secured limited insurance coverage for da mage resulting from cybersecurity incidents.   risks related to media and stakeholder activities  adverse or inaccurate media coverage on our products or business practices including topics related to social environmental and governance as well as negative social media discussion may significantly harm adidas reputation and brand image lead to public misperception of the companys business performance and eventually res ult in a sales slowdown.  similarly certain activities on the part of key stakeholders e,,,,,,,,,,,,,0.3894158094337631,,,,,,
3232,we also face the risk that members of top management as well as our employees breach rules and stan dards that guide appropriate and responsible business behavior.  this includes the risks of fraud financial misstatements or manipulation anticompetitive business practices bribery corruption discrimination and harassment in the workplace.   our compli ance management system cms helps us to prevent detect and adequately respond to these risks.  our global policy manual provides a framework for basic work procedures and processes and our fair play code of conduct stipulates that every employee and our  business partners shall act ethically in compliance with the laws and regulations of the legal systems where they conduct company business,,,,,,,,,,0.3456621726855449,,,,,,,,,
3234,our compli ance management system cms helps us to prevent detect and adequately respond to these risks.  our global policy manual provides a framework for basic work procedures and processes and our fair play code of conduct stipulates that every employee and our  business partners shall act ethically in compliance with the laws and regulations of the legal systems where they conduct company business.  in addition our regional compliance managers and local compliance officers guide and advise our operating managers  regarding fraud and corruption topics.  furthermore we utilize controls such as segregation of duties in it systems and data analytics technology to prevent or detect fraudulent activities,,,,,,,,,,,,,0.3700320269611622,,,,,,
3235,our global policy manual provides a framework for basic work procedures and processes and our fair play code of conduct stipulates that every employee and our  business partners shall act ethically in compliance with the laws and regulations of the legal systems where they conduct company business.  in addition our regional compliance managers and local compliance officers guide and advise our operating managers  regarding fraud and corruption topics.  furthermore we utilize controls such as segregation of duties in it systems and data analytics technology to prevent or detect fraudulent activities.  we are also working with external partners and law firms to ensur e we are informed about legal requirements across the globe and we take appropriate action to ensure compliance,,,,,,,,,,0.3688013478475728,,,,,0.3642665606285208,,,,
3246,g.  sourcing logistics leading to loss of sales higher cost and a decrease in profitability.   to manage and mitigate these risks we continuously monitor potential threats and have implemented business continuity plans includ ing but not limited to fallback solutions for transportation  dynamic capacity management of containers and carriers and reallocation of production .  we also maintain high safety standards in all our locations and have secured insurance coverage for proper ty damage and business interruptions,,,,,,,,0.4620308089622133,,,,,,,,,,,
3260,we manage projects utilizing reviews by project teams as well as project steering committees to evaluate the progress quality and costs of those projects on a regular basis.  this approach allows early detection of project risks and quick implementation of corrective action or timely cancelation of projects with a low chance of success.  to ensure  true endtoend management of key projects we have established a network of program and project management departments across all main functions i. e,,,,,,0.3778471000830239,,,,,,,0.3945997045911342,,,,,,
3261,this approach allows early detection of project risks and quick implementation of corrective action or timely cancelation of projects with a low chance of success.  to ensure  true endtoend management of key projects we have established a network of program and project management departments across all main functions i. e.   sales marketing operations finance it  and human resources,,,,,,0.4036652287612299,,,,,,,0.393138844886622,,,,,,
3262,to ensure  true endtoend management of key projects we have established a network of program and project management departments across all main functions i. e.   sales marketing operations finance it  and human resources.  we also work with external partners fo r project management support in areas where we do not have the required expertise or experience inhouse,,,,,,,,,,,,,0.4357090589781896,,,,,,
3263,e.   sales marketing operations finance it  and human resources.  we also work with external partners fo r project management support in areas where we do not have the required expertise or experience inhouse.         to  o ur sha reho l ders  gro up  man a gemen t rep o rt  o ur co mpa n y  gro up  man a gemen t rep o rt  fin a n cial  review   co n so l ida ted fin an cia l sta temen ts  a ddition a l in fo rma tion            a n n u a l  r e p o r t       illustration of opportunities  in this report we illustrate financial and nonfinancial opportunities considered most relevant in   and beyond,,,,,,,,,,,,,0.4875295772071253,0.4774908107747084,,,,,
3264,sales marketing operations finance it  and human resources.  we also work with external partners fo r project management support in areas where we do not have the required expertise or experience inhouse.         to  o ur sha reho l ders  gro up  man a gemen t rep o rt  o ur co mpa n y  gro up  man a gemen t rep o rt  fin a n cial  review   co n so l ida ted fin an cia l sta temen ts  a ddition a l in fo rma tion            a n n u a l  r e p o r t       illustration of opportunities  in this report we illustrate financial and nonfinancial opportunities considered most relevant in   and beyond.  acc ording to our assessment methodology  opportunities related to existing yeezy inventory opportunities related to consumer demand and product offering macroeconomic sociopolitical regulatory and currency opportunities  opportunities related to order and supply management  opportunities related to the distribution strategy and personnel opportunities are considered major,,,,,,,,,,,,,0.394974357472229,0.4372054481467514,,,,,
3265,we also work with external partners fo r project management support in areas where we do not have the required expertise or experience inhouse.         to  o ur sha reho l ders  gro up  man a gemen t rep o rt  o ur co mpa n y  gro up  man a gemen t rep o rt  fin a n cial  review   co n so l ida ted fin an cia l sta temen ts  a ddition a l in fo rma tion            a n n u a l  r e p o r t       illustration of opportunities  in this report we illustrate financial and nonfinancial opportunities considered most relevant in   and beyond.  acc ording to our assessment methodology  opportunities related to existing yeezy inventory opportunities related to consumer demand and product offering macroeconomic sociopolitical regulatory and currency opportunities  opportunities related to order and supply management  opportunities related to the distribution strategy and personnel opportunities are considered major.  the assessment is illustrated in the corporate opportunities overview table,,,,,,,,,,,,,0.3677166887750395,,,,,,
3287,personnel opportunities  creating and managing a performanceoriented culture that fosters diversity  equity  and inclusion as well as leadership accountability and clear values in the workplace could lead to increased diversity of thought increased creativity and innovation  and higher employee satisfaction and engagement.  this may positively impact the compa nys financial performance.  a workforce that includes diverse talent and reflects the diversity of our customers and consumers helps us better serve the communities we work in and strengthen s brand reputation among our consumers which could potentially cr eate a competitive advantage and positively impact top and bottomline performance.    opportunities related to product engineering and manufacturing processes  we constantly monitor which of our product features are perceived as most relevant by our consume rs,,,,,,,,,,,,,0.3766543000802267,,,,,,
3290,opportunities related to product engineering and manufacturing processes  we constantly monitor which of our product features are perceived as most relevant by our consume rs.  according to this a further optimization of our product design could result in higher net sales and margins by consistently focusing on product features that add the most value to our consumers while increasing the cost efficiency of less relevant co mponents or reducing complexity in product design.  by working closely with our suppliers we also see respective potential for more efficient manufacturing processes.   litigation opportunities  our legal department is constantly monitoring the market for pot ential infringements of our own rights by third parties e,,,0.4450741234169494,,,,,,,,,,0.4537764128415216,0.4370426695970458,,,,,
3293,litigation opportunities  our legal department is constantly monitoring the market for pot ential infringements of our own rights by third parties e. g.  related to trademarks patents  or other intellectual property rights.  in the event that a  third party breaches our contracts or infringes our rights we try to enforce and protect our legal po sitions and to the extent required retain specialized external counsel,,,,,,,,,,,,,0.3819477284023234,,,,,,
3294,g.  related to trademarks patents  or other intellectual property rights.  in the event that a  third party breaches our contracts or infringes our rights we try to enforce and protect our legal po sitions and to the extent required retain specialized external counsel.  this may result in among others the company demanding  contractual penalties or other financial damages payments from third parties,,,,,,,,,,,,,0.3651772377484785,,,,,,
3295,related to trademarks patents  or other intellectual property rights.  in the event that a  third party breaches our contracts or infringes our rights we try to enforce and protect our legal po sitions and to the extent required retain specialized external counsel.  this may result in among others the company demanding  contractual penalties or other financial damages payments from third parties.    opportunities related to tax and customs regula tions  the potential release of valuation allowances on deferred tax assets or the release of tax risk reserves e,,,,,,,,,,0.3623850691006968,,,,,,,,,
3334,to reach a level of  between   and    to reach a level of  between   and    to reach a level of  between   and    .    to reach a level of  between   and   capital expenditure    million   to reach a level of  around   million   to reach a level of  around   million   to reach a level of  around   million     million   to reach a level of  around   million                as published on february  .  for average working capital and capital expenditure as of march  .    as published on july,,,,,,,,,,,,,,,,0.3274097661809725,,,
3395,dec.       change in   liabilities and equity          shortterm borrowings          accounts payable            current lease liabilities          other current financial liabilities          income taxes          other current provisions            current accrued liabilities            other current liabilities          total current liabilities                       longterm borrowings            noncurrent lease liabilities            other noncurrent financial liabilities          pensions and similar obligations          deferred tax liabilities          other noncurrent provisions          noncurrent accrued liabilities         n. a.  other noncurrent liabilities           total noncurrent liabilities                       share capital          reserves          retained earnings            shareholders equity                      noncontrolling interests                    total equity                      total liabilities and equity                      the accompanying notes are an integral part of these consolidated financial statements,,,,,,,,,0.3527799801721806,,,,,,,,,,
3405,.    . pp  royalty and commission income         .   other operating income,,,,,,,,,,0.346363932224427,,0.3657566374439101,,,,,,0.3157053028637528,
3406,. pp  royalty and commission income         .   other operating income         .   other operating expenses,,,,,,,,,0.3557760773127711,0.3618026159721859,,0.3745084459303182,,0.4270795553029659,,,,0.3360395048461995,
3407,pp  royalty and commission income         .   other operating income         .   other operating expenses               .    of net sales,,,,,,,0.4797836860096547,,0.3494775578713291,0.3659150414102728,,0.3981998271018987,,0.4340148671856492,,,,0.3139067425866249,
3408,other operating income         .   other operating expenses               .    of net sales     .,,,,,,,,,,,,,,0.4230960724387686,,,,0.2626803468270712,
3409,other operating expenses               .    of net sales     .    .,,,,,,,0.4641623599815033,,,,,,,0.4197277873416698,,,,,
3412,. pp  marketing and pointofsale expenses           .    of net sales     .,,,,,,,0.4622580191021721,,,,,,,,,,,,
3415,.    . pp  distribution and selling expenses           .    of net sales,,,,,,,0.4665474711063295,,,,,,,,,,,,
3416,. pp  distribution and selling expenses           .    of net sales     .,,,,,,,0.486896987500237,,,,,,,,,,,,
3417,pp  distribution and selling expenses           .    of net sales     .    .,,,,,,,0.4617296166720727,,,,,,,,,,,,
3460,.    n. a.  net income attributable to noncontrolling interests,,,,,,,,,,,,0.3628770766048736,,,0.3714910748792398,,,,
3477,.    n. a.           the accompanying notes are an integral part of these consolidated financial statements,,,,,,,,,0.3771629845573894,,,,,,,,,,
3497,the following amendments to existing standards and interpretations are effective for financial years beginning on january     and have been applied for the first time to these consolidated financi al statements   ifrs  insurance contracts and amendments to ifrs  effective date january    the new standard covers the recognition and measurement presentation and disclosure related to all types of insurance contracts.  ifrs  is effective for reporting periods beginning on or after january    and replaces ifrs  insurance contracts.  ifrs  had no material impact on the consolidated financial statements.    amendments to ias  definition of accounting estimates effective date january   in february  the iasb issued amendments to ias  in which it introduces a definition of accounting estimates,,,,,,,,,,,,,,,,0.3806596546438504,,,
3498,ifrs  is effective for reporting periods beginning on or after january    and replaces ifrs  insurance contracts.  ifrs  had no material impact on the consolidated financial statements.    amendments to ias  definition of accounting estimates effective date january   in february  the iasb issued amendments to ias  in which it introduces a definition of accounting estimates.  the amendments clarify the distinction between changes in accounting estimates and changes in accounting policies and the correction of errors,,,,,,,,,,,,,,,,0.3117321862593492,,,
3499,ifrs  had no material impact on the consolidated financial statements.    amendments to ias  definition of accounting estimates effective date january   in february  the iasb issued amendments to ias  in which it introduces a definition of accounting estimates.  the amendments clarify the distinction between changes in accounting estimates and changes in accounting policies and the correction of errors.  also they clarify how entities use measurement techniques and inputs to develop acco unting estimates,,,,,,,,,,,,,,,,0.3003904765835429,,,
3507,the amendments to ias  are appli cable for annual periods beginning on or after january  .  since the amendments to the practice statement  provide nonmandatory guidance on the application of the definition of material to accounting policy information an effective date for these  amendments is not necessary.  the amendments have led to a selective reduction in the disclosures on accounting policies.           to  o ur sha reho l ders  gro up  man a gemen t rep o rt  o ur co mpa n y  gro up  man a gemen t rep o rt  fin a n cial  review  co n so l ida ted fin an cia l  sta temen ts  a ddition a l in fo rma tion            a n n u a l  r e p o r t        amendments to ias  deferred tax related to assets and liabilities arising from a single transaction effective date january    in may  the board issued amendments to ias  which narrow the scope of the initial recognition exemption under ias  so that it no longer applies to transactions that give rise to equal taxable and deductible temporary differences,,,,,,,,,,,,,,,0.3793438629870584,0.33666191009193,,,
3508,since the amendments to the practice statement  provide nonmandatory guidance on the application of the definition of material to accounting policy information an effective date for these  amendments is not necessary.  the amendments have led to a selective reduction in the disclosures on accounting policies.           to  o ur sha reho l ders  gro up  man a gemen t rep o rt  o ur co mpa n y  gro up  man a gemen t rep o rt  fin a n cial  review  co n so l ida ted fin an cia l  sta temen ts  a ddition a l in fo rma tion            a n n u a l  r e p o r t        amendments to ias  deferred tax related to assets and liabilities arising from a single transaction effective date january    in may  the board issued amendments to ias  which narrow the scope of the initial recognition exemption under ias  so that it no longer applies to transactions that give rise to equal taxable and deductible temporary differences.  the amend ments should be applied to transactions that occur on or after the beginning of the earliest comparative period presented,,,,,,,,,,,,,,,0.3722360395091396,0.3131696963566029,,,
3511,the amend ments should be applied to transactions that occur on or after the beginning of the earliest comparative period presented.  in addition at the beginning of the earliest comparative period presented a deferred tax asset provided that sufficient taxable pr ofit is available and a deferred tax liability should also be recognized for all deductible and taxable temporary differences associated with leases and decommissioning obligations.  the amendments had no material impact on adidas in particular since adid as did not apply the initial recognition exemption in the context of leases under ifrs .    amendments to ias   international tax reform  pillar two model rules  effective date january   in may  the iasb issued international tax reform pillar two model rules  amendments to ias  to clarify the application of ias  income taxes to income taxes arising from tax law enacted or substantively enacted to implement the  oecd pillar two model rules,,,,,,,,,,,,,,,,0.3295721157649856,,,
3512,in addition at the beginning of the earliest comparative period presented a deferred tax asset provided that sufficient taxable pr ofit is available and a deferred tax liability should also be recognized for all deductible and taxable temporary differences associated with leases and decommissioning obligations.  the amendments had no material impact on adidas in particular since adid as did not apply the initial recognition exemption in the context of leases under ifrs .    amendments to ias   international tax reform  pillar two model rules  effective date january   in may  the iasb issued international tax reform pillar two model rules  amendments to ias  to clarify the application of ias  income taxes to income taxes arising from tax law enacted or substantively enacted to implement the  oecd pillar two model rules.  the amendments include a temporary excepti on to the accounting for deferred taxes arising from the implementation of the pillar two model rules and additional disclosure requirements for affected entities with the aim to help users of the financial statements better understand an entitys exposur e to the pillar two model rules,,,,,,,,,,,,,,,,0.3529111095292001,,,
3513,the amendments had no material impact on adidas in particular since adid as did not apply the initial recognition exemption in the context of leases under ifrs .    amendments to ias   international tax reform  pillar two model rules  effective date january   in may  the iasb issued international tax reform pillar two model rules  amendments to ias  to clarify the application of ias  income taxes to income taxes arising from tax law enacted or substantively enacted to implement the  oecd pillar two model rules.  the amendments include a temporary excepti on to the accounting for deferred taxes arising from the implementation of the pillar two model rules and additional disclosure requirements for affected entities with the aim to help users of the financial statements better understand an entitys exposur e to the pillar two model rules.  the required disclosures are provided in the note of income taxes,,,,,,,,,,,,,,,,0.3325153617186803,,,
3514,amendments to ias   international tax reform  pillar two model rules  effective date january   in may  the iasb issued international tax reform pillar two model rules  amendments to ias  to clarify the application of ias  income taxes to income taxes arising from tax law enacted or substantively enacted to implement the  oecd pillar two model rules.  the amendments include a temporary excepti on to the accounting for deferred taxes arising from the implementation of the pillar two model rules and additional disclosure requirements for affected entities with the aim to help users of the financial statements better understand an entitys exposur e to the pillar two model rules.  the required disclosures are provided in the note of income taxes.    see note   new standards and interpretations as well as amendments to existing standards and interpretations are usually not applied by adidas before the eu effective date,,,,,,,,,,,,,,,,0.3452103246628836,,,
3519,the amendments to ifrs  are applicable for annual periods beginning on or after january   and must be applied retrospectively to sale and leaseback transact ions entered into after the date of initial application of ifrs .  earlier application is permitted when the fact is disclosed.  the amendments are not expected to have a material impact on the consolidated financial statements of adidas.    amendments to ias   classification of liabilities as current or noncurrent effective date january   in january  the iasb issued amendments to paragraphs  to  of ias  to specify the requirements for classifying liabilities as current or noncurrent,,,,,,,,,,,,,,,,0.3277225434700965,,,
3522,amendments to ias   classification of liabilities as current or noncurrent effective date january   in january  the iasb issued amendments to paragraphs  to  of ias  to specify the requirements for classifying liabilities as current or noncurrent.  t he amendments clarify what is meant by a right to defer settlement that such a right to defer must exist at the end of the reporting period and that the classification is unaffected by the likelihood that an entity will exercise its deferral right.  in oc tober  the iasb issued further amendments to ias  in which it clarifies that only covenants with which an entity must comply on or before the reporting date will affect a liabilitys classification as current or noncurrent.  the amendments are effec tive for annual reporting periods beginning on or after january   and must be applied retrospectively,,,,,,,,,,,,,,,,0.3069178324103535,,,
