1728,while the uptake o f the list as an industry best practice matured further and afirm membership continues to grow various tools have been developed further in  such as a harmonized test request form the thirdparty lab evaluation questionnaire and the offer of addit ional languages for the supplier online training videos.  in addition a pfas  phaseout guidance supported by an online webinar for suppliers has been published.  all these tools will be issued to the public and made available to other companies from the tex tile and sporting goods industry and their suppliers.  we also continued to participate in several major public stakeholder consultation processes initiated by the european commission e,,,0.4156265183488221,,,,,,,,,,0.3679182159832682,,,,,,
1730,all these tools will be issued to the public and made available to other companies from the tex tile and sporting goods industry and their suppliers.  we also continued to participate in several major public stakeholder consultation processes initiated by the european commission e. g.  european chemicals agency and us state legislative initiatives to  inform governmental entities on implications and opportunities of drafted legislation,,,,,,,,,,,,,0.3713041631920568,,,,,,
1747,this included the introduction of a us regulatory compliance database which allows individual business entities and production locations to be screened against trade sanctions and forced labor risk data.  we automated this process by  linking our inhouse sustainable material traceability system to this platform enabling us to track the risk of forced labor in our supply chain.  we also continued to roll out an internal reporting tool to identify and evaluate the potential presence of ilo forced labor indicators.  we started in china where all our tier        to  o ur sha reho l ders  gro up  man a gemen t rep o rt  o ur co mpa n y  gro up  man a gemen t rep o rt  fin a n cial  review  co n so l ida ted fin an cia l  sta temen ts  a ddition a l in fo rma tion            a n n u a l  r e p o r t       manufacturing partners our nominated tier  material suppliers and targeted tier  spinning mills were assessed against these ilo indicators,,,0.429649715167867,,,,,,,,,,,,,,,,
1748,we automated this process by  linking our inhouse sustainable material traceability system to this platform enabling us to track the risk of forced labor in our supply chain.  we also continued to roll out an internal reporting tool to identify and evaluate the potential presence of ilo forced labor indicators.  we started in china where all our tier        to  o ur sha reho l ders  gro up  man a gemen t rep o rt  o ur co mpa n y  gro up  man a gemen t rep o rt  fin a n cial  review  co n so l ida ted fin an cia l  sta temen ts  a ddition a l in fo rma tion            a n n u a l  r e p o r t       manufacturing partners our nominated tier  material suppliers and targeted tier  spinning mills were assessed against these ilo indicators.  none of the suppliers assessed showed evi dence of forced labor,,,0.4399471353111656,,,,,,,,,,,,,,,,
1750,we started in china where all our tier        to  o ur sha reho l ders  gro up  man a gemen t rep o rt  o ur co mpa n y  gro up  man a gemen t rep o rt  fin a n cial  review  co n so l ida ted fin an cia l  sta temen ts  a ddition a l in fo rma tion            a n n u a l  r e p o r t       manufacturing partners our nominated tier  material suppliers and targeted tier  spinning mills were assessed against these ilo indicators.  none of the suppliers assessed showed evi dence of forced labor.  this tool is now being applied globally to ensure ongoing regulatory compliance across the entire supply chain.   in response to the ongoing war in ukraine and continued political instability in postcoup myanmar we continue to carry out a heightened version of human rights due diligence,,,0.432198301976389,,,,,,,,,,,,,,,,
1833,all strategic suppliers have also submitted initial improvement plans to address gaps  identified in the gender equality selfassessment tool and will continue to update their roadmaps for improvement.   monitoring and assessing performance   we regularly assess our manufacturing partners on their ability to provide fair healthy and environmentally sound workplace conditions by conducting announced and unannounced audits by our own team and by accredited external auditors.  any cases of noncompliance identified during audits are given a clear time frame for remediation.  potential new manufacturing facilities are assessed in a similar way and orders can only be placed if approved by the sea team,,0.3426861954477321,,,,,,,,,,,,,,,,,
1834,monitoring and assessing performance   we regularly assess our manufacturing partners on their ability to provide fair healthy and environmentally sound workplace conditions by conducting announced and unannounced audits by our own team and by accredited external auditors.  any cases of noncompliance identified during audits are given a clear time frame for remediation.  potential new manufacturing facilities are assessed in a similar way and orders can only be placed if approved by the sea team.  based on the audit results  the sourcing and se a teams jointly decide on the course of action ranging from training to enforcement actions such as sending warning letters or hiring external consultants to help improve workplace systems or practices,,0.3505038149506604,,,,,,,,,,,0.3726632713374858,,,,,,
1853,of these  factories   were either rejected directly after the initial assessment identified zerotolerance issues or were rejected with a second visit due to identification of one or more threshold issues which means they were rejected but given the chance to remediate the noncompliance issues within a specific tim eframe.  the vast majority  of all initial assessments were undertaken in asia   with china accounting for   .   overall at the end of  the firsttime rejection rate of new factories visited was  and thus lower than in t he previous year  .  manufacturing partners with threshold issues are typically  given three months to remediate them  before being reaudited for final acceptance,,,0.4241997318807976,,,,,,,,,,,,,,,,
1854,the vast majority  of all initial assessments were undertaken in asia   with china accounting for   .   overall at the end of  the firsttime rejection rate of new factories visited was  and thus lower than in t he previous year  .  manufacturing partners with threshold issues are typically  given three months to remediate them  before being reaudited for final acceptance .  through active support and capacity building all initially rejected  factories succe ssfully closed their noncompliance issues and were onboarded,,,0.4142554803359211,,,,,,,,,,,,,,,,
1902,we closely track the progress of workers graduating from this training initiative and since  approximately  female super visors have been promoted to higher positions as a result of their participation in the program.       labor rights in  we also saw a continuation of our mobilephonebased digital training project which had been successfully rolled out at  manuf acturing facilities in  countries in  .  the digital tool assesses workers awareness of their labor rights and remedies e. g,,,,,,,,,,,,,0.3892156112902515,,,,,,
1903,labor rights in  we also saw a continuation of our mobilephonebased digital training project which had been successfully rolled out at  manuf acturing facilities in  countries in  .  the digital tool assesses workers awareness of their labor rights and remedies e. g.  fire safety harassment and abuse and use of grievance channels,,,,,,,,,,,,,0.4153587100837438,,,,0.3007042268005637,,
1907,more than  workers took part in      and averaged a score higher than  out of  in the posttest questions thereby demonstrating very high levels of awareness of their core rights and available remedies.           to  o ur sha reho l ders  gro up  man a gemen t rep o rt  o ur co mpa n y  gro up  man a gemen t rep o rt  fin a n cial  review  co n so l ida ted fin an cia l  sta temen ts  a ddition a l in fo rma tion            a n n u a l  r e p o r t       manufacturing facility engagements and training sessions   throughout  we combined onsite and remote i. e.   virtual interactions to maximize the impact of our facility engagements and training sessions,,,,,,,,,,,,,,,,,0.2935231876617375,,
1908,to  o ur sha reho l ders  gro up  man a gemen t rep o rt  o ur co mpa n y  gro up  man a gemen t rep o rt  fin a n cial  review  co n so l ida ted fin an cia l  sta temen ts  a ddition a l in fo rma tion            a n n u a l  r e p o r t       manufacturing facility engagements and training sessions   throughout  we combined onsite and remote i. e.   virtual interactions to maximize the impact of our facility engagements and training sessions.  in total we completed  individual facility engagements in    and  t raining sessions for manufac turing partners licensees workers and adidas employees   reaching a total of around  people,,,,,,,,,,,,,0.3929992769201036,,,,,,
1909,e.   virtual interactions to maximize the impact of our facility engagements and training sessions.  in total we completed  individual facility engagements in    and  t raining sessions for manufac turing partners licensees workers and adidas employees   reaching a total of around  people.  the training sessions continued to cover a broad range of topics from our workplace standards guidelines and supporting policies through to targeted training on specific labor health and safety and environmental topics,,,,,,,,,,,,,0.4241422497570384,,,,0.310367128078104,,
1910,virtual interactions to maximize the impact of our facility engagements and training sessions.  in total we completed  individual facility engagements in    and  t raining sessions for manufac turing partners licensees workers and adidas employees   reaching a total of around  people.  the training sessions continued to cover a broad range of topics from our workplace standards guidelines and supporting policies through to targeted training on specific labor health and safety and environmental topics.   we continued to work with our licensee partners in  to ensure they are implementing adidas workplace standards into their manufacturing partners operations in a consiste nt manner,,,,,,,,,,,,,0.3917472335797616,,,,,,
1912,the training sessions continued to cover a broad range of topics from our workplace standards guidelines and supporting policies through to targeted training on specific labor health and safety and environmental topics.   we continued to work with our licensee partners in  to ensure they are implementing adidas workplace standards into their manufacturing partners operations in a consiste nt manner.  our licensees continue to have access to the fla elearning materials which include training courses covering topics such as human rights forced labor responsible manufacturing and worker engagement.  in  we expanded this training by fac ilitating access to the better buying institutes elearning course on responsible purchasing practices,,,,,,,,,,,,,0.3646191048117376,,,,0.3231177794289373,,
1918,in  in addition to our own audits we began to incorporate assessments conducted by the ilos better work program  a collaboration between the united nations  ilo and the international finance corporation to improve working conditions within the apparel and footwear industr y.  adidas also  continued to use social and labor convergence program slcp assessments     in its monitoring activities  to avoid repetitive social audits in shared facilities.   a total of  social compliance audits initial assessments and performance audits were conducted in    six of which were conducted remotely  .  of the  onsite performan ce audits conducted  were carried out on an unannounced basis whereby the manufacturing facility is not informed in advance of the exact date of assessment,,,,,,,,,,,,,,,,,0.29877748540796,,
1921,of the  onsite performan ce audits conducted  were carried out on an unannounced basis whereby the manufacturing facility is not informed in advance of the exact date of assessment.  the number of audits in factories manufacturing goods for licensees was reduced from  in   to  i n  reflecting a reduction in the number of licensee suppliers.    number of audits by region and type                     region   initial assessment  performance audit  environmental assessment  total                           asia                    americas                  emea                  total                                     every new manufacturing facility has to pass an initial assessment to prove compliance with the adidas workplace standards before an order is placed.  the data shown includes both initial assessments and initial assessment followups and includes onsite and desktop assessments,,,0.4204005104808573,,,,,,,,,,,,,,,,
1922,the number of audits in factories manufacturing goods for licensees was reduced from  in   to  i n  reflecting a reduction in the number of licensee suppliers.    number of audits by region and type                     region   initial assessment  performance audit  environmental assessment  total                           asia                    americas                  emea                  total                                     every new manufacturing facility has to pass an initial assessment to prove compliance with the adidas workplace standards before an order is placed.  the data shown includes both initial assessments and initial assessment followups and includes onsite and desktop assessments.    audits conducted in approved factories that have passed the initial assessment including onsite and desktop assessments,,,0.4458215660058791,,,,,,,,,,,,,,,,
1924,the data shown includes both initial assessments and initial assessment followups and includes onsite and desktop assessments.    audits conducted in approved factories that have passed the initial assessment including onsite and desktop assessments.  as of  audits under the slcp and better work programs are included.    includes environmental assessments and wastewater test assessments according to the zdhc wastewater guidelines,,0.355817404006054,0.4231522539445174,,0.4705467812896189,,,,,,,,,,,,,,
1925,audits conducted in approved factories that have passed the initial assessment including onsite and desktop assessments.  as of  audits under the slcp and better work programs are included.    includes environmental assessments and wastewater test assessments according to the zdhc wastewater guidelines.    includes audits done in licensee factories,,0.3515664887963296,0.4448498782891009,,0.4335435755324983,,,,,,,,,,,,,,
1926,as of  audits under the slcp and better work programs are included.    includes environmental assessments and wastewater test assessments according to the zdhc wastewater guidelines.    includes audits done in licensee factories.   to complement our broader sustainability efforts we monitor our suppliers to ensure compliance with our environmental standards and guidelines and to validate their performance against annual environmental targets,,0.338283173097874,,,0.4334434556313046,,,,,,,,,,,,,,
1927,includes environmental assessments and wastewater test assessments according to the zdhc wastewater guidelines.    includes audits done in licensee factories.   to complement our broader sustainability efforts we monitor our suppliers to ensure compliance with our environmental standards and guidelines and to validate their performance against annual environmental targets.  in   facilities in  countries were assessed and evaluated for their environmental performance which represented  of our key tier  and tier  manufacturing partners and selected       to  o ur sha reho l ders  gro up  man a gemen t rep o rt  o ur co mpa n y  gro up  man a gemen t rep o rt  fin a n cial  review  co n so l ida ted fin an cia l  sta temen ts  a ddition a l in fo rma tion            a n n u a l  r e p o r t       tier  suppliers enrolled in our sourcing sustainability program,,0.3433162554674852,0.4427725129842624,,0.5080970791250461,,,,,,,,,,,,,,
1928,includes audits done in licensee factories.   to complement our broader sustainability efforts we monitor our suppliers to ensure compliance with our environmental standards and guidelines and to validate their performance against annual environmental targets.  in   facilities in  countries were assessed and evaluated for their environmental performance which represented  of our key tier  and tier  manufacturing partners and selected       to  o ur sha reho l ders  gro up  man a gemen t rep o rt  o ur co mpa n y  gro up  man a gemen t rep o rt  fin a n cial  review  co n so l ida ted fin an cia l  sta temen ts  a ddition a l in fo rma tion            a n n u a l  r e p o r t       tier  suppliers enrolled in our sourcing sustainability program.  in additi on a total of  wastewater test assessments were conducted according to the zdhc wastewater guidelines,,,0.444897016043518,,0.4625419252986559,,,,,,,,,,,,,,
1929,to complement our broader sustainability efforts we monitor our suppliers to ensure compliance with our environmental standards and guidelines and to validate their performance against annual environmental targets.  in   facilities in  countries were assessed and evaluated for their environmental performance which represented  of our key tier  and tier  manufacturing partners and selected       to  o ur sha reho l ders  gro up  man a gemen t rep o rt  o ur co mpa n y  gro up  man a gemen t rep o rt  fin a n cial  review  co n so l ida ted fin an cia l  sta temen ts  a ddition a l in fo rma tion            a n n u a l  r e p o r t       tier  suppliers enrolled in our sourcing sustainability program.  in additi on a total of  wastewater test assessments were conducted according to the zdhc wastewater guidelines.    as we continue to increase our focus on addedvalue advisory services and empowerment projects which go beyond our regular audit routine the numbe r of internally managed audits decreased to  in    with    assessments of all assessments performed by thirdparty monitors,,,,,0.4566928175355579,,,,,,,,,,,,,,
1930,in   facilities in  countries were assessed and evaluated for their environmental performance which represented  of our key tier  and tier  manufacturing partners and selected       to  o ur sha reho l ders  gro up  man a gemen t rep o rt  o ur co mpa n y  gro up  man a gemen t rep o rt  fin a n cial  review  co n so l ida ted fin an cia l  sta temen ts  a ddition a l in fo rma tion            a n n u a l  r e p o r t       tier  suppliers enrolled in our sourcing sustainability program.  in additi on a total of  wastewater test assessments were conducted according to the zdhc wastewater guidelines.    as we continue to increase our focus on addedvalue advisory services and empowerment projects which go beyond our regular audit routine the numbe r of internally managed audits decreased to  in    with    assessments of all assessments performed by thirdparty monitors  .   a total of    of all direct and licensee facilities were audited in,,,,,0.4888252328071196,,,,,,,,,,,,,,
1941,in total the skpi has  units of measures uom.  these include compliance with threshold and zerotolerance issues  completion of remediation plans accident and absenteeism rates as well as a range of worker empowerment measures such as resolution and satisfaction rate of workers grievances participation rate in worker satisfaction surveys and the ratio of females  in midmanagerial positions.  the skpi assesses a factorys performance in each of the uoms based on the information gathered and where applicable validated during social compliance audits which are uploaded to a dashboard for each supplier.  the result is a final score in  which is converted to srating levels from  with s being the best,,,,,,,,,,,,,,,,0.3507856516999693,,,
1942,these include compliance with threshold and zerotolerance issues  completion of remediation plans accident and absenteeism rates as well as a range of worker empowerment measures such as resolution and satisfaction rate of workers grievances participation rate in worker satisfaction surveys and the ratio of females  in midmanagerial positions.  the skpi assesses a factorys performance in each of the uoms based on the information gathered and where applicable validated during social compliance audits which are uploaded to a dashboard for each supplier.  the result is a final score in  which is converted to srating levels from  with s being the best.  the thresholds are set as follows s  s  s  s  s,,,,,,,,,,,,,,,,0.3710045935470027,,,
1943,the skpi assesses a factorys performance in each of the uoms based on the information gathered and where applicable validated during social compliance audits which are uploaded to a dashboard for each supplier.  the result is a final score in  which is converted to srating levels from  with s being the best.  the thresholds are set as follows s  s  s  s  s .   for suppliers that have achieved a skpi of s  we reserve the possibility to exclude  them from selected  skpi compliance measurements for one year  due to their low risk profile,,,,,,,,,,,,,,,,0.3476628597259202,,,
1944,the result is a final score in  which is converted to srating levels from  with s being the best.  the thresholds are set as follows s  s  s  s  s .   for suppliers that have achieved a skpi of s  we reserve the possibility to exclude  them from selected  skpi compliance measurements for one year  due to their low risk profile .    in  almost   of our  key manufacturing facilities achieved a rating of s or better which is a significant impr ovement compared to,,,,,,,,,,,,,,,,0.3113002515866443,,,
1948,we see a positive trend with almost all of the higherperforming manufacturing facilities s or s in  maintaining or improving their skpi rating in .  with this performance we are confident that we will meet the   target for the upper performance band for our suppliers and now expect  of our strategic tier  suppliers to achieve a minimum of s or better by .     including social and environmental assessments excluding zdhc wastewater  assessments .         to  o ur sha reho l ders  gro up  man a gemen t rep o rt  o ur co mpa n y  gro up  man a gemen t rep o rt  fin a n cial  review  co n so l ida ted fin an cia l  sta temen ts  a ddition a l in fo rma tion            a n n u a l  r e p o r t       social impact performance rating of strategic supplier factories by skpi in    all of our ke y licensees i,,,0.4168662689944623,,,,,,,,,,,,,,,,
1954,this rating reflects that these licensees have succes sfully demonstrated that they have embedded strong governance systems supply chain management and purchasing practices compliance requirements into their business practices.  licensees are also assessed on the existence of policies and systems to address stakeholder engagement as well as levels of public reporting and communication.   noncompliances identified in active factories   our manufacturing partners facilities are evaluated against a number of critical compliance issues.  while threshold issues are considered serious but correctable noncompliances that can be addressed through remedial action within a specified timeframe zerotolerance issues  such as forced labor  child labor practices  or critical lifethreatening health safety and environ ment conditions  immediately trigger a warning and potential disqualification of a supplier,,,,,,,0.4613959400500507,,,,,,,,,,,,
1956,noncompliances identified in active factories   our manufacturing partners facilities are evaluated against a number of critical compliance issues.  while threshold issues are considered serious but correctable noncompliances that can be addressed through remedial action within a specified timeframe zerotolerance issues  such as forced labor  child labor practices  or critical lifethreatening health safety and environ ment conditions  immediately trigger a warning and potential disqualification of a supplier.  during the course of each year we continuously track noncompliances identified through manufacturing partners performance audits collaboration audits selfgovernance assessments and since  slcp assessments.  we follow up on all noncompliance and require our manufacturing partners to remediate these findings within a specified timeframe,,,0.4220374892465913,,,,,,,,,,,,,,,,
1958,during the course of each year we continuously track noncompliances identified through manufacturing partners performance audits collaboration audits selfgovernance assessments and since  slcp assessments.  we follow up on all noncompliance and require our manufacturing partners to remediate these findings within a specified timeframe.  the identified issues in  remained largely the same  as those re ported in .    labor  besides identifying noncompliance with the workplace standards our social compliance team focuses on the use and effectiveness of the facilities hr management systems including any gaps in policies and procedures related to specific risk areas such a s forced labor child labor freedom of association or discrimination,,,,,,,,,,,,,,,,,0.3186532392785434,,
