,Sentences,"Scores_a_AGRICULTURE, FORESTRY AND FISHING",Scores_b_MINING AND QUARRYING,Scores_c_MANUFACTURING,"Scores_d_ELECTRICITY, GAS, STEAM AND AIR CONDITIONING SUPPLY","Scores_e_WATER SUPPLY; SEWERAGE, WASTE MANAGEMENT AND REMEDIATION ACTIVITIES",Scores_f_CONSTRUCTION,Scores_g_WHOLESALE AND RETAIL TRADE; REPAIR OF MOTOR VEHICLES AND MOTORCYCLES,Scores_h_TRANSPORTATION AND STORAGE,Scores_i_ACCOMMODATION AND FOOD SERVICE ACTIVITIES,Scores_j_INFORMATION AND COMMUNICATION,Scores_k_FINANCIAL AND INSURANCE ACTIVITIES,Scores_l_REAL ESTATE ACTIVITIES,"Scores_m_PROFESSIONAL, SCIENTIFIC AND TECHNICAL ACTIVITIES",Scores_n_ADMINISTRATIVE AND SUPPORT SERVICE ACTIVITIES,Scores_o_PUBLIC ADMINISTRATION AND DEFENCE; COMPULSORY SOCIAL SECURITY,Scores_p_EDUCATION,Scores_q_HUMAN HEALTH AND SOCIAL WORK ACTIVITIES,"Scores_r_ARTS, ENTERTAINMENT AND RECREATION",Scores_s_OTHER SERVICE ACTIVITIES
39,n. a.  balance sheet and cash flow data  in millions        total assets           inventories           receivables and other  current assets           operating working capital           shareholders equity           capital expenditure         net cash generated fromused in operating activities        n. a,,,,0.3662700200647707,,,,0.394410786411576,,,,,,,,,,,
40,a.  balance sheet and cash flow data  in millions        total assets           inventories           receivables and other  current assets           operating working capital           shareholders equity           capital expenditure         net cash generated fromused in operating activities        n. a.  per share of common stock         basic earnings,,,,,,,,,,0.3476986243038067,,,,,,,,,
48,.    n. a.  net cash generated fromused in operating activities,0.3525669877515989,,,0.3852152464492411,,,,,,,,,,,0.365199860299741,,,,
49,n. a.  net cash generated fromused in operating activities  .,0.3616184329517435,,,0.3879836756678678,,,,,,,,,,,0.3748864358844291,,,,
50,a.  net cash generated fromused in operating activities  .    .    n,0.3801809259708049,,,0.4059321270334946,,,,,,,,,,,0.3632165596349325,,,,
51,net cash generated fromused in operating activities  .    .    n. a,0.3604333106893143,,,0.3550285996483388,,,,,,,,,,,0.3843761839912262,,,,
74,these are parts of the nonfinancial statement that are covered by a separate reasonable assurance engagement.     these are parts of the nonfinancial statement that are  covered by a separate limited assurance engagement.   term underlined in blue  there is a detailed definition of this term in the glossary.   independent assurance  the consolidated financial statements prepared by adidas ag including the statement of financial position income statement statement of comprehensive income statement of changes in equity statement of cash flows and the notes as well as the group management report  have been audited by pricewaterhousecoopers gmbh wirtschaftsprüfungsgesellschaft pwc,,,,,,,,,,,,,,,0.3661396089735093,,,,
75,these are parts of the nonfinancial statement that are  covered by a separate limited assurance engagement.   term underlined in blue  there is a detailed definition of this term in the glossary.   independent assurance  the consolidated financial statements prepared by adidas ag including the statement of financial position income statement statement of comprehensive income statement of changes in equity statement of cash flows and the notes as well as the group management report  have been audited by pricewaterhousecoopers gmbh wirtschaftsprüfungsgesellschaft pwc .   see copy of the auditors report  in addition this report contains a combined nonfinancial statement for adidas ag and the group,,,,,,,,,,,,,,,0.3669579803791383,,,,
123,i think if you look at the different categories then in the lifestyle area its obvious that we have been very classicdriven.  we have bee n very strong on the courtside which is terrace and now also campus.  what i tried to do is to scale that at the right speed at the right time to build and keep the heat.  we continue to do collabs and limited editions on all the franchises but at the same  time we also make sure that we increase production and give the retailers more of the products that work,,,,,,,,,,,,,,,,,,0.3107211140690801,
124,we have bee n very strong on the courtside which is terrace and now also campus.  what i tried to do is to scale that at the right speed at the right time to build and keep the heat.  we continue to do collabs and limited editions on all the franchises but at the same  time we also make sure that we increase production and give the retailers more of the products that work.  and then we do takedowns of the trends that are happening on the more commercial side,,,,,,,,,,,,,,,,,,0.2611315658682955,
126,we continue to do collabs and limited editions on all the franchises but at the same  time we also make sure that we increase production and give the retailers more of the products that work.  and then we do takedowns of the trends that are happening on the more commercial side.  we are doing this on the courtside and now we have started to  do the same in running  lifestyle .  sl and country are two shoes coming out of our archive that we saw potential in,,,,,,,,,,,,,,,,,,0.2717339075317765,
127,and then we do takedowns of the trends that are happening on the more commercial side.  we are doing this on the courtside and now we have started to  do the same in running  lifestyle .  sl and country are two shoes coming out of our archive that we saw potential in.  sl is also a terrace shoe but in an old running style,,,,,,,,,,,,,,,,,,0.318008347980712,
132,and then on top of what we do on the classic side  because of the lack of newness in running lifestyle we have initiated many projects when it gets to completely new silhouettes.  many of those are seeded into the market as we speak.  the goal is that we will have new running silhouettes in the lifestyle area that the market has never seen before at the back end of this year to be scaled in  and beyond.    how about the performance side of the business  here we also looked at what kind of products do we have in the different categories that are ready to go,,,,,,,,,,,,,,,,,,0.3130542837524301,
133,many of those are seeded into the market as we speak.  the goal is that we will have new running silhouettes in the lifestyle area that the market has never seen before at the back end of this year to be scaled in  and beyond.    how about the performance side of the business  here we also looked at what kind of products do we have in the different categories that are ready to go.  and we have accelerated quite a few of them,,,,,,,,,,,,,,,,,,0.3341374341092862,
179,this year will be a year of sports with the uefa e uro   and the copa amrica in football the olympic and paralympic games in paris all taking place this summer.  how important are these events for the adidas business  they all play a little bit of a different role but what they have in common is that aft er years of covid and difficult circumstances for big events with no spectators or limited access its the first year again where everything is largely back to normal.  i think both athletes and spectators are looking forward to participating in big events  and to celebrating sports and being together again.  the summer of sport starts with the uefa e uro  in our home market germany which of course is very special,,,,,,,,,,,,,,,,,,0.2628003420510273,
180,how important are these events for the adidas business  they all play a little bit of a different role but what they have in common is that aft er years of covid and difficult circumstances for big events with no spectators or limited access its the first year again where everything is largely back to normal.  i think both athletes and spectators are looking forward to participating in big events  and to celebrating sports and being together again.  the summer of sport starts with the uefa e uro  in our home market germany which of course is very special.  we all remember the fantastic atmosphere of the football world cup  in germany and i think  we will see the same again this year,,,,,,,,,,,,,,,,,,0.2838589268817829,
181,i think both athletes and spectators are looking forward to participating in big events  and to celebrating sports and being together again.  the summer of sport starts with the uefa e uro  in our home market germany which of course is very special.  we all remember the fantastic atmosphere of the football world cup  in germany and i think  we will see the same again this year.  it will be a very important event not only for sports but for peoples mindset in general,,,,,,,,,,,,,,,,,,0.2781531237900477,
182,the summer of sport starts with the uefa e uro  in our home market germany which of course is very special.  we all remember the fantastic atmosphere of the football world cup  in germany and i think  we will see the same again this year.  it will be a very important event not only for sports but for peoples mindset in general.  for us both the e uro  and the copa also have a business impact because we sell replicas of the different teams licensed pr oducts and the official match ball for the e uro  fussballliebe,,,,,,,,,,,,,,,,,,0.3105865094999458,
183,we all remember the fantastic atmosphere of the football world cup  in germany and i think  we will see the same again this year.  it will be a very important event not only for sports but for peoples mindset in general.  for us both the e uro  and the copa also have a business impact because we sell replicas of the different teams licensed pr oducts and the official match ball for the e uro  fussballliebe.   the olympics and paralympics are different because they are not necessarily commercial events where we sell a lot of products directly related to them,,,,,,,,,,,,,,,,,,0.3443046637796673,
184,it will be a very important event not only for sports but for peoples mindset in general.  for us both the e uro  and the copa also have a business impact because we sell replicas of the different teams licensed pr oducts and the official match ball for the e uro  fussballliebe.   the olympics and paralympics are different because they are not necessarily commercial events where we sell a lot of products directly related to them.  but the olympics and paralympics both create global and local heroes,,,,,,,,,,,,,,,,,,0.2650546605755671,
185,for us both the e uro  and the copa also have a business impact because we sell replicas of the different teams licensed pr oducts and the official match ball for the e uro  fussballliebe.   the olympics and paralympics are different because they are not necessarily commercial events where we sell a lot of products directly related to them.  but the olympics and paralympics both create global and local heroes.  and they make sport play a bigger role in peoples life all over the world,,,,,,,,,,,,,,,,,,0.3252275459553493,
190,it is really good for us that these sports events all happen in  because that fits perfectly with our plan to be the best sports brand again.  it is also perfect timing with the product pipeline and the plans we have for  and beyond.      you are a big sports fan.  which sports event are you personally looking forward to the most   i look forward to all sports events,,,,,,,,,,,,,,,,,,0.3015887632421953,
192,you are a big sports fan.  which sports event are you personally looking forward to the most   i look forward to all sports events.  it doesnt matter what it is.  if its a bundesliga game or if its a nat ional championship a college tournament or the olympics i dont really separate between the events,,,,,,,,,,,,,,,,,,0.2969232697875513,
193,which sports event are you personally looking forward to the most   i look forward to all sports events.  it doesnt matter what it is.  if its a bundesliga game or if its a nat ional championship a college tournament or the olympics i dont really separate between the events.  i love to see and do sports,,,,,,,,,,,,,,,,,,0.2714599658009166,
195,if its a bundesliga game or if its a nat ional championship a college tournament or the olympics i dont really separate between the events.  i love to see and do sports.  its my life and my job.  there are so many good events and to be honest with you there       to  o ur sha reho l ders  gro up  man a gemen t rep o rt   o ur co mpa n y  gro up  man a gemen t rep o rt  fin a n cial  review  co n so l ida ted fin an cia l sta t emen ts  a ddition a l in fo rma tion            a n n u a l  r e p o r t        are good events almost every day in s ome kind of sport somewhere in the world,,,,,,,,,,,,,,,,,,0.3236192433663959,
196,i love to see and do sports.  its my life and my job.  there are so many good events and to be honest with you there       to  o ur sha reho l ders  gro up  man a gemen t rep o rt   o ur co mpa n y  gro up  man a gemen t rep o rt  fin a n cial  review  co n so l ida ted fin an cia l sta t emen ts  a ddition a l in fo rma tion            a n n u a l  r e p o r t        are good events almost every day in s ome kind of sport somewhere in the world.  so theres enough to look forward to and it would be kind of unfair to only pick one,,,,,,,,,,,,,,,,,,0.2977822235499822,
293,a.  global it global operations global legal and global workplaces.  in  she became senior  vice president workplaces  hr global functions .  as of   michelle additionally took over the global covid crisis management lead and between  and  she also acted as hr business partner for global brands,,,,,,,,,,,,,,,,,0.3001967095335028,,
295,in  she became senior  vice president workplaces  hr global functions .  as of   michelle additionally took over the global covid crisis management lead and between  and  she also acted as hr business partner for global brands.  from mid she led the companys global human resources organization as head of global hr.  in  michelle was appointed to the executive board and is responsible for global human resources people and culture,,,,,,,,,,,,,,,,,0.3061406519645084,,
351,we critically examined and scrutinized the information provided by the executive board .        to  o ur sha reho l ders  gro up  man a gemen t rep o rt   o ur co mpa n y  gro up  man a gemen t rep o rt  fin a n cial  review  co n so l ida ted fin an cia l sta t emen ts  a ddition a l in fo rma tion            a n n u a l  r e p o r t        meetings of the supervisory board and its co mmittees  in the past financial year the supervisory board primarily exercised its duties in plenary meetings.  members who were unable to participate in the meetings took part in the resolutions by submitting their votes in writing.  in the year under revie w the meetings of the supervisory board and its committees took place both as physical and virtual meetings,,,,,,,,,,,,,,,0.3699041912598349,,,,
352,to  o ur sha reho l ders  gro up  man a gemen t rep o rt   o ur co mpa n y  gro up  man a gemen t rep o rt  fin a n cial  review  co n so l ida ted fin an cia l sta t emen ts  a ddition a l in fo rma tion            a n n u a l  r e p o r t        meetings of the supervisory board and its co mmittees  in the past financial year the supervisory board primarily exercised its duties in plenary meetings.  members who were unable to participate in the meetings took part in the resolutions by submitting their votes in writing.  in the year under revie w the meetings of the supervisory board and its committees took place both as physical and virtual meetings.  the latest videoconferencing technology was used to ensure an open and appropriate discussion between the executive board and the supervisory boar d within the virtual meeting s,,,,,,,,,,0.3487469708493628,,,,,,,,,
359,in addition the chairman of the supervisory board and as applicable the entire supervisory board were informed about events of fundamental importance for evaluating the situation development and management of the c ompany if required also at short notice.  the chairman of the supervisory board regularly reported during meetings on discussions with the executive board outside the supervisory board meetings .  the supervisory board also convened regularly without the ex ecutive board members in particular to discuss internal affairs of the supervisory board as well as personnel and compensation matters relating to the executive board.   the audit committee also followed recommendation d,,,,,,,,,,,,,,,0.3643742039462052,,,,
370,the growing importance of esg  environmental social governance  topics and their regulation were further regular topics of discussion at the supervisory board meetings.  moreover the executive board informed us about the current status and the developments of the human resources organization.  as regards per sonnel matters the extension of harm ohlmeyers appointment the resignation s of roland auschel brian grevy and amanda rajkumar from the executive board and the appointment s of arthur hoeld and michelle robertson to the executive board were the main su bjects of consultation.   due to statutory regulations or the rules of procedure certain transactions and measures of the executive board require the approval of the supervisory board,,0.3546021230313609,,,,,,,,,,,,,,,,,
371,moreover the executive board informed us about the current status and the developments of the human resources organization.  as regards per sonnel matters the extension of harm ohlmeyers appointment the resignation s of roland auschel brian grevy and amanda rajkumar from the executive board and the appointment s of arthur hoeld and michelle robertson to the executive board were the main su bjects of consultation.   due to statutory regulations or the rules of procedure certain transactions and measures of the executive board require the approval of the supervisory board.  the supervisory board discussed transactions requiring its approval as t hey arose and gave its approval to resolution items after thorough reviews in some cases based on preparations by the relevant committees,,0.3480984024000642,,,,,,,,,,,,,0.4646167544814696,0.4051591411521173,0.3401151890534257,,
372,as regards per sonnel matters the extension of harm ohlmeyers appointment the resignation s of roland auschel brian grevy and amanda rajkumar from the executive board and the appointment s of arthur hoeld and michelle robertson to the executive board were the main su bjects of consultation.   due to statutory regulations or the rules of procedure certain transactions and measures of the executive board require the approval of the supervisory board.  the supervisory board discussed transactions requiring its approval as t hey arose and gave its approval to resolution items after thorough reviews in some cases based on preparations by the relevant committees.  in addition the supervisory board regularly conferred on personnel and compensation matters concerning the executiv e board as       to  o ur sha reho l ders  gro up  man a gemen t rep o rt   o ur co mpa n y  gro up  man a gemen t rep o rt  fin a n cial  review  co n so l ida ted fin an cia l sta t emen ts  a ddition a l in fo rma tion            a n n u a l  r e p o r t        well as questions of corporate governance,,,,,,,,,,0.3589515921898562,,,,,0.448884830663886,0.3614146793122451,,,
418,we also discussed the fulfillment of the statutory gender quota in the supervisory board stipulated in   section  sentences   and  aktg.  in view of the supe rvisory board election at the  annual general meeting both the shareholder representatives and the employee representatives resolved in accordance with   section  sentence  aktg that the minimum quota of  women and  men on the supervisory b oard has to be fulfilled separately for the shareholder representatives and the employee representatives .  at the december meeting we focused on the preliminary budget and investment plan for the  financial year as presented by the executive board whi ch we approved after thorough deliberation as well as on the marketing and sponsorship agreements concluded in the year under review.  after a thorough review we approved the final budget and investment plan presented to us for resolution in february,,,,,,,,,,,,,,,,0.3153386632369185,,,
424,a further agenda item was the review of the objectives of the supervisory board regard ing its composition including the competency profile.  we also conferred on the upcoming supervisory board election in  and thoroughly discussed the horizontal comparison of the executive board compensation conducted by an external compensation consul tant.  based on this comparison the executive board compensation was assessed to be appropriate.  the supervisory board also discussed the current       to  o ur sha reho l ders  gro up  man a gemen t rep o rt   o ur co mpa n y  gro up  man a gemen t rep o rt  fin a n cial  review  co n so l ida ted fin an cia l sta t emen ts  a ddition a l in fo rma tion            a n n u a l  r e p o r t        implementation status of the proposed measures of improvement resulting from the selfassessment conducted in the   financial year efficiency examination,,,,,,,,,,,,,,,,0.3314019977380901,,,
427,the supervisory board also discussed the current       to  o ur sha reho l ders  gro up  man a gemen t rep o rt   o ur co mpa n y  gro up  man a gemen t rep o rt  fin a n cial  review  co n so l ida ted fin an cia l sta t emen ts  a ddition a l in fo rma tion            a n n u a l  r e p o r t        implementation status of the proposed measures of improvement resulting from the selfassessment conducted in the   financial year efficiency examination.  finally upon the general committees recommendation we resolved to appoint michelle robertson as a member of the executive board responsible for global human resources people and culture effective janu ary   .  tasks and topics for the commit tees in order to perform our tasks in an efficient manner we have established a total of five standing supervisory board committees.  the committees prepare resolutions and topics for the meetings of the entire s upervisory board,,,,,,,,,,,,,,,,0.3072346235299723,,,
428,finally upon the general committees recommendation we resolved to appoint michelle robertson as a member of the executive board responsible for global human resources people and culture effective janu ary   .  tasks and topics for the commit tees in order to perform our tasks in an efficient manner we have established a total of five standing supervisory board committees.  the committees prepare resolutions and topics for the meetings of the entire s upervisory board.  within the legally permissible framework and in appropriate cases we have furthermore delegated the supervisory boards authority to pass certain resolutions to individual committees,,,,,,,,,,,,,,,0.3753428668154397,,0.3150399139181969,,
429,tasks and topics for the commit tees in order to perform our tasks in an efficient manner we have established a total of five standing supervisory board committees.  the committees prepare resolutions and topics for the meetings of the entire s upervisory board.  within the legally permissible framework and in appropriate cases we have furthermore delegated the supervisory boards authority to pass certain resolutions to individual committees.  with the exception of the audit committee the chairm an of the supervisory board also chairs all the standing committees,,0.3476231169946847,,,,,,,,0.37684058365252,,,0.4375157690333861,,0.3868401183458314,0.3493314625303978,0.3269533879020009,,
430,the committees prepare resolutions and topics for the meetings of the entire s upervisory board.  within the legally permissible framework and in appropriate cases we have furthermore delegated the supervisory boards authority to pass certain resolutions to individual committees.  with the exception of the audit committee the chairm an of the supervisory board also chairs all the standing committees.  the respective committee chairmen report to the supervisory board on their work as well as the content and results of the committee meetings on a regular and comprehensive basis,,0.3461401119007674,,,,,,,,0.3674878880263943,,,,,0.4193183780796802,0.346797052655599,0.2943677451647528,,
431,within the legally permissible framework and in appropriate cases we have furthermore delegated the supervisory boards authority to pass certain resolutions to individual committees.  with the exception of the audit committee the chairm an of the supervisory board also chairs all the standing committees.  the respective committee chairmen report to the supervisory board on their work as well as the content and results of the committee meetings on a regular and comprehensive basis .  the stee ring committee  did not meet in the year under review,,0.333020725035736,,,,,,,,,,,,,0.3910325141395383,,,,
433,the respective committee chairmen report to the supervisory board on their work as well as the content and results of the committee meetings on a regular and comprehensive basis .  the stee ring committee  did not meet in the year under review.   the general committee  held six meetings in the year under review    six meetings.  the main task of the general committee was to prepare resolutions for the entire supervisory board on personnel and compensation matters of the executive board,,0.3343953713845012,,,,,,,,,,,,,,,,,
