4501,a.                        financial liabilities per level                          thereof aggregated by category according to ifrs                         financial assets at fair value through profit or loss fvtpl                         financial assets at fair value through other comprehensive income  fvoci                        thereof equity investments without recycling to profit and loss                        financial assets at amortized cost ac                          financial liabilities at fair value through profit or loss fvtpl                        financial liabilities at amortized cost ac                                                 level  is based on quoted prices in active markets for identical assets or liabilities.   level  is based on inputs other than quoted prices included within level  that are observable for the assets or liabilities  either directly i. e,,,,,,,,,,,,,,,,0.3425775789175511,,,
4502,financial liabilities per level                          thereof aggregated by category according to ifrs                         financial assets at fair value through profit or loss fvtpl                         financial assets at fair value through other comprehensive income  fvoci                        thereof equity investments without recycling to profit and loss                        financial assets at amortized cost ac                          financial liabilities at fair value through profit or loss fvtpl                        financial liabilities at amortized cost ac                                                 level  is based on quoted prices in active markets for identical assets or liabilities.   level  is based on inputs other than quoted prices included within level  that are observable for the assets or liabilities  either directly i. e.  as prices or indirectly i,,,,,,,,,,,,,,,,0.3351846585312301,,,
4503,level  is based on inputs other than quoted prices included within level  that are observable for the assets or liabilities  either directly i. e.  as prices or indirectly i. e,,,,0.3608642879875243,,,,,,,,,,,,,,,
4505,as prices or indirectly i. e.  derived from prices.   level  is based on inputs for the assets or liabilities that are not based on observable market data unobservable inputs,,,,0.3549496683769235,,,,,,,,,,,,,,,
4510,additions   dis posals   gains   losses   gains   losses   transfers   currency translation   fair value dec.      investments in other equity instruments held for trading fahft                      investments in other equity instruments fvtpl                      investments in other equity instruments fvoci                      earnout components assets                           reconciliation of fair value hierarchy level  in    in millions                               realized   unrealized          fair value jan.       additions   dis posals   gains   losses   gains   losses   transfers   currency translation   fair value dec.      investments in other equity instruments held for trading fahft                      investments in other equity instruments fvtpl                      investments in other equity instruments fvoci                      promissory notes fvtpl                      earnout components assets                          due to the shortterm maturities of cash and cash equivalents shortterm financial assets and accounts receivable and payable  as well as other current financial receivables and payables their respective fair values equal their carrying amount,,,,,,,0.4629495873075601,,,,0.4862485006268105,,,,,,,,
4511,investments in other equity instruments held for trading fahft                      investments in other equity instruments fvtpl                      investments in other equity instruments fvoci                      earnout components assets                           reconciliation of fair value hierarchy level  in    in millions                               realized   unrealized          fair value jan.       additions   dis posals   gains   losses   gains   losses   transfers   currency translation   fair value dec.      investments in other equity instruments held for trading fahft                      investments in other equity instruments fvtpl                      investments in other equity instruments fvoci                      promissory notes fvtpl                      earnout components assets                          due to the shortterm maturities of cash and cash equivalents shortterm financial assets and accounts receivable and payable  as well as other current financial receivables and payables their respective fair values equal their carrying amount.   the fair values of noncurrent financial assets and liabilities are estimated by discounting expected future cash flows using current i nterest rates for debt of similar terms and remaining maturities and adjusted by a companyspecific credit risk premium  or measured at market prices,,,,,,,,,,,0.5277280039076178,,,,,,,,
4512,additions   dis posals   gains   losses   gains   losses   transfers   currency translation   fair value dec.      investments in other equity instruments held for trading fahft                      investments in other equity instruments fvtpl                      investments in other equity instruments fvoci                      promissory notes fvtpl                      earnout components assets                          due to the shortterm maturities of cash and cash equivalents shortterm financial assets and accounts receivable and payable  as well as other current financial receivables and payables their respective fair values equal their carrying amount.   the fair values of noncurrent financial assets and liabilities are estimated by discounting expected future cash flows using current i nterest rates for debt of similar terms and remaining maturities and adjusted by a companyspecific credit risk premium  or measured at market prices .  fair values of longterm financial assets are based on quoted market prices in an active market or are calculated as present values of expected future cash flows,,,,,,,,,,,0.5193428937094684,,,,,,,,
4513,investments in other equity instruments held for trading fahft                      investments in other equity instruments fvtpl                      investments in other equity instruments fvoci                      promissory notes fvtpl                      earnout components assets                          due to the shortterm maturities of cash and cash equivalents shortterm financial assets and accounts receivable and payable  as well as other current financial receivables and payables their respective fair values equal their carrying amount.   the fair values of noncurrent financial assets and liabilities are estimated by discounting expected future cash flows using current i nterest rates for debt of similar terms and remaining maturities and adjusted by a companyspecific credit risk premium  or measured at market prices .  fair values of longterm financial assets are based on quoted market prices in an active market or are calculated as present values of expected future cash flows.   adidas designated certain investments as equity securities at fair value through other comprehensive income equity because the company intends to hold those investments for the long term in order to gain       to  o ur sha reho l ders  gro up  man a gemen t rep o rt  o ur co mpa n y  gro up  man a gemen t rep o rt  fin a n cial  review  co n so l ida ted fin an cia l  sta temen ts  a ddition a l in fo rma tion            a n n u a l  r e p o r t       insights into innovative production technologies and trends,,,,,,,,,,,0.4702302805361577,,,,,,,,
4518,in accordance with ifrs   the follow ing tables show the valuation methods used in measuring level   level   and level   fair values as well as the significant unobservable inputs used.   no reclassifcations between hierachy levels were made in .  a review of the hierachy levels is carrie d out regularly  by adidas.    financial instruments level  measured at fair value         type   valuation method   significant unobservable inputs   category  convertible bond   the fair value is based on the market price of the convertible bond on the balance sheet date,,,,,,,,,,,,,,,,0.3716862616246377,,,
4519,no reclassifcations between hierachy levels were made in .  a review of the hierachy levels is carrie d out regularly  by adidas.    financial instruments level  measured at fair value         type   valuation method   significant unobservable inputs   category  convertible bond   the fair value is based on the market price of the convertible bond on the balance sheet date.    not applicable   amortized cost  eurobond   the fair value is based on the market price of the eurobond on the balance sheet date,,,,,,,,,,,,,,,,0.3820966090483406,,,
4520,a review of the hierachy levels is carrie d out regularly  by adidas.    financial instruments level  measured at fair value         type   valuation method   significant unobservable inputs   category  convertible bond   the fair value is based on the market price of the convertible bond on the balance sheet date.    not applicable   amortized cost  eurobond   the fair value is based on the market price of the eurobond on the balance sheet date.    not applicable   amortized cost  other equity investments   the fair value is based on the market price of the investment on the balance sheet date,,,,,,,,,,,,,,,,0.3662409949754346,,,
4553,year ending dec.      financial assets classified at amortized cost ac      financial assets at fair value through profit or loss fvtpl      thereof designated as such upon initial recognition      thereof classified as held for trading      equity instruments at fair value through profit or loss fvtpl      equity instruments at fair value through other comprehensive income fvoci      financial liabilities at amortized cost ac      financial liabilities at fair value through profit or loss fvtpl      thereof designated as such upon initial recognition      thereof classified as held for trading           net gains or losses on financial assets measured at amortized cost comprise mainly impairment losses and reversals.   net gains or losses on financial assets or financial liabilities classified as fair value through profit or loss include the effects from fair value measurements of the derivatives that are not part of a hedging relationship and changes in the fair value of other financial instruments as well as interest expenses.         to  o ur sha reho l ders  gro up  man a gemen t rep o rt  o ur co mpa n y  gro up  man a gemen t rep o rt  fin a n cial  review  co n so l ida ted fin an cia l  sta temen ts  a ddition a l in fo rma tion            a n n u a l  r e p o r t       net gains or losses on equity instruments at fair value through profit or loss mainly include fair value adjustments based on the respective valuation method,,,,,,,,,,,0.4664808105840123,,,,,,,,
4554,financial assets classified at amortized cost ac      financial assets at fair value through profit or loss fvtpl      thereof designated as such upon initial recognition      thereof classified as held for trading      equity instruments at fair value through profit or loss fvtpl      equity instruments at fair value through other comprehensive income fvoci      financial liabilities at amortized cost ac      financial liabilities at fair value through profit or loss fvtpl      thereof designated as such upon initial recognition      thereof classified as held for trading           net gains or losses on financial assets measured at amortized cost comprise mainly impairment losses and reversals.   net gains or losses on financial assets or financial liabilities classified as fair value through profit or loss include the effects from fair value measurements of the derivatives that are not part of a hedging relationship and changes in the fair value of other financial instruments as well as interest expenses.         to  o ur sha reho l ders  gro up  man a gemen t rep o rt  o ur co mpa n y  gro up  man a gemen t rep o rt  fin a n cial  review  co n so l ida ted fin an cia l  sta temen ts  a ddition a l in fo rma tion            a n n u a l  r e p o r t       net gains or losses on equity instruments at fair value through profit or loss mainly include fair value adjustments based on the respective valuation method.    see table financial instruments level  measured at fair value  during   no dividends regarding equity instruments at fair value through other comprehensive income were recognized,,,,,,,,,,,0.4608104802350844,,,,,,,,
4605,other activities to mitigate credit risks include retention of title clauses as well as on a selective basis credit insurance the sale of accounts receivable without recourse and bank guarantees.  further quantitative information on the extent to which credit enhancements mitigate the credit risk of accounts receivable is included in th ese note s.   see note   at the end of   no customer accounted for more than  of accounts receivable.   the treasury department arranges currency commodity  interest rate  and e quity hedges  and invests cash with major banks of a high credit standing throughout the world,,,,,,,,,,,0.4837387316909387,,,,,,,,
4648,future cash outflows arising from financial liabilities that are recognized in the consolidated statement of financial position are presented in the table.   this includes payments to settle obligations from borrowings as well as cash outflows from cashsettled derivatives with negative market values.  financial liabilities that may be settled in advance without penalty are included on the basis of the earliest date of potential repayment.  cash flows for variableinterest liabilities are determined with reference to the conditions at the balance sheet date,,,,,,,,,,,0.4746631965714499,,,,,,,,
4649,this includes payments to settle obligations from borrowings as well as cash outflows from cashsettled derivatives with negative market values.  financial liabilities that may be settled in advance without penalty are included on the basis of the earliest date of potential repayment.  cash flows for variableinterest liabilities are determined with reference to the conditions at the balance sheet date.         to  o ur sha reho l ders  gro up  man a gemen t rep o rt  o ur co mpa n y  gro up  man a gemen t rep o rt  fin a n cial  review  co n so l ida ted fin an cia l  sta temen ts  a ddition a l in fo rma tion            a n n u a l  r e p o r t       future cash outflows   in millions                   up to   year   up to  years   up to  years   up to  years   up to  years   more than  years   total  as at december                   bank borrowings                eurobond                 equityneutral convertible bond                accounts payable                  other financial liabilities                accrued liabilities               derivative financial liabilities                  total                   as at december                   bank borrowings                eurobond                 equityneutral convertible bond                accounts payable                  other financial liabilities                accrued liabilities                derivative financial liabilities                  total                                   including interest payments,,,,,,,,,,,0.4842534151618456,,,,,,,,
4650,financial liabilities that may be settled in advance without penalty are included on the basis of the earliest date of potential repayment.  cash flows for variableinterest liabilities are determined with reference to the conditions at the balance sheet date.         to  o ur sha reho l ders  gro up  man a gemen t rep o rt  o ur co mpa n y  gro up  man a gemen t rep o rt  fin a n cial  review  co n so l ida ted fin an cia l  sta temen ts  a ddition a l in fo rma tion            a n n u a l  r e p o r t       future cash outflows   in millions                   up to   year   up to  years   up to  years   up to  years   up to  years   more than  years   total  as at december                   bank borrowings                eurobond                 equityneutral convertible bond                accounts payable                  other financial liabilities                accrued liabilities               derivative financial liabilities                  total                   as at december                   bank borrowings                eurobond                 equityneutral convertible bond                accounts payable                  other financial liabilities                accrued liabilities                derivative financial liabilities                  total                                   including interest payments.    accrued interest excluded,,,,,,,,,,,0.465517690129743,,,,,,,,
4685,in  a gain of    million was reclassified into the net sales and a loss of    million was reclassified into the cost of sales.   in additi on hedging instruments not designated as hedge accounting in accordance with ifrs  were canceled to minimize the economic risk.           to  o ur sha reho l ders  gro up  man a gemen t rep o rt  o ur co mpa n y  gro up  man a gemen t rep o rt  fin a n cial  review  co n so l ida ted fin an cia l  sta temen ts  a ddition a l in fo rma tion            a n n u a l  r e p o r t       the following table provides a reconciliation by risk category of components of equity and analysis of oci items net of tax resulting from cash flow hedge accounting  changes of reserves by risk category   in millions         hedging reserve   cost of hedging reserve  balance at january           cash flow hedges      changes in fair value      foreign currency risk  sales      foreign currency risk  inventory purchases       foreign currency risk  net foreign investment      amount no longer recognized in oci      foreign currency risk       contracts during the year      amount included in the cost of nonfinancial items      foreign currency risk  inventory purchases      tax on movements of reserves during the year      equity hedges      changes in fair value      amount reclassified to profit or loss      balance at december              changes of reserves by risk category   in millions         hedging reserve   cost of hedging reserve  balance at january           cash flow hedges      changes in fair value      foreign currency risk  sales      foreign currency risk  inventory purchases      foreign currency risk  net foreign investment      amount no longer recognized in oci      foreign currency risk       contracts during the year      amount included in the cost of nonfinancial items      foreign currency risk  inventory purchases      tax on movements on reserves during the year      equity hedges      changes in fair value      amount reclassified to profit or loss      balance at december                  to  o ur sha reho l ders  gro up  man a gemen t rep o rt  o ur co mpa n y  gro up  man a gemen t rep o rt  fin a n cial  review  co n so l ida ted fin an cia l  sta temen ts  a ddition a l in fo rma tion            a n n u a l  r e p o r t       in order to determine the fair values of derivatives that are not publicly traded adidas uses generally accepted quantitative financial models based on market conditions prevailing at the balance sheet date.   notes to the consolidated income statement   other operating income  other operating income consists of the following  other operating income   in millions         year ending dec,,,,,,,0.4643801602164792,,,,,,,,,,,,
4690,income from transitional service agreements      income from release of accrued liabilities and other provisions      gains from disposal of fixed assets      sundry income      other operating income       the decrease in income from transition services agreements relates to contracts with the buyer of the reebok business from .  adidas discontinued these services in .    other operating expenses  expenses are presented by function according to the cost  of sales method in the income statement with the exception of impairment losses net on accounts receivable and contract assets which are disclosed in a separate line item as required by ifrs  financial instruments .  other operating expenses presented  by functions include marketing and pointofsale expenses distribution and selling expenses and general and administration expenses  as well as sundry expenses less any income from government grants if applicable,,,,,,,0.4946609080927897,,0.378127912722351,,,,,0.4245746864538903,,,,,
4692,other operating expenses  expenses are presented by function according to the cost  of sales method in the income statement with the exception of impairment losses net on accounts receivable and contract assets which are disclosed in a separate line item as required by ifrs  financial instruments .  other operating expenses presented  by functions include marketing and pointofsale expenses distribution and selling expenses and general and administration expenses  as well as sundry expenses less any income from government grants if applicable.   marketing and pointofsale expenses consist of promotion and communication spending such as promotion contracts advertising events  and other communication activities.  however they do not include marketing overhead expenses which are presented in distribution and selling expenses,,,,,,,0.4970120484035077,0.4377951513305226,0.4093831248108387,0.3843754285449456,0.4617694694727949,0.3780646719693782,,0.484393067095978,,,,0.2853946524517982,
4693,other operating expenses presented  by functions include marketing and pointofsale expenses distribution and selling expenses and general and administration expenses  as well as sundry expenses less any income from government grants if applicable.   marketing and pointofsale expenses consist of promotion and communication spending such as promotion contracts advertising events  and other communication activities.  however they do not include marketing overhead expenses which are presented in distribution and selling expenses.   the di stribution and selling expenses consist of sales force and sales administration costs direct and indirect supply chain costs  and marketing overhead expenses as well as expenses for research and development which amounted to    million in      million,,,,,,0.3751702218947824,,0.4209175197448753,0.3662281006760132,0.3978733664026199,,,,0.4580703471622548,,,,,
4694,marketing and pointofsale expenses consist of promotion and communication spending such as promotion contracts advertising events  and other communication activities.  however they do not include marketing overhead expenses which are presented in distribution and selling expenses.   the di stribution and selling expenses consist of sales force and sales administration costs direct and indirect supply chain costs  and marketing overhead expenses as well as expenses for research and development which amounted to    million in      million.   general and administration expenses include the functions it finance legal human resources and facilities   services  as well as general management,,,,,,0.3690804769178641,,0.4021751176379131,,0.3521291944049823,,,,,,,,,
4695,however they do not include marketing overhead expenses which are presented in distribution and selling expenses.   the di stribution and selling expenses consist of sales force and sales administration costs direct and indirect supply chain costs  and marketing overhead expenses as well as expenses for research and development which amounted to    million in      million.   general and administration expenses include the functions it finance legal human resources and facilities   services  as well as general management.   sundry expenses consist mainly of costs for onetime effects as well as losses from disposal of fixed assets,,,,,,,,0.4158426450514241,,0.3751078042623303,,,,0.4228108432036505,,,,,
4696,the di stribution and selling expenses consist of sales force and sales administration costs direct and indirect supply chain costs  and marketing overhead expenses as well as expenses for research and development which amounted to    million in      million.   general and administration expenses include the functions it finance legal human resources and facilities   services  as well as general management.   sundry expenses consist mainly of costs for onetime effects as well as losses from disposal of fixed assets.         to  o ur sha reho l ders  gro up  man a gemen t rep o rt  o ur co mpa n y  gro up  man a gemen t rep o rt  fin a n cial  review  co n so l ida ted fin an cia l  sta temen ts  a ddition a l in fo rma tion            a n n u a l  r e p o r t       income from government grants is reported as a deduction from the related expenses and amounted to   million  in       million,,,,,,0.4267028320896663,,0.4337223129737733,0.3687196501665633,0.4065540350251554,,,,,,0.3135444766383156,,,
4697,general and administration expenses include the functions it finance legal human resources and facilities   services  as well as general management.   sundry expenses consist mainly of costs for onetime effects as well as losses from disposal of fixed assets.         to  o ur sha reho l ders  gro up  man a gemen t rep o rt  o ur co mpa n y  gro up  man a gemen t rep o rt  fin a n cial  review  co n so l ida ted fin an cia l  sta temen ts  a ddition a l in fo rma tion            a n n u a l  r e p o r t       income from government grants is reported as a deduction from the related expenses and amounted to   million  in       million.     cost by nature  supplementary information on the expenses by nature is detailed below,,,,,,0.4077284081381279,,0.4265687311549541,0.4405158116507099,0.3453099568411617,,,,,0.4636716734426214,0.313706123585674,,,
