86,consolidated financial statements   assets              sep   sep   in millions of       siemens energy investment        assets siemens real estate        assets innovation governance and pensions        assetbased adjustments    intragroup financing receivables        taxrelated assets        liabilitybased adjustments        financing eliminations and other items        reconciliation to consolidated financial statements             note   information about geographies                      revenue by location   of customers  revenue by location  of companies  noncurrent assets    fiscal year  fiscal year  sep   in millions of                 europe c.i.s. africa middle east                    americas                    asia australia                    siemens                          thereof germany                          thereof countries outside of germany                             therein u.s                              noncurrent assets consist of property plant and equipment goodwill and other intangible assets.  note   related party transactions  joint ventures and associates  siemens has relationships with many joint ventures and associates in the ordinary course of business whereby siemens buys and sells a wide variety of products and services generally on arms length terms. the transactions between continuing operations and joint ventures and associates were as follows                          sales of goods and services  and other income  purchases of goods and services and other expenses  receivables  liabilities    fiscal year  fiscal year  sep   sep   sep   sep   in millions of                     joint ventures                    associates                                                               as of september   and  receivables to associates included reimbursement rights against siemens energy which were recognized correspondingly with obligations from customer contracts in connection with siemens energy activities legally remaining at siemens. liabilities to associates as of september   and  were mainly due to trade receivables that also result from these activities and that have economically to be allocated to siemens energy.  as of september   and  guarantees to joint ventures and associates amounted to  million and  million respectively thereof  million and  million respectively to associates. these guarantees included mainly obligations from performance and credit guarantees in connection with the siemens energy business. for these guarantees siemens has reimbursement rights towards siemens energy.  as of september   and  loans given to joint ventures and associates amounted to  million and  million therein  million and  million related to joint ventures respectively. the related book values amounted to  million and  million therein  million and  million related to joint ventures respectively. valuation adjustments recognized in fiscal  and  reduced book values of loans related to joint ventures by  million and  million respectively.  as of september   and  the company had commitments to make capital contributions to joint ventures and associates of  million and  million therein  million and  million related to joint ventures respectively.  as of september   and  there were loan commitments to joint ventures amounting to  million and  million respectively.,0.1833372203994972,0.2893649332506306,0.3256883871873243,0.4509467257841983,0.3300170075368717,0.3155817222932094,0.3618569818403881,0.29699891339281,0.2382210584788802,0.277984457763858,0.3788985628330292,0.1835529700471013,0.2890170040825616,0.3237021487130121,,,0.1499795362373145,,0.282220141577144
87,consolidated financial statements   pension entities  as of september   and  lease liabilities resulting from sale and leaseback transactions with pension entities amounted to  million and  million respectively.  for information regarding the funding of our postemployment benefit plans see notes  and  . related individuals  in fiscal  and  members of the managing board received cash compensation of . million and . million. the fair value of sharebased compensation amounted to . million and . million for  and  stock awards respectively granted in fiscal  and . in fiscal  and  the company granted contributions under the bsav to members of the managing board totaling . million and . million respectively.  therefore in fiscal  and  compensation and benefits attributable to members of the managing board amounted to . million and . million in total respectively.  in fiscal  and  expense related to sharebased compensation amounted to . million and . million respectively including expenses related to the additional cash payment compensation due to the spinoff of siemens energy.  former members of the managing board and their surviving dependents received emoluments within the meaning of  section  para.  no.  b of the german commercial code totaling . million and . million in fiscal  and  respectively.  the defined benefit obligation dbo of all pension commitments to former members of the managing board and their surviving dependents as of september   and  amounted to . million and . million respectively.  compensation attributable to members of the supervisory board comprised in fiscal  and  base compensation and additional compensation for committee work and amounted to . million and . million including meeting fees respectively.  in fiscal  and  no other major transactions took place between the company and the members of the managing board and the supervisory board.  some of our board members hold or in the last year have held positions of significant responsibility with other entities. we have relationships with almost all of these entities in the ordinary course of our business whereby we buy and sell a wide variety of products and services on arms length terms.  note   principal accountant fees and services  fees related to professional services rendered by the companys principal accountant ey for fiscal  and  are        fiscal year  in millions of       audit services  .  .  other attestation services  . . tax services      .  .    in fiscal  and   and  respectively of the total fees related to ernst  young gmbh wirtschaftsprfungsgesellschaft germany.  audit services relate primarily to services provided by ey for auditing siemens consolidated financial statements for auditing financial statements of siemens ag and its subsidiaries for reviews of interim financial statements being integrated into the audit for projectaccompanying it audits as well as for audits of the internal control system at service companies. other attestation services include primarily audits of financial statements as well as other attestation services in connection with ma activities audits of employee benefit plans attestation services relating to sustainability reporting compensation reporting and disclosures in accordance with  eu taxonomy comfort letters and other attestation services required under regulatory requirements contractually agreed or requested on a voluntary basis.  note   corporate governance  the managing and supervisory boards of siemens aktiengesellschaft and of siemens healthineers ag a publicly listed subsidiary of siemens provided the declaration required under section  of the german stock corporation act aktg on october   and september   respectively. the declarations are available on the companys websites at siemens.comgcgcode and at corporate.siemenshealthineers.cominvestorrelationscorporategovernance.  note  subsequent events  in november  agreements were entered into with the intent to acquire  of the shares in siemens limited india from the siemens energy group for a purchase price of . billion in cash. closing of the transaction is expected in december . upon closing the acquisition will be accounted for as equity transaction not impacting net income and siemens share in siemens limited india will increase to . additionally the siemens energy group will receive a put option for up to an additional  of the shares in siemens limited india. if specific guarantee events occur siemens energy can exercise the option for a fixed price totaling  million for the entire  stake to be paid by siemens. the transaction will be recognized in equity not impacting net income and a purchase liability measured at the respective present value of the option price will be recorded.,0.1543152710074736,0.2944633639575815,0.2874888178594336,0.332904669861811,0.3309008317222801,0.2852731744766654,0.3582497746116175,0.3246717212327439,0.3020044801815731,0.2631333160833149,0.4469882762204905,0.2137635090057543,,0.3457825586785885,0.2719892224862337,0.2365576137399725,0.1673957477476127,0.1123129602799069,0.343046070720648
88,consolidated financial statements   note   list of subsidiaries and associated companies pursuant to section  para.  of the german commercial code         equity interest  september    in  subsidiaries    germany  companies    acuson gmbh erlangen    airport munich logistics and services gmbh hallbergmoos    ait applied information technologies gmbh  co. kg stuttgart    ait verwaltungsgmbh stuttgart    alpha verteilertechnik gmbh cham    befund gmbh erlangen    berliner vermgensverwaltung gmbh berlin    capta grundstcksverwaltungsgesellschaft mbh grnwald    dade behring grundstcks gmbh kemnath    eos.uptrade gmbh hamburg    evosoft gmbh nuremberg    geisenhausener entwicklungs management gmbh grnwald    geisenhausener entwicklungsgmbh  co. kg grnwald    hacon ingenieurgesellschaft mbh hanover    illit grundstcksverwaltungsmanagement gmbh grnwald    innomotics beteiligungsgmbh munich    innomotics gmbh munich    innomotics real estate gmbh  co. kg nuremberg    ipgd grundstcksverwaltungsgesellschaft mbh grnwald    kaco new energy gmbh neckarsulm    komptime gmbh munich    kyros  gmbh munich    kyros  gmbh munich    kyros  gmbh munich    kyros  gmbh munich    kyros  gmbh munich    kyros b ag munich    kyros c ag munich    lincas electro vertriebsgesellschaft mbh grnwald    moorenbrunn entwicklungs management gmbh grnwald    moorenbrunn entwicklungsgmbh  co. kg grnwald    next gmbh munich    next services gmbh munich    optio grundstcksvermietungsgesellschaft mbh  co. objekt tbingen kg grnwald    remech systemtechnik gmbh unterwellenborn    risicom rckversicherung ag grnwald    siemens advanta solutions gmbh munich    siemens bank gmbh munich    siemens beteiligungen europa gmbh munich    siemens beteiligungen inland gmbh munich    siemens beteiligungen management gmbh kemnath    siemens beteiligungen usa gmbh berlin    siemens beteiligungsverwaltung gmbh  co. ohg kemnath      siemens campus erlangen grundstcksgmbh  co. kg grnwald    siemens campus erlangen objekt  gmbh  co. kg grnwald    siemens campus erlangen objekt  gmbh  co. kg grnwald,,,,,0.2931660132884907,,0.3268161103962397,0.269470642459067,0.2417536115473099,,0.3602569928211321,,,,,,,0.134347273064203,0.2776010452357519
89,consolidated financial statements   siemens campus erlangen objekt  gmbh  co. kg grnwald    siemens campus erlangen objekt  gmbh  co. kg grnwald    siemens campus erlangen objekt  gmbh  co. kg grnwald    siemens campus erlangen objektmanagement gmbh grnwald    siemens campus erlangen verwaltungsgmbh grnwald    siemens digital business builder gmbh munich    siemens digital logistics gmbh frankenthal    siemens electronic design automation gmbh munich    siemens finance  leasing gmbh munich    siemens financial services gmbh munich    siemens fonds invest gmbh munich    siemens global innovation partners management gmbh munich    siemens healthcare diagnostics products gmbh marburg    siemens healthcare gmbh munich    siemens healthineers ag munich    siemens healthineers beteiligungen gmbh  co. kg rttenbach    siemens healthineers beteiligungen verwaltungsgmbh rttenbach    siemens healthineers holding i gmbh munich    siemens healthineers holding iii gmbh munich    siemens healthineers innovation gmbh  co. kg rttenbach    siemens healthineers innovation verwaltungsgmbh rttenbach    siemens immobilien besitz gmbh  co. kg grnwald    siemens immobilien management gmbh grnwald    siemens industriepark karlsruhe gmbh  co. kg grnwald    siemens industry software gmbh cologne    siemens liquidity one munich    siemens logistics gmbh nuremberg    siemens middle east services gmbh  co. kg munich      siemens middle east services lp gmbh munich    siemens mobility gmbh munich    siemens mobility real estate gmbh  co. kg grnwald    siemens mobility real estate management gmbh grnwald    siemens nixdorf informationssysteme gmbh grnwald    siemens officecenter frankfurt gmbh  co. kg grnwald    siemens officecenter verwaltungs gmbh grnwald    siemens private finance versicherungsvermittlungsgesellschaft mbh munich    siemens project ventures gmbh erlangen    siemens real estate consulting gmbh  co. kg munich    siemens real estate consulting management gmbh grnwald    siemens real estate gmbh  co. kg kemnath    siemens real estate management gmbh kemnath    siemens technology accelerator gmbh munich    siemens technopark nrnberg gmbh  co. kg grnwald    siemens traction gears gmbh penig    siemens trademark gmbh  co. kg kemnath    siemens trademark management gmbh kemnath    siemens treasury gmbh munich    siemensfonds c munich    siemensfonds pension captive munich    siemensfonds s munich    siemensfonds s munich    siemensstadt c gmbh  co. kg grnwald    siemensstadt c verwaltungs gmbh grnwald    siemensstadt cx gmbh  co. kg grnwald    siemensstadt cx verwaltungs gmbh grnwald    siemensstadt grundstcksgmbh  co. kg grnwald,,,,,,,0.316042747903506,0.2661616246582972,0.2285452998638767,0.2576665122447517,0.35764691201659,,0.359939542020161,0.3227751719812861,,0.2320614888109173,,0.1569962729176626,0.2859960961373436
90,consolidated financial statements   siemensstadt management gmbh grnwald    siemensstadt spe gmbh  co. kg grnwald    siemensstadt spe verwaltungs gmbh grnwald    siemensstadt swhh gmbh  co. kg grnwald    siemensstadt swhh verwaltungs gmbh grnwald    siemensstadt vg gmbh  co. kg grnwald    siemensstadt vg verwaltungs gmbh grnwald    sillit grundstcksverwaltungsgesellschaft mbh munich    simar ost grundstcksgmbh grnwald    sykatec systeme komponenten anwendungstechnologie gmbh erlangen    varian medical systems deutschland gmbh  co. kg darmstadt    varian medical systems haan gmbh haan    varian medical systems mnchen gmbh munich    varian medical systems particle therapy gmbh  co. kg troisdorf    vms deutschland holdings gmbh darmstadt    vvk versicherungsvermittlungs und verkehrskontor gmbh munich    weiss spindeltechnologie gmbh maroldsweisach    zeleni holding gmbh kemnath    zeleni real estate gmbh  co. kg kemnath    europe commonwealth of independent states c.i.s. africa middle east without germany  companies    estel rail automation spa algiers  algeria    siemens healthineers algeria e.u.r.l. hydra  algeria    siemens healthineers oncology services algeria e.u.r.l. hydra  algeria    siemens spa algiers  algeria    siemens industry software closed jointstock company yerevan  armenia    acuson sterreich gmbh vienna  austria    etm professional control gmbh eisenstadt  austria    innomotics gmbh vienna  austria    ith icoserve technology for healthcare gmbh innsbruck  austria    siemens advanta solutions gmbh vienna  austria    siemens aktiengesellschaft sterreich vienna  austria    siemens healthcare diagnostics gmbh vienna  austria    siemens industry software gmbh linz  austria    siemens konzernbeteiligungen gmbh vienna  austria    siemens metals technologies vermgensverwaltungs gmbh vienna  austria    siemens mobility austria gmbh vienna  austria    siemens personaldienstleistungen gmbh vienna  austria    steiermrkische medizinarchiv gesmbh graz  austria    varian medical systems gesellschaft mbh brunn am gebirge  austria    vvk versicherungsvermittlungs und verkehrskontor gmbh vienna  austria    siemens w.l.l. manama  bahrain    innomotics n.v. beersel  belgium    siemens healthcare nv grootbijgaarden  belgium    siemens industry software nv leuven  belgium    siemens mobility s.a.  n.v beersel  belgium    siemens s.a.n.v. beersel  belgium    varian medical systems belgium nv grootbijgaarden  belgium    siemens d.o.o. sarajevo  u likvidaciji sarajevo  bosnia and herzegovina    siemens medicina d.o.o. sarajevo  bosnia and herzegovina    siemens eood sofia  bulgaria    siemens healthcare eood sofia  bulgaria    siemens mobility eood sofia  bulgaria    varinak bulgaria eood sofia  bulgaria    siemens d.d. zagreb  croatia    siemens healthcare d.o.o. zagreb  croatia,,0.2784357931208577,0.3041823606795746,0.3035226744699557,0.319901759972294,,,0.2828723015076748,0.256027314062014,,,,0.4133751876992513,0.3237266063390195,,0.2627897331357271,0.1956294297557765,0.1391055271471225,0.3041649478250296
91,consolidated financial statements   oez s.r.o. letohrad  czech republic    siemens healthcare s.r.o. prague  czech republic    siemens industry software s.r.o. prague  czech republic    siemens large drives s.r.o. drasov  czech republic    siemens mobility s.r.o. prague  czech republic    siemens s.r.o. prague  czech republic    innomotics as ballerup  denmark    siemens as ballerup  denmark    siemens healthcare as ballerup  denmark    siemens industry software as ballerup  denmark    siemens mobility as ballerup  denmark    siemens healthcare logistics llc cairo  egypt    siemens healthcare s.a.e. cairo  egypt    siemens industrial llc new cairo  egypt    siemens industry software a limited liability company  private free zone new cairo  egypt    siemens mobility egypt llc cairo  egypt    siemens healthcare oy espoo  finland    siemens industry software oy espoo  finland    siemens mobility oy espoo  finland    siemens osakeyhti espoo  finland    varian medical systems finland oy helsinki  finland    vibeco  virtual buildings ecosystem oy espoo  finland    acuson france sas courbevoie  france    block imaging sas paris  france    innomotics sas saintpriest  france    padam mobility sas paris  france    petnet solutions sas lisses  france    siemens electronic design automation sarl meudon la fort  france    siemens financial services sas courbevoie  france    siemens france holding sas courbevoie  france    siemens healthcare sas courbevoie  france    siemens industry software sas chtillon  france    siemens lease services sas courbevoie  france    siemens logistics sas saintdenis  france    siemens mobility sas chtillon  france    siemens sas courbevoie  france    sqills it services sas paris  france    supplyframe europe sas grenoble  france    varian medical systems france sarl le plessisrobinson  france    wattsense sas dardilly  france    siemens a.e. electrotechnical projects and products athens  greece    siemens healthcare industrial and commercial single member societe anonyme marousi  greece    siemens mobility rail and road transportation solutions singlemember societe anonyme athens  greece    evosoft hungary szamitastechnikai kft. budapest  hungary    siemens healthcare kft. budapest  hungary    siemens industry software kft. budapest  hungary    siemens mobility kft. budapest  hungary    siemens zrt. budapest  hungary    varian medical systems hungary kft. budapest  hungary    mentor graphics holdings unlimited company shannon county clare  ireland    mentor graphics development services limited shannon county clare  ireland    siemens electronic design automation limited shannon county clare  ireland    siemens healthcare diagnostics manufacturing limited swords county dublin  ireland    siemens healthcare medical solutions limited swords county dublin  ireland    siemens industry software limited shannon county clare  ireland    siemens limited dublin  ireland,,,0.2887655439463433,0.3567003382904519,,0.3163139791255278,,,,,,,0.4512264304940987,0.3050053331196007,,,0.1404957004191197,0.1341328547904216,0.2923892195493731
92,consolidated financial statements   mckit systems ltd. givat shmuel  israel    siemens concentrated solar power ltd. rosh haayin  israel    siemens electronic design automation ltd herzilya pituah  israel    siemens healthcare ltd. rosh haayin  israel    siemens industry operations ltd. rosh haayin  israel    siemens industry software ltd. airport city  israel    siemens ltd. rosh haayin  israel    siemens mobility ltd. rosh haayin  israel    siemens mobility operations ltd. rosh haayin  israel    ugs israeli holdings israel ltd. airport city  israel    acuson italy s.r.l. milan  italy    innomotics s.r.l. milan  italy    siemens healthcare s.r.l. milan  italy    siemens industry software s.r.l. milan  italy    siemens logistics s.r.l. milan  italy    siemens mobility s.r.l. milan  italy    siemens s.p.a. milan  italy    varian medical systems italia s.p.a. segrate  italy    innomotics limited liability partnership almaty  kazakhstan    siemens healthcare limited liability partnership almaty  kazakhstan    siemens too almaty  kazakhstan    vms kenya ltd nairobi  kenya    siemens industrial business co. for electrical electronic and mechanical contracting wll kuwait city  kuwait    siemens large drives company for repairing  maintenance of light  heavy equipment w.l.l ahmadi  kuwait    crabtree pty ltd maseru  lesotho    atruvi invest management s..r.l munsbach  luxembourg    fast track diagnostics luxembourg s. r.l. eschsuralzette  luxembourg    tfm international s.a. i.l. luxembourg  luxembourg    ftd europe ltd sliema  malta    ctsi mauritius ltd. ebene  mauritius    varian medical systems mauritius ltd. ebene  mauritius    siemens healthcare sarl casablanca  morocco    siemens industry software sarl sala al jadida  morocco    siemens s.a. casablanca  morocco    castor iii b.v. the hague  netherlands    chronos b.v. enschede  netherlands    mendix technology b.v. rotterdam  netherlands    pollux iii b.v. the hague  netherlands    siemens electronic design automation b.v. eindhoven  netherlands    siemens finance b.v. the hague  netherlands    siemens financieringsmaatschappij n.v. the hague  netherlands    siemens healthineers holding iii b.v. the hague  netherlands    siemens healthineers holding iv b.v. the hague  netherlands    siemens healthineers holding v b.v. the hague  netherlands    siemens healthineers nederland b.v. the hague  netherlands    siemens industry software netherlands b.v. eindhoven  netherlands    siemens international holding b.v. the hague  netherlands    siemens mobility b.v. zoetermeer  netherlands    siemens mobility holding b.v. the hague  netherlands    siemens nederland n.v. the hague  netherlands    sqills products b.v. enschede  netherlands    tass international b.v. helmond  netherlands    varian medical systems nederland b.v. houten  netherlands    innomotics as oslo  norway    siemens as oslo  norway    siemens healthcare as oslo  norway,,0.3287855360490239,0.3958596148875215,0.3800002728878944,0.2893764147820292,0.3800385065820778,,0.3113560689465618,,0.2587006950694247,,,0.3672549227021247,,,0.2215203144323515,,,
