,Sentences,"Scores_a_AGRICULTURE, FORESTRY AND FISHING",Scores_b_MINING AND QUARRYING,Scores_c_MANUFACTURING,"Scores_d_ELECTRICITY, GAS, STEAM AND AIR CONDITIONING SUPPLY","Scores_e_WATER SUPPLY; SEWERAGE, WASTE MANAGEMENT AND REMEDIATION ACTIVITIES",Scores_f_CONSTRUCTION,Scores_g_WHOLESALE AND RETAIL TRADE; REPAIR OF MOTOR VEHICLES AND MOTORCYCLES,Scores_h_TRANSPORTATION AND STORAGE,Scores_i_ACCOMMODATION AND FOOD SERVICE ACTIVITIES,Scores_j_INFORMATION AND COMMUNICATION,Scores_k_FINANCIAL AND INSURANCE ACTIVITIES,Scores_l_REAL ESTATE ACTIVITIES,"Scores_m_PROFESSIONAL, SCIENTIFIC AND TECHNICAL ACTIVITIES",Scores_n_ADMINISTRATIVE AND SUPPORT SERVICE ACTIVITIES,Scores_o_PUBLIC ADMINISTRATION AND DEFENCE; COMPULSORY SOCIAL SECURITY,Scores_p_EDUCATION,Scores_q_HUMAN HEALTH AND SOCIAL WORK ACTIVITIES,"Scores_r_ARTS, ENTERTAINMENT AND RECREATION",Scores_s_OTHER SERVICE ACTIVITIES
1,table of reports   combined management report  consolidated financial statements  responsibility statement siemens group  independent auditors reports siemens group  annual financial statements  responsibility statement siemens ag  independent auditors report siemens ag  fiveyear summary  compensation report including auditors report  report of the supervisory board  corporate governance statement  notes and forwardlooking statements,,0.256776093286635,0.2989033437027067,0.3218318922911228,,0.2989162023874415,,,,0.2770648415307455,,,,,,0.2206599908268461,,,
2,combined management report   for fiscal,,,,,,,,,,,,,,,,,,0.1153640949130034,
4,combined management report   . organization of the siemens group and basis of presentation   siemens is a technology group that is active in nearly all countries of the world focusing on the areas of automation and digitalization in the process and manufacturing industries intelligent infrastructure for buildings and distributed energy systems smart mobility solutions for rail transport and medical technology and digital healthcare services.  siemens comprises siemens aktiengesellschaft siemens ag a stock corporation under the federal laws of germany as the parent company and its subsidiaries. our company is incorporated in germany with our corporate headquarters situated in munich. as of september   siemens had around  employees.  as of september   siemens has the following reportable segments digital industries  smart infrastructure  mobility  and siemens healthineers  which together form our industrial business and siemens financial services sfs  which supports the activities of our industrial businesses and also conducts its own business with external customers. furthermore we report results for portfolio companies  which comprises businesses that are managed separately to improve their performance.  our reportable segments and portfolio companies may do business with each other leading to corresponding orders and revenue. such orders and revenue are eliminated on group level.  nonfinancial matters of the group and siemens ag  siemens has policies for environmental employee and social matters for the respect of human rights and anticorruption and bribery matters among others. our business model is described in chapters  and  of this combined management report. reportable information that is necessary for an understanding of the development performance position and the impact of our activities on these matters is included in this combined management report in particular in chapters  through . forwardlooking information including risk disclosures is presented in chapter . chapter  includes additional information that is required to be reported in the combined management report related to the parent company siemens ag. eu taxonomy disclosures are outlined in chapter .  as supplementary information amounts reported in the consolidated financial statements and the annual financial statements of siemens ag related to such nonfinancial matters and additional explanations thereto are included in notes to consolidated financial statements for fiscal  notes     and  and in the notes to the annual financial statements for fiscal  notes     and . in order to inform the users of the financial reports in a focused manner these disclosures are not subject to a specific nonfinancial framework  in contrast to the disclosures in our separate sustainability report  document which are based on the standards developed by the global reporting initiative gri. said document also includes detailed information on degree siemens sustainability framework. with degree siemens intends to manage and track its progress on selected ambitions in the environmental social and governance areas.,,0.2639856998779655,0.3455584547422839,0.4169877752899121,0.2947338572875626,0.3237361487227144,0.3154445931759311,0.2720728690634706,,,0.3570453316379396,,0.3769210756720442,0.3369552417183236,,,0.1855156907459296,,0.2726731367691172
5,combined management report   . financial performance system  . revenue growth  in the siemens financial framework we aim to achieve a revenue growth range of  to  per year on a comparable basis over a cycle of three to five years. our primary measure for managing and controlling our revenue growth is comparable growth because it shows the development in our business net of currency translation effects which arise from the external environment outside of our control and portfolio effects which involve business activities which are either new to or no longer a part of the respective business.  currency translation effects are the difference between revenue for the current period calculated using the exchange rates of the current period and revenue for the current period calculated using the exchange rates of the comparison period. for calculating the percentage change yearoveryear this absolute difference is divided by revenue for the comparison period. a portfolio effect arises in the case of an acquisition or a disposition and is calculated as the change yearoveryear in revenue related to the transaction. for calculating the percentage change this absolute change is divided by revenue for the comparison period. any portfolio effect is excluded for the twelve months following the relevant transaction after which both current and past reporting periods fully reflect the portfolio change. for orders we apply the same calculations for currency translation and portfolio effects as described above.  . profitability and capital efficiency  within the siemens financial framework we aim to achieve over a cycle of three to five years margins that are comparable to those of our relevant competitors. therefore we have defined profit margin ranges for our industrial businesses which also consider the profit margins of their respective relevant competitors. profit margin is defined as profit of the respective business divided by its revenue.  for our industrial businesses profit represents ebita adjusted for amortization of intangible assets not acquired in business combinations.  we have set the following margin ranges              margin range  digital industries      smart infrastructure      mobility      siemens healthineers        siemens financial services roe after tax                for siemens healthineers we present the margin range we expect as that companys majority shareholder.  in line with common practice in the financial services business our financial indicator for measuring capital efficiency at sfs is return on equity after tax or roe after tax. roe is defined as sfs profit after tax divided by its average allocated equity.  primary measure for managing and controlling profit and profitability at group level net income is the primary driver of basic earnings per share from net income eps as well as of eps before purchase price allocation accounting eps pre ppa which is used for our capital market communication. eps pre ppa is defined as basic earnings per share from net income adjusted for amortization of intangible assets acquired in business combinations and related income taxes. as with eps eps pre ppa includes the amounts attributable to shareholders of siemens ag. we aim to achieve highsingledigit annual growth in eps pre ppa over a cycle of three to five years.  we seek to work profitably and as efficiently as possible with the capital provided by our shareholders and lenders. for purposes of managing and controlling our capital efficiency we use return on capital employed or roce as our primary measure in our siemens financial framework. our goal is to achieve a roce within a range of  to  over a cycle of three to five years.  . capital structure  sustainable revenue and profit development is supported by a healthy capital structure. accordingly a key consideration within the siemens financial framework is to maintain ready access to the capital markets through various debt products and preserve our ability to repay and service our debt obligations over time. our primary measure for managing and controlling our capital structure is the ratio of industrial net debt to ebitda continuing operations. this financial measure indicates the approximate amount of time in years that would be needed to cover industrial net debt through income from continuing operations without taking into account interest taxes depreciation and amortization. we aim to achieve a ratio of up to ..  . liquidity and dividend  we intend to continue providing an attractive return to our shareholders. in the siemens financial framework we strive for a dividend per share that exceeds the amount for the preceding year or at least matches it.  as in the past we intend to fund the dividend payout from free cash flow. our primary measure to assess our ability to generate cash and ultimately to pay dividends is the cash conversion rate for the siemens group defined as the ratio of free cash flow continuing and discontinued operations to net income. over a cycle of three to five years we aim to achieve a cash conversion rate of  minus the annual comparable revenue growth rate.  at the annual shareholders meeting the managing board in agreement with the supervisory board will submit the following proposal to allocate the unappropriated net income of siemens ag for fiscal  to distribute a dividend of . on each share of no par value entitled to the dividend for fiscal  existing at the date of the annual shareholders meeting the remaining amount is to be carried,0.1497050619375363,,0.301276872877502,0.3157905300785989,,,0.3355008047184155,,,,,,0.3066677559992227,0.3297808090970867,,,,,
6,combined management report   forward. payment of the proposed dividend is contingent upon approval by siemens shareholders at the annual shareholders meeting on february  . the prioryear dividend was . per share.. calculations of eps pre ppa and roce  calculation of eps pre ppa         fiscal year  in millions of  shares in thousands earnings per share in       net income attributable to shareholders of siemens ag        plus amortization of intangible assets acquired in business combinations  attributable to shareholders of siemens ag        less taxes on adjustment        i adjusted net income attributable to shareholders of siemens ag        ii weighted average shares outstanding        i  ii eps pre ppa   .   .   calculation of roce         fiscal year  in millions of       net income        less other interest expensesincome net       plus sfs other interest expensesincome        plus net interest expenses related to provisions for pensions and similar obligations      less interest adjustments discontinued operations     less taxes on interest adjustments tax rate flat        plus defined varianrelated acquisition effects after tax       i income before interest after tax        ii average capital employed        i  ii roce  .  .       item other interest expensesincome net primarily consists of interest relating to corporate debt and related hedging activities as well as interest income on corporate assets.   effects resulting from purchase price allocation for varian medical systems inc. varian which are comprised of amortization of tangible and intangible assets inventory stepups deferred revenue adjustments and    related income taxes.     for purposes of calculating roce in interim periods income before interest after tax is annualized. average capital employed is determined using the average of the respective balances as of the quarterly reporting dates for the periods under review.   calculation of capital employed     total equity  less goodwill and other intangible assets resulting from purchase price allocation related to the varian acquisition  plus longterm debt  plus shortterm debt and current maturities of longterm debt  less cash and cash equivalents  less current interestbearing debt securities  less fair value of foreign currency and interest hedges relating to short and longterm debt  plus provisions for pensions and similar obligations  less sfs debt  plus adjustments from assets classified as held for disposal and liabilities associated with assets classified as held for disposal  less adjustment for deferred taxes on net accumulated actuarial gainslosses on provisions for pensions and similar obligations  capital employed continuing and discontinued operations,,,,,,,,,0.2283231201795235,,,,,,,0.2165404033429019,0.139574331161303,,
7,combined management report   . segment information  . overall economic conditions  overall calendar  was characterized by many headwinds for the global economy. global economic development continued to slowly recover from the negative shocks of the previous years the coronavirus pandemic covid with its disruptions on global demand and supply chains war in ukraine and the following commodity price explosions especially for european energy spiraling inflation and severe financial tightening which caused some turbulence in the banking sector and financial markets. after calendar  in which global gross domestic product gdp increased by . calendar  is expected to show global gdp increasing by . which shows a remarkable resilience of the global economy given the number of big negative shocks of the previous year.  in the postpandemic world consumption patterns of households continued to normalize. in particular the shift to goods from services triggered by covid ended and then reversed with a strong rebound of the service sector including tourism and a normalization of goods demand. in addition in light of much higher interest rates many firms started to reduce their inventory levels which they had previously elevated as a precautionary measure to ensure production and delivery during periods of supply chain bottlenecks. accordingly both global goods demand and trade were significantly weaker in calendar .  these trends were primary contributors for the significant slowdown of the chinese economy during calendar  after it started very dynamically in the first quarter of calendar  following lifting of severe covid lockdowns. another main contributor for the slowdown was the intensification of the countrys real estate crisis. hence chinas gdp is expected to grow by only  in calendar  which is regarded as low because under multiple lockdowns in calendar  china delivered gdp growth of only  and some catchingup in  was expected.  the u.s. economy was a positive surprise. although monetary policy was substantially tightened and the main policy interest rate was increased to . consumption and investment were strong and gdp is expected to expand by . in calendar . in particular the labor market was robust and unemployment remained at historic lows. despite the strong economy inflation and core inflation rates declined substantially. by end of calendar  consumer price inflation is expected to be approximately  after it reached nearly . at the end of calendar . receding global commodity and energy prices and the dissolvement of supply chain bottlenecks both helped ease inflation while tighter monetary policy had the desired effect of anchoring inflation expectations. this helped the u.s. avoid a pricewageprice spiral which could have led to structurally higher inflation rates.  while the u.s. showed stronger economic growth than expected the european union e.u. experienced the difficulties that were widely expected. the drastic increase of energy prices in calendar  a result of the war in ukraine had a severe negative impact especially on energyintensive industries. strong increases in inflation rates led the european central bank to increase the main policy interest rate to . which weighed on fixed investment especially in the real estate sector. moreover the global manufacturing and trade slowdown mentioned above weighed on the e.u. due in particular to the high concentration of manufacturing and export industries in germany the regions largest economy. gdp growth in calendar  is expected to be . in the e.u. and . in germany. only the service sector in particular tourism supported the overall e.u. economy.  the partly estimated figures presented here for gdp are based on an sp global report dated october  .  . digital industries  digital industries  offers a comprehensive product portfolio and system solutions for automation used in discrete and process industries these offerings include automation systems and software for factories numerical control systems servo motors drives and inverters and integrated automation systems for machine tools and production machines. digital industries also provides process control systems machinetomachine communication products sensors for measuring pressure temperature level flow rate distance or shape and radio frequency identification systems. furthermore digital industries offers production and product lifecycle management plm software and software for simulation and testing of mechatronic systems. these leading software offerings are supplemented by an electronic design automation eda software portfolio the mendix cloudnative lowcode application development platform which allows customers to significantly reduce app development times through visual representation of underlying code and digital marketplaces for the global electronics value chain such as supplyframe and pixeom. digital industries also provides customers with lifecycle and datadriven services.  taken together digital industries offerings enable customers to optimize entire value chains from product design and development through production and postsale services. with its advanced software solutions in particular digital industries supports customers in their evolution towards the digital enterprise resulting in increased flexibility and efficiency of production processes and reduced time to market for new products. the most important customer markets include the automotive industry the machinebuilding industry the pharmaceutical and chemicals industry the food and beverage industry and the electronics and semiconductor industry. digital industries serves its customers through a common regional sales organization spanning all its businesses using various sales channels depending on the type of customer and industry and also enhancing customer choice across all channels. changes in customer demand especially for standard products are driven strongly by macroeconomic cycles and can lead to significant shortterm fluctuation in digital industries profitability. volume from large contracts in the software business particularly for eda may also result in strong fluctuations in quarterly volume and profitability. in fiscal  digital industries continued to transition parts of its software business particularly plm from largely upfront revenue recognition towards software as a service saas which yields more predictable recurring revenue and offers growth opportunities by opening access to new customers especially small and mediumsized companies seeking to reduce costs associated with owning complex it infrastructure. the transition held back revenue growth rates and profit margin development in the software business in fiscal  and digital industries expects continued impacts until completion of the transition. competition with digital industries business activities comes primarily from multinational corporations that offer a relatively broad portfolio and from smaller companies active only in certain geographic or product markets.  digital industries sees three trends  influencing its business and providing longterm growth opportunities. producers of investment goods in todays increasingly digital environment must modernize their production capacity particularly to increase production flexibility and reduce time to market. this environment also spurs producers to complement their core products with vertical solutions and service,0.1603825889697117,,,,,,,,,,,,,,,,,0.1228430803648589,
