,Sentences,"Scores_a_AGRICULTURE, FORESTRY AND FISHING",Scores_b_MINING AND QUARRYING,Scores_c_MANUFACTURING,"Scores_d_ELECTRICITY, GAS, STEAM AND AIR CONDITIONING SUPPLY","Scores_e_WATER SUPPLY; SEWERAGE, WASTE MANAGEMENT AND REMEDIATION ACTIVITIES",Scores_f_CONSTRUCTION,Scores_g_WHOLESALE AND RETAIL TRADE; REPAIR OF MOTOR VEHICLES AND MOTORCYCLES,Scores_h_TRANSPORTATION AND STORAGE,Scores_i_ACCOMMODATION AND FOOD SERVICE ACTIVITIES,Scores_j_INFORMATION AND COMMUNICATION,Scores_k_FINANCIAL AND INSURANCE ACTIVITIES,Scores_l_REAL ESTATE ACTIVITIES,"Scores_m_PROFESSIONAL, SCIENTIFIC AND TECHNICAL ACTIVITIES",Scores_n_ADMINISTRATIVE AND SUPPORT SERVICE ACTIVITIES,Scores_o_PUBLIC ADMINISTRATION AND DEFENCE; COMPULSORY SOCIAL SECURITY,Scores_p_EDUCATION,Scores_q_HUMAN HEALTH AND SOCIAL WORK ACTIVITIES,"Scores_r_ARTS, ENTERTAINMENT AND RECREATION",Scores_s_OTHER SERVICE ACTIVITIES
143,based on the analysis of the value potential of the groups businesses and the opportunities and risks of strategic steps critical operating issues were presented to the supervisory board for discussion.  where required by law the articles of association or the rules of procedure for the executive board the supervisory board gives its approval for individual business transactions.  some of the discussions by the supervisory board were difficult and on two matters so confrontational that it was only possible to adopt a resolution by using the supervisory board chairmans casting vote provided for by law.  on both sides of the supervisory board all members were unanimous that this last resort should be an absolute exception,,,,,,,0.45557340016717396,,,,,,,,,,,,
144,where required by law the articles of association or the rules of procedure for the executive board the supervisory board gives its approval for individual business transactions.  some of the discussions by the supervisory board were difficult and on two matters so confrontational that it was only possible to adopt a resolution by using the supervisory board chairmans casting vote provided for by law.  on both sides of the supervisory board all members were unanimous that this last resort should be an absolute exception.  no matter how controversial a discussion might be the common goal is always to reach a consensus for the good of the company its employees and its shareholders,,,,,,,,,,0.35146196482989883,,,,,,,,,
148,the supervisory board and executive board worked together intensively and shared information.  at meetings of the executive committee the majority of which were attended by executive board members and occasionally by external advisors as we ll all topics were discussed in detail and meetings of committees and the supervisory board were prepared and followed up.  in addition in the periods between meetings the chairs of the supervisory board and its committees engaged in a close and regular exchange of views and information with the executive board and were informed about major developments.  important facts were reported at the latest at the subsequent supervisory board or committee meetings,,,,,,,,,,0.3595329154241751,,,,,,0.3267278932090506,,,
149,at meetings of the executive committee the majority of which were attended by executive board members and occasionally by external advisors as we ll all topics were discussed in detail and meetings of committees and the supervisory board were prepared and followed up.  in addition in the periods between meetings the chairs of the supervisory board and its committees engaged in a close and regular exchange of views and information with the executive board and were informed about major developments.  important facts were reported at the latest at the subsequent supervisory board or committee meetings.  before the supervisory board meetings the shareholder and the employee representatives each held separate meetings to discuss the agenda items,,,,,,,,,,0.3434736239136645,,,,,,,,,
164,meetings are only held exclusively as telephone or video conferences in exceptional circumstances.  in the reporting year only two out of a total of meetings of the supervisory board and its committees were held as video conferences all others were inperson meetings.  the meetings held as vi deo conferences were of short duration and were arranged at short notice.  attendance at meetings of the supervisory board and its committees which were held as inperson meetings with the option of participation via a video link was,,,,,,,,,,,,,,,,,0.269010840029872,,
166,the meetings held as vi deo conferences were of short duration and were arranged at short notice.  attendance at meetings of the supervisory board and its committees which were held as inperson meetings with the option of participation via a video link was . .  the following table shows attendance in individualized form attendance rate at the meetings of the supervisory board and its committees fy supervisory board meetings committee meetings meetings attendedattendancerate in meetings attendedattendance rate in prof,,,,,,,,,,,,,,,,0.3451728775355595,,,
167,attendance at meetings of the supervisory board and its committees which were held as inperson meetings with the option of participation via a video link was . .  the following table shows attendance in individualized form attendance rate at the meetings of the supervisory board and its committees fy supervisory board meetings committee meetings meetings attendedattendancerate in meetings attendedattendance rate in prof.  dr,,,,,,,,,,,,,,,,0.3322344353393481,,,
168,.  the following table shows attendance in individualized form attendance rate at the meetings of the supervisory board and its committees fy supervisory board meetings committee meetings meetings attendedattendancerate in meetings attendedattendance rate in prof.  dr. ing,,,,,,,,,,,,,,,,0.3346664037910345,,,
169,the following table shows attendance in individualized form attendance rate at the meetings of the supervisory board and its committees fy supervisory board meetings committee meetings meetings attendedattendancerate in meetings attendedattendance rate in prof.  dr. ing.  dr,,,,,,,,,,,,,,,,0.33086817694064,,,
250,report on the work of the committees the primary task of the supervisory boards six co mmittees is to prepare decisions and topics for discussion at the full meetings.  the supervisory board has delegated individual decisionmaking powers to its committees where this is legally pe rmissible.  the powers of the committees and the requirements on committee members are set out in the rules of procedure for the respective committees.  the chairs of the committees provided the supervisory board with regular detailed reports on the work of the committees in the reporting year,,0.3892163394666845,,,,,,,,0.3872152593817272,,,0.4050116309698329,,0.3753424441933074,,0.34159253386806965,0.25104414990707774,
251,the supervisory board has delegated individual decisionmaking powers to its committees where this is legally pe rmissible.  the powers of the committees and the requirements on committee members are set out in the rules of procedure for the respective committees.  the chairs of the committees provided the supervisory board with regular detailed reports on the work of the committees in the reporting year.  the chairs of the committees were also in close contact with the other members of their committees outside the regular meetings to exchange views on particularly important topics,,,,,,,,,,0.3820045044584667,,,,,0.39900693839876494,,0.2789503802171215,,
252,the powers of the committees and the requirements on committee members are set out in the rules of procedure for the respective committees.  the chairs of the committees provided the supervisory board with regular detailed reports on the work of the committees in the reporting year.  the chairs of the committees were also in close contact with the other members of their committees outside the regular meetings to exchange views on particularly important topics.  the compositions of the six committees as of september are shown in the sectio n supervisory board,,,,,,,,,,0.3549721091018931,,,,,0.39981598994839934,0.3488048135093334,0.3010940423952037,0.25780979286400324,
253,the chairs of the committees provided the supervisory board with regular detailed reports on the work of the committees in the reporting year.  the chairs of the committees were also in close contact with the other members of their committees outside the regular meetings to exchange views on particularly important topics.  the compositions of the six committees as of september are shown in the sectio n supervisory board.  the executive committee präsidium met times in the past fi scal year due to the current situation and the preparations for the seminal meetings of the supervisory board,,,,,,,,,,,,,,,,0.33350182632172093,0.26971645738646655,,
400,since october the automation engineering and springs stabilizers businesses assigned to the former multi tracks segment as of september have been part of the automotive technology segment.  the same applies to the forged technologies business reported as a separate segment as of september .  since october the investment in tk elevator held by thyssenkrupp since the sale of the elevator technology business at the end of july has been assigned to reconciliation in the segment reporting included in the former multi tracks segment in the fiscal year.  thyssenkrupp transrapid gmbh which was assigned to the marine systems segment as of september has also been included under r econciliation within the service units in the segment reporting since october,,,,,,,,0.4085905389733725,,,,,,,,,,,
402,since october the investment in tk elevator held by thyssenkrupp since the sale of the elevator technology business at the end of july has been assigned to reconciliation in the segment reporting included in the former multi tracks segment in the fiscal year.  thyssenkrupp transrapid gmbh which was assigned to the marine systems segment as of september has also been included under r econciliation within the service units in the segment reporting since october .  corresponding adjustments have been made for these changes in the recognition and presentation of the data for the prior year.  for further details of the investment in tk elevator see also note segment reporting and note financial instruments,,,,,,,,0.40079171376446976,,,,,,,,,,,
409,these activities met the criteria set forth in ifrs for recognition as a disposal group for the first time in the th quarter of .  therefore the assets and liabilities relating to thes e activities have to be presented separately in the statement of financial position as of september .  the business performance is presented by segment.  the gcgc contains recommendations for disclosure s on the internal control and risk management system that go beyond the statutory requirements for the management report and are therefore outside the scope of the audit of the content of the management report performed by the auditor,,0.44944021637182013,,,0.562142467943021,,,,,0.3676720219389612,0.4871618806960299,,,0.46602270973176074,0.4011136619062364,,0.2884545438779076,,0.4275807688945102
410,therefore the assets and liabilities relating to thes e activities have to be presented separately in the statement of financial position as of september .  the business performance is presented by segment.  the gcgc contains recommendations for disclosure s on the internal control and risk management system that go beyond the statutory requirements for the management report and are therefore outside the scope of the audit of the content of the management report performed by the auditor.  in this report they are assigned to the content of the co rporate governance statement moreover they are contained in separate paragraphs to set them apart from the disclosures to be audited and flagged accordingly,,0.3973792261882362,,,,,,,,0.3685875494222816,0.49063246254066,,,0.44588312030298694,0.3873848751792088,0.331547574442032,,,
431,the be arings and forged technologies business units which were reported as se gments in the prior year were transferred to the new decarbon technologies segment and to the automotive technology segment respectively.  for further details of the realignment of the portfolio please refer to the strategy subsection.  in the past fiscal year our business activities were organized in five segments automotive technology decarbon technologies materials services steel europe and marine systems.  the segments are generally divided into business units and operating units,,,,,,,,,,,,,,0.41943243739793035,,,,,
432,for further details of the realignment of the portfolio please refer to the strategy subsection.  in the past fiscal year our business activities were organized in five segments automotive technology decarbon technologies materials services steel europe and marine systems.  the segments are generally divided into business units and operating units.  as of september companies and investments accounted for by the equity method are included in the consolidated financial statements overall we consolidate companies from countries,,,,,,,0.4576118182152225,,,,0.47827075033623045,,,0.4683559881578656,,,,0.2558653279957485,
437,furthermore four regional platforms offer services required by the operating businesses in the various regions.  details on this can be found under corporate headquarters in the section report on the economic position.  www. thyssenkrupp,,,,0.4000467059026666,,,,,,,,,,,,,,,
483,the next step is to drive forward the transformation of the business models for example through increased modularization and standardization of products and by extending the profitable service business.  on the basis of its market position and competitive strength we still see good development potential for materials services.  as well as working to improve its performance we also invested in the future.  the segment is relying especially on the implementation of its materials as a service strategy which is aimed at increasing the share of services and expanding the highmargin supply chain business,,,0.4909934664050053,,,,,,,,,,,,,,,,
510,in the second phase in order to provide longterm support for the performance targets of the individual businesses we are focusing more on structural topics.  as part of this process the businesses are defining individual measures for further increasing their ef ficiency and optimizing their respective business models or adapting them to changing markets.  wherever necessary we cons istently implement restructuring measures.  with the rampup of the second phase the aforementioned areas of action will be dissolved from a central perspective,,,,,,,,,,,,,,0.4209265694476734,,,,,
512,wherever necessary we cons istently implement restructuring measures.  with the rampup of the second phase the aforementioned areas of action will be dissolved from a central perspective.  the transformation office will closely monitor the businesses individual projects and provide support if necessary.  the businesses remain responsible for the implementation of the ongoing development measures and their success,,,,,,,,,,,,,,0.42345159832786056,,,0.27309965978011136,,
513,with the rampup of the second phase the aforementioned areas of action will be dissolved from a central perspective.  the transformation office will closely monitor the businesses individual projects and provide support if necessary.  the businesses remain responsible for the implementation of the ongoing development measures and their success.  for further details on the status of the individual measures in each segment please refer to the resp ective subsections in the report on the economic position,,,,,,0.41100467343364766,0.4642336441156037,,,,,,,0.5038244084996839,,,0.3289453847553358,,
579,on the basis of the groups current composition we are adhering to the overall mediumterm adjusted targets as previously communicated an adjusted ebit margin of to and as a result a positive free cash flow before ma.  in addition ensuring a reli able dividend payment has the utmost priority.  further information on our segments and the resp ective measures to achieve the targets can be found in the segment review in the report on the economic position.  more information on our key performance indicators can be found in management of the group in this section of the report details on the forecast for the current fiscal year are provided in the forecast report,,,,,,,,,0.35536018067104874,,,,,,,,,,
817,india .  .  . construction output real in versus prior year world,,,,,,0.44026097963062444,,,,,,,,,,,,,
818,.  . construction output real in versus prior year world .,,,,,,0.41432694514215057,,,,,,,,,,,,,
819,. construction output real in versus prior year world .  .,,,,,,0.41258819287249393,,,,,,,,,,,,,
854,in particular the weakness in capital spending in germany dampened the recovery of the countrys machinery sector.  a decline of .  is forecast for as a whole in zero growth is expected.  construction the global construction industry is likely to grow by,,,,,,0.4340838344064178,,,,,,,,,,,,,
856,is forecast for as a whole in zero growth is expected.  construction the global construction industry is likely to grow by .  in .  positive trends in emerging markets and developing countries as well as stateaided infrastructure investment remain the driving force behind this development,,,,,,0.415843197307882,,,,,,,,,,,,,
857,construction the global construction industry is likely to grow by .  in .  positive trends in emerging markets and developing countries as well as stateaided infrastructure investment remain the driving force behind this development.  however overall growth in most regions is being curbed by weaker momentum in housing construction,,,,,,0.5002684466412874,,,,,,,,,,,,,
867,the german construction industry remains in decline.  a decrease of .  is expected for as a whole.  persistently high borrowing costs are holding back investment in the construction of both private housing and commercial properties,,,,,,0.4767547244303221,,,,,,,,,,,,,
871,slightly positive trends are evident in publicsector construction with a recovery of .  forecast for .  in china only moderate growth of .  is expected in,,,,,,0.46735458260468504,,,,,,,,,,,,,
875,the crisis in the real estate sector has not yet subsided completely.  possible relief could come from state aid packages for publicsector housing construction.  only a slight recovery and .  growth are expected for,,,,,,,,,,,,0.360218993571393,,,,,,,
878,growth are expected for .  in the usa as well the construction industry is benefiting from state aid programs.  growth of .  is expected for but this is already likely to slow to,,,,,,0.431673929299553,,,,,,,,,,,,,
879,in the usa as well the construction industry is benefiting from state aid programs.  growth of .  is expected for but this is already likely to slow to .  in,,,,,,0.4463769079525895,,,,,,,,,,,,,
1074,sales by customer group in other customer groupsother processorsengineeringautomotiveenergy and utilitiespackagingconstructionpublic sector defensesteel and related processingtrading thyssenkrupp annual report combined management report report on the economic position adjusted ebit adjusted ebit million year endedsept.  year endedsept.  change in th quarterendedsept.  th quarterendedsept,,,,0.3896589284296327,,,,,,,,,,,,,,,
1104,.  .  thereof automotive technology .,,,,,,,,,,,,,0.3989985809498817,,,,,,
1105,.  thereof automotive technology .  .,,0.39292313226301784,,,,,,,,,,,0.409233993039771,,,0.3476630386402663,,,
1106,thereof automotive technology .  .  .,,0.41698008269896747,,,,,,,,,,,0.422553940378343,,,0.330730589558125,,,
1111,.  .  .  materials services,,,,,,,,,,,,,,,,,,,0.4413546035242155
1112,.  .  materials services .,,,,,,,,0.4070239002613552,0.3651568052820842,,,,0.40793083784217005,,,,0.2933854686072963,,0.46683240077669774
1113,.  materials services .  .,,0.3880009124406839,,,,0.4381485918162222,,0.42040592896403495,0.3558456250146168,,,,0.4096819324482103,,,,0.279267000005003,,0.46598104850359473
1114,materials services .  .  .,,0.38949786110907764,,,,0.4303117525518659,,0.4219654103977797,0.3692029823870399,,,,0.4272820487518667,,,,0.2924456080448609,,0.4732041565238406
1152,our growth and performance goal is to be among the best in our competitive environment.  with regard to sustainability we are implementi ng a large number of measures aimed at saving energy.  they include for example replacing old compressors with more efficient versions switching to led lighting in production facilities and office buildings specifically reducing heating temperatures and identifying and eliminating compressed air leaks.  a further aspect of our energy efficiency program is the installation of facilities to generate energy from renewable resources,,,,0.38991545070637457,,,,,,,,,,,,,,,
1154,they include for example replacing old compressors with more efficient versions switching to led lighting in production facilities and office buildings specifically reducing heating temperatures and identifying and eliminating compressed air leaks.  a further aspect of our energy efficiency program is the installation of facilities to generate energy from renewable resources.  we are also working closely with an external service provider to ensure the supply of electricity from renewable sources to our production sites worldwide.  the market environment in the past fiscal year wa s characterized by changes in volumes depending on manufacturer model range and drive system which differed in some cases tangibly from the overall market trend and by the declining customer demand from the construction machinery sector,,0.391359443678542,,0.4861373951995372,,0.4096742245830407,,,,,,,,,,,,,
1155,a further aspect of our energy efficiency program is the installation of facilities to generate energy from renewable resources.  we are also working closely with an external service provider to ensure the supply of electricity from renewable sources to our production sites worldwide.  the market environment in the past fiscal year wa s characterized by changes in volumes depending on manufacturer model range and drive system which differed in some cases tangibly from the overall market trend and by the declining customer demand from the construction machinery sector.  chinese automotive manufacturers continued their course of expansion in both the domestic market and global markets which gained them market share and resulted in cost pressures,,,,0.45486993608968473,,,,,,,,,,,,,,,
1156,we are also working closely with an external service provider to ensure the supply of electricity from renewable sources to our production sites worldwide.  the market environment in the past fiscal year wa s characterized by changes in volumes depending on manufacturer model range and drive system which differed in some cases tangibly from the overall market trend and by the declining customer demand from the construction machinery sector.  chinese automotive manufacturers continued their course of expansion in both the domestic market and global markets which gained them market share and resulted in cost pressures.  we responded to these challenges with strict cost management the successful negotiation of prices and compensation for volume shortfalls and the continuation of our efficiency measures in production and materials,,,,0.41221162327407934,,,,,,,,,,,,,,,
1200,in the context of focusing our portfolio we successfully completed the sale of the activities of thyssenkrupp industries india.  by establishing partnerships and other customer projects we positioned the newly created segment in the market for decarbonization technologies.  current challenges are the slower market development and project deferrals by customers which we are responding to with measures to improve ef ficiency.  we are also addressing restructuring measures systematically for example by further strengthening the focus of cement plant engineering on the areas of new constructiongreen techno logies service and engineering,,,,,,0.4068714810922025,,,,,,,,,,,,,
1202,current challenges are the slower market development and project deferrals by customers which we are responding to with measures to improve ef ficiency.  we are also addressing restructuring measures systematically for example by further strengthening the focus of cement plant engineering on the areas of new constructiongreen techno logies service and engineering.  in fiscal year we continue to prioritize increasing the profitability of all businesses.  www,,,,,,0.4842905655318948,,,,,,,,,,,,,
1231,materials services is one of the worlds leading millindependent materials distributors and service providers.  we offer our customers not only a wide range of materials and raw materials but also the associated services ranging from supply chain management to warehousing and logistics.  with around sites in more than countries we are present where our customers need us.  our core markets are north america and europe,,0.38684712301163243,,,,,,,,,,,,,,,,,
1260,the measures included the renego tiation of contracts with major customers the reduction of freight and energy costs and further site closures and restructuring measures.  special items most of the special items in the past fiscal year related to asset impairment losses at european companies.  other expenses were in connection with restructuring and the sale of two companies.  investments in line with its targets materials services invested particularly in north american growth projects and inaugurated a new service center each in mexico an d the usa in the past fiscal year,,,,,,,,0.4066338964197461,,,0.4975077069427136,,,,,,,,0.4138758505426946
