2160,fulfillment of the dnsh criteria in the performance of this economic activity was reviewed in accordance with the procedures and verification documents outlined in the specific sections.  dnsh criteria climate change adaptation the dnsh criteria relating to climate change ad aptation require the performance of a climate risk and vulnerability analysis and the assessment and possible implementation of adaptation solutions that can mitigate the climate risks identified.  in the case of business activities that are considered in the screening procedure for taxonomy alignment in a reporting year the climate risk potential is analyzed for sites of relevance to the performance of these activities on the basis of climate scenarios such as representative concentration pathways rcp.  and rcp,0.3235692674209495,,,,,,,,,,,,,,,,,,
2167,on the basis of the climate risk analyses and vulnerability assessments adaptation solutions to mitigate potential climate risks are assessed on a sitebysite basi s and implemented if necessary.  dnsh criteria sustainable use and protection of water and marine resources the dnsh criteria relating to sustainable use and protection of water and marine resources require an assessment of the risks relating to water quality and the avoidance of water shortages as well as the elimination of such risks if these have not already been identified and eliminated in the environmental impact assessments pursuant to directive eu.  for operations in third countries risks analyses of this type must be performed in accordance with the applicable national laws or international standards with the proviso that the aspirational level for good quality water resources is comparable to that of the european regulations.  in the case of business activities that are considered in the screening procedure for taxonomy alig nment in a reporting year suitable evidence is obtained for the sites of relevance to the performance of these activities on the basis of which it can be established that such risk analyses have been performed and any necessary mitigation measures have been implemented,0.3103025611124399,,,,0.4463872901858354,,,,,,,,,,,,,,
2168,dnsh criteria sustainable use and protection of water and marine resources the dnsh criteria relating to sustainable use and protection of water and marine resources require an assessment of the risks relating to water quality and the avoidance of water shortages as well as the elimination of such risks if these have not already been identified and eliminated in the environmental impact assessments pursuant to directive eu.  for operations in third countries risks analyses of this type must be performed in accordance with the applicable national laws or international standards with the proviso that the aspirational level for good quality water resources is comparable to that of the european regulations.  in the case of business activities that are considered in the screening procedure for taxonomy alig nment in a reporting year suitable evidence is obtained for the sites of relevance to the performance of these activities on the basis of which it can be established that such risk analyses have been performed and any necessary mitigation measures have been implemented.  such evidence includes for example operating permits preliminary reviews in respect of environmental impact assessments or the environmental impact assessments themselves environmental audits or specific risk analyses in respect of th e requirements described in this section,0.3328752342580546,,,,0.5084558090927526,,,,,,,,,,,,,,
2169,for operations in third countries risks analyses of this type must be performed in accordance with the applicable national laws or international standards with the proviso that the aspirational level for good quality water resources is comparable to that of the european regulations.  in the case of business activities that are considered in the screening procedure for taxonomy alig nment in a reporting year suitable evidence is obtained for the sites of relevance to the performance of these activities on the basis of which it can be established that such risk analyses have been performed and any necessary mitigation measures have been implemented.  such evidence includes for example operating permits preliminary reviews in respect of environmental impact assessments or the environmental impact assessments themselves environmental audits or specific risk analyses in respect of th e requirements described in this section.  thyssenkrupp annual report combined management report eu taxonomy dnsh criteria transition to a circular economy as a rule the dnsh criteria in respect of transition to a circular economy require an assessment of the availability and where feasible adoption of techniques that support the following practices use of secondary raw materials and reused components in manufactured products design for high durability recyclability easy disassembly and adaptability of products waste management that prioritizes recycling over disposal in the manufacturing process information on and traceability of substances of concern in products in the case of business activities that are considered in the screening procedure for taxonomy alignment in a reporting year suitable evidence is obtained for the sites of relevance to the performance of these activities on the basis of which it can be established that an asse ssment of the availability of processes in support of the circular economy has been performed or that such practices are already used in the context of this business activity,,,0.5256051458996454,,0.5001646170678087,,,,,,,,,,,,,,
2170,in the case of business activities that are considered in the screening procedure for taxonomy alig nment in a reporting year suitable evidence is obtained for the sites of relevance to the performance of these activities on the basis of which it can be established that such risk analyses have been performed and any necessary mitigation measures have been implemented.  such evidence includes for example operating permits preliminary reviews in respect of environmental impact assessments or the environmental impact assessments themselves environmental audits or specific risk analyses in respect of th e requirements described in this section.  thyssenkrupp annual report combined management report eu taxonomy dnsh criteria transition to a circular economy as a rule the dnsh criteria in respect of transition to a circular economy require an assessment of the availability and where feasible adoption of techniques that support the following practices use of secondary raw materials and reused components in manufactured products design for high durability recyclability easy disassembly and adaptability of products waste management that prioritizes recycling over disposal in the manufacturing process information on and traceability of substances of concern in products in the case of business activities that are considered in the screening procedure for taxonomy alignment in a reporting year suitable evidence is obtained for the sites of relevance to the performance of these activities on the basis of which it can be established that an asse ssment of the availability of processes in support of the circular economy has been performed or that such practices are already used in the context of this business activity .  such evidence includes for example operating permits compliance audits relating to waste disposal law environmental audits or productspecific documents that provide information about the composition of materials or other properties of the products manufactured in the course this business activity that are relevant to this matter,,,0.569269582849941,,0.45074716015032384,,0.45418290831157904,,,,,,,,,,,,
2171,such evidence includes for example operating permits preliminary reviews in respect of environmental impact assessments or the environmental impact assessments themselves environmental audits or specific risk analyses in respect of th e requirements described in this section.  thyssenkrupp annual report combined management report eu taxonomy dnsh criteria transition to a circular economy as a rule the dnsh criteria in respect of transition to a circular economy require an assessment of the availability and where feasible adoption of techniques that support the following practices use of secondary raw materials and reused components in manufactured products design for high durability recyclability easy disassembly and adaptability of products waste management that prioritizes recycling over disposal in the manufacturing process information on and traceability of substances of concern in products in the case of business activities that are considered in the screening procedure for taxonomy alignment in a reporting year suitable evidence is obtained for the sites of relevance to the performance of these activities on the basis of which it can be established that an asse ssment of the availability of processes in support of the circular economy has been performed or that such practices are already used in the context of this business activity .  such evidence includes for example operating permits compliance audits relating to waste disposal law environmental audits or productspecific documents that provide information about the composition of materials or other properties of the products manufactured in the course this business activity that are relevant to this matter.  dnsh criteria pollution prevention and control the dnsh criteria relating to pollution prevention and control require that economic activities do not lead to the manufacture placing on the market or use of substances or groups of substances whether on their own in mixtures or in articles that are subject to european regulation,,0.39988927914200323,0.6261597693729251,,0.5344705278419366,,0.45617006474459487,,,,,,,,,,,,
2172,thyssenkrupp annual report combined management report eu taxonomy dnsh criteria transition to a circular economy as a rule the dnsh criteria in respect of transition to a circular economy require an assessment of the availability and where feasible adoption of techniques that support the following practices use of secondary raw materials and reused components in manufactured products design for high durability recyclability easy disassembly and adaptability of products waste management that prioritizes recycling over disposal in the manufacturing process information on and traceability of substances of concern in products in the case of business activities that are considered in the screening procedure for taxonomy alignment in a reporting year suitable evidence is obtained for the sites of relevance to the performance of these activities on the basis of which it can be established that an asse ssment of the availability of processes in support of the circular economy has been performed or that such practices are already used in the context of this business activity .  such evidence includes for example operating permits compliance audits relating to waste disposal law environmental audits or productspecific documents that provide information about the composition of materials or other properties of the products manufactured in the course this business activity that are relevant to this matter.  dnsh criteria pollution prevention and control the dnsh criteria relating to pollution prevention and control require that economic activities do not lead to the manufacture placing on the market or use of substances or groups of substances whether on their own in mixtures or in articles that are subject to european regulation.  these include persistent organic pollutants listed in annexes i and ii to regulation eu mercury and mercury compounds or mercury mixtures as defined in article of regulation eu ozonedepleting substances as defined in annexes i and ii to regulation ec no,,,0.5964676664054009,,0.5328356651310967,,,,,,,,,,,,,,
2173,such evidence includes for example operating permits compliance audits relating to waste disposal law environmental audits or productspecific documents that provide information about the composition of materials or other properties of the products manufactured in the course this business activity that are relevant to this matter.  dnsh criteria pollution prevention and control the dnsh criteria relating to pollution prevention and control require that economic activities do not lead to the manufacture placing on the market or use of substances or groups of substances whether on their own in mixtures or in articles that are subject to european regulation.  these include persistent organic pollutants listed in annexes i and ii to regulation eu mercury and mercury compounds or mercury mixtures as defined in article of regulation eu ozonedepleting substances as defined in annexes i and ii to regulation ec no.  hazardous substances in electrical and electron ic appliances as defined annex ii to directive eu chemical substances as defined in annex xvii to regulation ec no,,,0.5504160245056661,,0.47429733977220684,,,,,,,,,,,,,,
2174,dnsh criteria pollution prevention and control the dnsh criteria relating to pollution prevention and control require that economic activities do not lead to the manufacture placing on the market or use of substances or groups of substances whether on their own in mixtures or in articles that are subject to european regulation.  these include persistent organic pollutants listed in annexes i and ii to regulation eu mercury and mercury compounds or mercury mixtures as defined in article of regulation eu ozonedepleting substances as defined in annexes i and ii to regulation ec no.  hazardous substances in electrical and electron ic appliances as defined annex ii to directive eu chemical substances as defined in annex xvii to regulation ec no.  substances in a concentration of more than,,,,,0.45110947354301334,,,,,,,,,,,,,,
2181,chemical substances as defined in annex xvii to regulation ec no.  are exempted if the conditions defined in that annex are complied with in full.  also exempted are substances in a concentration of more than .  percent by mass which satisfy the criteria defined in article of regulation ec no,,,,,,,,,,,,,,,0.40816902027432866,,,,
2182,are exempted if the conditions defined in that annex are complied with in full.  also exempted are substances in a concentration of more than .  percent by mass which satisfy the criteria defined in article of regulation ec no.  by at least months and were determined in accordance with article if it is established and documented that no suitable alternative substances or technologies are available and these substances are used under controlled conditions,,,,,,,,,,,,,,,0.3651768694194832,,,,
2183,also exempted are substances in a concentration of more than .  percent by mass which satisfy the criteria defined in article of regulation ec no.  by at least months and were determined in accordance with article if it is established and documented that no suitable alternative substances or technologies are available and these substances are used under controlled conditions.  thyssenkrupp annual report combined management report eu taxonomy in the case of business activities that are considered in the screening procedure for taxonomy alignment in a reporting year suitable evidence is obtained for the sites of relevance to the performance of these activities on the basis of which it can be established that none of the aforementioned substances on their own in mixtures or in articles are manufactured placed on the market or used or that this is done only in accordance with the ex emptions described above,,,0.48416988701686425,,,,,,,,,,,,,,,,
2185,by at least months and were determined in accordance with article if it is established and documented that no suitable alternative substances or technologies are available and these substances are used under controlled conditions.  thyssenkrupp annual report combined management report eu taxonomy in the case of business activities that are considered in the screening procedure for taxonomy alignment in a reporting year suitable evidence is obtained for the sites of relevance to the performance of these activities on the basis of which it can be established that none of the aforementioned substances on their own in mixtures or in articles are manufactured placed on the market or used or that this is done only in accordance with the ex emptions described above.  such evidence includes for example lists of substances with a clp classification in accordance with regulation ec no.  declarations of conformity safety data sheets and declarations of rohs compliance from the sites that perform the activities,,,0.47912195782374317,,,,,,,,,,,,,,,,
2187,such evidence includes for example lists of substances with a clp classification in accordance with regulation ec no.  declarations of conformity safety data sheets and declarations of rohs compliance from the sites that perform the activities.  dnsh criteria protection and restoration of biodiversity and ecosystems the dnsh criteria relating to protection and restoration of biodiversity and ecosystems require the completion of an environmental impact assessment or screening in accordance with directive eu together with the implementation of th e required mitigation and remedial measures resulting from the impact assessment or screening.  for activities located in or near biodiversitysensitive areas e,0.38122841908461536,,,,,,,,,,,,,,,,,,
2188,declarations of conformity safety data sheets and declarations of rohs compliance from the sites that perform the activities.  dnsh criteria protection and restoration of biodiversity and ecosystems the dnsh criteria relating to protection and restoration of biodiversity and ecosystems require the completion of an environmental impact assessment or screening in accordance with directive eu together with the implementation of th e required mitigation and remedial measures resulting from the impact assessment or screening.  for activities located in or near biodiversitysensitive areas e. g,0.3791427929655155,,,,,,,,,,,,,,,,,,
2189,dnsh criteria protection and restoration of biodiversity and ecosystems the dnsh criteria relating to protection and restoration of biodiversity and ecosystems require the completion of an environmental impact assessment or screening in accordance with directive eu together with the implementation of th e required mitigation and remedial measures resulting from the impact assessment or screening.  for activities located in or near biodiversitysensitive areas e. g.  the natura network of protected areas unesco world heritage sites and key biodiversity areas as well as other protected areas an appropriate assessment must be conducted in accordance with directives ec or eec and the necessary mitigation measures must have been implemented to avoid negative impacts on the protection objectives of such areas,0.39042923919160927,,,,,,,,,,,,,,,,,,
2190,for activities located in or near biodiversitysensitive areas e. g.  the natura network of protected areas unesco world heritage sites and key biodiversity areas as well as other protected areas an appropriate assessment must be conducted in accordance with directives ec or eec and the necessary mitigation measures must have been implemented to avoid negative impacts on the protection objectives of such areas.  in the case of activities in third countries these requirements must be implemented on the basis of comparable national laws or internat ional standards requiring the completion of an environmental impact assessment or sc reening,0.44639058339218446,,,,,,,,,,,,,,,,,0.29102565385255236,
2191,g.  the natura network of protected areas unesco world heritage sites and key biodiversity areas as well as other protected areas an appropriate assessment must be conducted in accordance with directives ec or eec and the necessary mitigation measures must have been implemented to avoid negative impacts on the protection objectives of such areas.  in the case of activities in third countries these requirements must be implemented on the basis of comparable national laws or internat ional standards requiring the completion of an environmental impact assessment or sc reening.  in the case of business activities that are considered in the screening procedure for taxonomy alignment in a reporting year suitable evidence is obtained for the sites of relevance on the basis of which it can be established that such assessments or screening have been completed and the necessary mitigation measures have been implemented,0.447313895838427,,,,,,,,,,,,,,,,,0.28163360388949693,
2192,the natura network of protected areas unesco world heritage sites and key biodiversity areas as well as other protected areas an appropriate assessment must be conducted in accordance with directives ec or eec and the necessary mitigation measures must have been implemented to avoid negative impacts on the protection objectives of such areas.  in the case of activities in third countries these requirements must be implemented on the basis of comparable national laws or internat ional standards requiring the completion of an environmental impact assessment or sc reening.  in the case of business activities that are considered in the screening procedure for taxonomy alignment in a reporting year suitable evidence is obtained for the sites of relevance on the basis of which it can be established that such assessments or screening have been completed and the necessary mitigation measures have been implemented.  such evidence includes for example operating permits preliminary reviews and environmental impact assessments environmental audi ts or specific risk analyses in respect of the requirements described above,0.4386060376556874,,,,,,,,,,,,,,,,,0.2843800798490687,
2193,in the case of activities in third countries these requirements must be implemented on the basis of comparable national laws or internat ional standards requiring the completion of an environmental impact assessment or sc reening.  in the case of business activities that are considered in the screening procedure for taxonomy alignment in a reporting year suitable evidence is obtained for the sites of relevance on the basis of which it can be established that such assessments or screening have been completed and the necessary mitigation measures have been implemented.  such evidence includes for example operating permits preliminary reviews and environmental impact assessments environmental audi ts or specific risk analyses in respect of the requirements described above.  compliance with the minimum safeguards article of the eu taxonomy specifies minimum safeguards that companies are required to fulfill in order to disclose taxonomyaligned turnover capital expenditure and operating expenditure,,,,,,,,,,,,,,,0.37535852401806435,,,,
2194,in the case of business activities that are considered in the screening procedure for taxonomy alignment in a reporting year suitable evidence is obtained for the sites of relevance on the basis of which it can be established that such assessments or screening have been completed and the necessary mitigation measures have been implemented.  such evidence includes for example operating permits preliminary reviews and environmental impact assessments environmental audi ts or specific risk analyses in respect of the requirements described above.  compliance with the minimum safeguards article of the eu taxonomy specifies minimum safeguards that companies are required to fulfill in order to disclose taxonomyaligned turnover capital expenditure and operating expenditure.  these require companies to have implemented procedures to ensure compliance with the oecd guidelines for multinational enterprises including the requirements for responsible business contact in the areas of taxes competition and fighting corruption the un guiding principles on business and human rights including the principles and rights set out in the declaration of the international labour organization on fundamental principles and rights at work and the international bill of human rights,,,,,,,0.4527999716052493,,,,,,,,0.3829253457724146,,,,
2195,such evidence includes for example operating permits preliminary reviews and environmental impact assessments environmental audi ts or specific risk analyses in respect of the requirements described above.  compliance with the minimum safeguards article of the eu taxonomy specifies minimum safeguards that companies are required to fulfill in order to disclose taxonomyaligned turnover capital expenditure and operating expenditure.  these require companies to have implemented procedures to ensure compliance with the oecd guidelines for multinational enterprises including the requirements for responsible business contact in the areas of taxes competition and fighting corruption the un guiding principles on business and human rights including the principles and rights set out in the declaration of the international labour organization on fundamental principles and rights at work and the international bill of human rights.  at thyssenkrupp the minimum standards for human and workers rights addressed in the eu taxonomy and the principles of good corporate governance are embedded in binding corporate policies and regulations such as the code of conduct the principles of compliance with human rights and due diligence obligations and the corporate gove rnance statement,,,,,,,,,,,,,,,0.38754203675192744,,,,
