3609,the amount of energy needed to deliver products and provide services is to be reduced without restricting the ability to deliver.  in addition components will be substituted so that the f ull energysaving potential can be leveraged components will be eliminated if they are incompatible with the goal of climate neutrality.  not all emissions will be entirely avoidable in the medium term.  one example is the materials services truck fleet in north america,,,,0.41992356506464273,,,,,,,,,,,,,,,
3628,recently adopted accounting standards in fiscal year thyssenkrupp adopted the following standards and amendments to already existing standards that did not have a material impact on the group financial statements ifrs insurance contracts issued in may including amendments to ifrs amendments to ifrs issued in june amendments to ias presentation of financial statements and ifrs practice statement disclosure of accounting policies is sued in february amendments to ias accounting policies changes in accounting estimates and errors definition of accounting estimates issu ed in february amendments to ias income taxes deferred tax related to assets and liabilities arising from a single transaction issued i n may amendments to ifrs insurance contracts.  initial application of ifrs and ifrs comparative information issued in december amendments to ias income taxes international tax reform pillar two model rules issued in may thyssenkrupp annual report group financial statements thyssenkrupp group notes to the financial statements issued accounting standards that have not been adopted in fiscal year the iasb has issued the following standards and amendments to standards whose application is not yet mandatory and which in par t require eu endorsement before they can be applied.  the group curr ently assumes that the application of these amendments of sta ndards will not have a material impact on the presentation of the consolidated financial statements amendments to ifrs consolidated financial statements and ias investments in associates and joint ventures sa le or contribution of assets between an investor and its associate or joint venture issued in september not yet endorsed initial application deferred indefinitely amendments to ias presentation of financial statements classification of liabilities as current or noncurrent issued in january and october respectively not yet endorsed expected initial application in fiscal year amendments to ifrs leases lease liability in a sale and leaseback issued in september not yet endorsed expected initial application in fiscal year amendments to ias statement of cash flows and ifrs financial instruments disclosures supplier finance arrangements issued in may not yet endorsed expected initial application in fiscal year amendments to ias the effects of changes in foreign exchange rates lack of exchangeability issued in august not yet endorsed expected initial application in fiscal year ifrs presentation and disclosure in financial statements is sued in april not yet endorsed expected initial applica tion in fiscal year ifrs subsidiaries without public accountability disclosures issued in mayi not yet endorsed expected initial appli cation would be in fiscal year but this standard does not have any relevance for the thyssenkrupp group amendments to ifrs and ifrs amendments to the classification and measurement of financial instruments issued in may not yet endorsed expected initial application in fiscal year amendments to ifrs ifrs ifrs ifrs and ias annual improvements to ifrs volume issued in july not yet endorsed expected initial application in fiscal year the firsttime application of ifrs is expected to have effects the specific extent is currently being analyzed although ea rly application is currently not expected.  thyssenkrupp annual report group financial statements thyssenkrupp group notes to the financial statements consolidated companies and equity interests composition of the scope of consolidation the changes in the scope of consolidation in fiscal years und respectively are presented in the table below acquisitionsdivestitures of businesses number of consolidated companies germany abroad totalbalance as of sept,,,,,,,,,,,,,,,,0.3423707246649119,,,
3629,initial application of ifrs and ifrs comparative information issued in december amendments to ias income taxes international tax reform pillar two model rules issued in may thyssenkrupp annual report group financial statements thyssenkrupp group notes to the financial statements issued accounting standards that have not been adopted in fiscal year the iasb has issued the following standards and amendments to standards whose application is not yet mandatory and which in par t require eu endorsement before they can be applied.  the group curr ently assumes that the application of these amendments of sta ndards will not have a material impact on the presentation of the consolidated financial statements amendments to ifrs consolidated financial statements and ias investments in associates and joint ventures sa le or contribution of assets between an investor and its associate or joint venture issued in september not yet endorsed initial application deferred indefinitely amendments to ias presentation of financial statements classification of liabilities as current or noncurrent issued in january and october respectively not yet endorsed expected initial application in fiscal year amendments to ifrs leases lease liability in a sale and leaseback issued in september not yet endorsed expected initial application in fiscal year amendments to ias statement of cash flows and ifrs financial instruments disclosures supplier finance arrangements issued in may not yet endorsed expected initial application in fiscal year amendments to ias the effects of changes in foreign exchange rates lack of exchangeability issued in august not yet endorsed expected initial application in fiscal year ifrs presentation and disclosure in financial statements is sued in april not yet endorsed expected initial applica tion in fiscal year ifrs subsidiaries without public accountability disclosures issued in mayi not yet endorsed expected initial appli cation would be in fiscal year but this standard does not have any relevance for the thyssenkrupp group amendments to ifrs and ifrs amendments to the classification and measurement of financial instruments issued in may not yet endorsed expected initial application in fiscal year amendments to ifrs ifrs ifrs ifrs and ias annual improvements to ifrs volume issued in july not yet endorsed expected initial application in fiscal year the firsttime application of ifrs is expected to have effects the specific extent is currently being analyzed although ea rly application is currently not expected.  thyssenkrupp annual report group financial statements thyssenkrupp group notes to the financial statements consolidated companies and equity interests composition of the scope of consolidation the changes in the scope of consolidation in fiscal years und respectively are presented in the table below acquisitionsdivestitures of businesses number of consolidated companies germany abroad totalbalance as of sept.  additions disposals balance as of sept,,,,,,,,,,0.35354283541113984,,,,,,0.34958575439106415,,,
3652,one of the structured ent ities is a special purpose leasing company established to realize the second construction phase of the thyssenkrupp quarter.  the lease obj ect and the corresponding liabilities are included in the consolidated financial statements.  there are no obligations to provide financ ial support.  the two other structured entities do not have a material influence on the groups net assets financial position and results of operations,,,,0.4125421305970574,,,,,,,,,,,,,,,
3667,as a result the assets and liabilities of the disposal group were reported separately in the line items assets held fo r sale and liabilities associated with assets held for sale in the statement of financial position as of september .  the contract for the sale of the indian electrical steel business to jsw steel limited and jfe steel corporation an indojapan ese consortium was signed on october see also note .  the aim is to close the transaction within the coming months.  in connection with the divestment process initiated a review of the valuation of the assets in accordance with ias was cond ucted immediately before the firsttime classificati on as a disposal group,,,,,,0.4142214963324255,,,,,,,,,,,,,
3670,in connection with the divestment process initiated a review of the valuation of the assets in accordance with ias was cond ucted immediately before the firsttime classificati on as a disposal group.  this resulted in a reversal of impairments totaling m illion because the fair value less the costs of disposal is higher than the carrying amount.  of this amount million relate to land and bui ldings million to technical machinery and equipment and million to factory and office equipment.  it is reported in the cost of sales in the th quarter of at the same time deferred taxes of million were recognized,,,,,0.44883102392050056,,,,,,,,,,,,,,
3671,this resulted in a reversal of impairments totaling m illion because the fair value less the costs of disposal is higher than the carrying amount.  of this amount million relate to land and bui ldings million to technical machinery and equipment and million to factory and office equipment.  it is reported in the cost of sales in the th quarter of at the same time deferred taxes of million were recognized.  the assets and liabilities that comprised the disposal group as of september are shown in the following table,,,,,0.4902347724000059,,,,,,,,,,,,,,
3672,of this amount million relate to land and bui ldings million to technical machinery and equipment and million to factory and office equipment.  it is reported in the cost of sales in the th quarter of at the same time deferred taxes of million were recognized.  the assets and liabilities that comprised the disposal group as of september are shown in the following table.  the cum ulative other comprehensive income in the equity allocated to the disposal group amounted to million as of september,,,,,0.5110062539047949,,,0.3974190682467503,,,,,,,,,,,
3685,following the firsttime classifi cation as a disposal group the measuremen t of the disposal group at fair value le ss the costs of disposal resulted in impairment losses of million in respect of intangible assets.  the impairment losses were reported in other expenses in the st quarter of .  in the nd quarter of the subsequent measurement of the disposal group at fair value less the costs of disposal resulted in further impairment losses of million which related to intangible assets and were reported in other expenses.  in both quarters the nonrecurring measurement at fair value less the costs of disposal was based on the negot iated purchase price,,,,,0.471849416799781,,,,,,,,,,,,,,
3744,thereof million relates to technical machine ry and equipment million to construction in progress million to buildings million to land million to other equipmen t factory and office equipment million to development costs and million to other intangible assets.  impairment losses of million were recorded in the cost of sales million in general and administrative expenses million in selling expenses and millio n in research and development cost.  the underlying value in use is based on the assumptions current at that time for the course of business u ntil taking into account the effects of the initiated green transformation.  a simplified extrapolation is then carried out unt il,,,,,,0.40195121800491324,,,,,,,,,,,,,
3758,in connect ion with the green transformation the economic effects expected from the ongo ing construction of the first direct reduction plant and the c urrent and expected future legal and economic conditions e. g.  trading in co allowances were considered particularly in the cash flows used for impairment testing.  of the impairment losses of million million relate to construction in progress million to technical machinery and equipment million to other equipment factory and office equipment million to buildings million to land million to development costs and million to other intangible assets,0.318043814638312,,,,,,,,,,,,,,,,,,
3761,of the impairment losses of million million relate to construction in progress million to technical machinery and equipment million to other equipment factory and office equipment million to buildings million to land million to development costs and million to other intangible assets.  impairment losses of million were recorded in t he cost of sales million in general and administrative expenses mi llion in selling expenses and million in research and devel opment cost.  due to the minimum carrying amount specified in ias .  million of the impairment losses calculated could not be recognized,,,,,,0.43152276034523984,,,,,,,,,,,,,
3769,impairments in the materials services segment including impairments on corporate assets in the st quarter ended december due to the decline in demand in the warehousing business caused especially by the w eak german economy and the asso ciated lower expectations for the future result of operations it was necessary to recognize impairm ent losses of million in the materials germany business field in the distribution services business unit of the materials servi ces segment.  thereof million related to technical machinery and equipment million to buildings and million to development costs that were recognized in selling expenses.  the recoverable amount relevant for determining the respective impairment loss is the value in use for which a discount rate after tax of .  was applied,,,,,,,0.4450522002913252,,,,,,,,,,,,0.4225810755400646
3770,thereof million related to technical machinery and equipment million to buildings and million to development costs that were recognized in selling expenses.  the recoverable amount relevant for determining the respective impairment loss is the value in use for which a discount rate after tax of .  was applied.  the value in use amounts to a total of million,,,,,,0.4054264501081561,,,,,,0.3669345189599489,,,,,,,
3773,the value in use amounts to a total of million.  moreover impairment testing in the materials services segment in the nd quarter ended march identified the need for impairment in the warehousing business in germany the uk and hu ngary and in the automotiverelated service centers in germany.  in the warehousing business impairment losses totaling million were recognized.  thereof million relate to technical machiner y and equipment million to other equipment factory and office equipment and million to development costs that were recogniz ed in selling expenses,,,0.48286239154730975,,,,0.4486278978330872,,,,,,,,,,,,
3775,in the warehousing business impairment losses totaling million were recognized.  thereof million relate to technical machiner y and equipment million to other equipment factory and office equipment and million to development costs that were recogniz ed in selling expenses.  the impairment losses were mainly due to the lower earnings expectations resulting from a decline in demand c aused by the gloomy economic situation.  the recoverable amount relevant for determining the impairment loss is the value in use which a mounts to million million and million for the cashgenerating units materials germany materials uk and materials hungary and for which countryspecific discount rates after tax of,,,,,,,0.49016580087332146,,,,,,,,,,,,
3831,thereof million relate to technical ma chinery and equipment million to real estate and buildings million to construction in progress and million to intangible as sets.  the largest part of the impairment loss was recognized for the copparo production site in italy.  the recoverable amount relevant fo r determining the impairment loss is the value in use which amounts to a total of million and for which a discount rate af ter tax of .  was applied,,,,,,0.4116209890413874,,,,,,,,,,,,,
3837,thereof million relate to technical machinery and equip ment and million to other equipment factory and office equipment.  the recoverable amount relevant for determining the impairment loss is the value in use of million for which a discount rate after tax of .  was applied.  due to the minimum carrying amount specified in ias,,,,,,0.40736009070284407,,,,,,,,,,,,,
3859,of this amount mi llion relates to technical machinery and equipment million to construction in progress million to buildings million to other equipment factory and office equipment million to development costs and million to other intangible assets.  furthermore this resulted in an impairment loss of million on corporate as sets that are assigned to special units.  the underlying value in use is based on a range of scenarios for the future business development.  th e results of the scenarios were weighted using probabilities that reflect th e current management assessment,,,,,,0.4547091703811701,,,,,,,,,,,,,
3925,the total fair value of this investment property is million prior year million thereof million prior year million are assigned to level and million prior year million are assigned to level valuations methods of the fair value hier archy.  of the fair value million prior year million are based on valuations of external appraisers.  investments accounted for using the equity method and joint operation investments accounted for using the equity method with the exception of the share of the investment in tk elevator which is accounted for using the equity method see note the investments accounted for using the equity method are on an individual basis immaterial.  the carrying amount of associates is million prior year million and of joint ventures is million prior year million,,,,,,0.42598300628077207,,,,,,0.40623504201666993,,,,,,,
3935,. r. l.  and participates in significant decisionmaking processes,,,,,,,,,,,,,,,0.3654014179984974,,,,
4003,sept.  raw materials production supplies work in progress finished products merchandise total inventories of million prior year million have a remaining term of more than one year.  inventories of million prior year million are recognized as an expense during the period.  pricerelated writedowns of inventories amounting to million are included in the cost of sales prior year writeups of inventories of million,,,,,,,0.4444158581578449,0.39470774048564305,,,,,,,,,,,
4004,raw materials production supplies work in progress finished products merchandise total inventories of million prior year million have a remaining term of more than one year.  inventories of million prior year million are recognized as an expense during the period.  pricerelated writedowns of inventories amounting to million are included in the cost of sales prior year writeups of inventories of million.  trade accounts receivable trade accounts receivable in the amount of million prior year million have a remaining term of more than one year,,,,,,,0.480796072581211,0.4347529103222792,,,,,,,,,,,
4017,assets and liabilities from contracts with customers as of september the groups current assets include contract assets in the amount of million prior year million adjusted see note of these million prior year million adjusted have a remaining term of more than one year.  in the fiscal year impairment losses on contract assets were reco gnized in the amount of million prior year million under selling expenses.  the decrease in contract assets in the reportin g year resulted mainly from the deconsolidation of thyssenkrup p industries india in the decarbon technologies segment from lower order costs in the plant construction business in the automotive technol ogy segment and from currency translation.  as of september the groups current liabilities include contract liabilities in the amount of million prior y ear million adjusted see note of these million prior year million adjusted have a remaining term of more than one year,,,,,,0.4155434773107956,,,,,,,,,,,,,
4018,in the fiscal year impairment losses on contract assets were reco gnized in the amount of million prior year million under selling expenses.  the decrease in contract assets in the reportin g year resulted mainly from the deconsolidation of thyssenkrup p industries india in the decarbon technologies segment from lower order costs in the plant construction business in the automotive technol ogy segment and from currency translation.  as of september the groups current liabilities include contract liabilities in the amount of million prior y ear million adjusted see note of these million prior year million adjusted have a remaining term of more than one year.  the increase in contract liabilities related mainly to the plant construction business in the marine systems segment here an increase in cumulatively recorded customer advance payments was offset by a lower increase in cumulatively recorded contract co sts and results,,,,,,0.4098898951916195,,,,,,,,,,,,,
4020,as of september the groups current liabilities include contract liabilities in the amount of million prior y ear million adjusted see note of these million prior year million adjusted have a remaining term of more than one year.  the increase in contract liabilities related mainly to the plant construction business in the marine systems segment here an increase in cumulatively recorded customer advance payments was offset by a lower increase in cumulatively recorded contract co sts and results.  the deconsolidation of thyssenkrupp industries india in the decarbon technologies segment had a particularly opposite effect.  in the course of the fiscal year sales in the amount of million prior year million was recognized which was included in the contract liability balance at the beginning of the fiscal year,,,,,,0.42408432298166404,,,,,,,,,,,,,
4021,the increase in contract liabilities related mainly to the plant construction business in the marine systems segment here an increase in cumulatively recorded customer advance payments was offset by a lower increase in cumulatively recorded contract co sts and results.  the deconsolidation of thyssenkrupp industries india in the decarbon technologies segment had a particularly opposite effect.  in the course of the fiscal year sales in the amount of million prior year million was recognized which was included in the contract liability balance at the beginning of the fiscal year.  in the fiscal year sales from performance obligations satisfied or partly satisfied in earlier periods amounted to million prior year million,,,,,,0.44897369188845204,,,,,,,,,,,,,
4029,million for fiscal year after total other financial assets other financial assets sept.  sept.  million current noncurrent current noncurrentmiscellaneous other financial assets equity instruments debt instruments derivatives not qualifying for hedge accounting derivatives qualifying for hedge accounting total miscellaneous other financial assets mainly include receivables in connection with agent activities claims from bonuses and di scounts and receivables from price adjustments.  other financial assets in the amount of million prior ye ar million have a remaining term of more than one year,,,,,,,,,,,0.4907923859397711,,,,,,,,
4030,sept.  million current noncurrent current noncurrentmiscellaneous other financial assets equity instruments debt instruments derivatives not qualifying for hedge accounting derivatives qualifying for hedge accounting total miscellaneous other financial assets mainly include receivables in connection with agent activities claims from bonuses and di scounts and receivables from price adjustments.  other financial assets in the amount of million prior ye ar million have a remaining term of more than one year.  as of september cumulative impairments amount to million prior year million regarding current other financial asset s and million prior year million regarding noncurrent other financial assets,,,,,,,,,,,0.5007043321534217,0.3506374387925823,,,,,,,
4031,million current noncurrent current noncurrentmiscellaneous other financial assets equity instruments debt instruments derivatives not qualifying for hedge accounting derivatives qualifying for hedge accounting total miscellaneous other financial assets mainly include receivables in connection with agent activities claims from bonuses and di scounts and receivables from price adjustments.  other financial assets in the amount of million prior ye ar million have a remaining term of more than one year.  as of september cumulative impairments amount to million prior year million regarding current other financial asset s and million prior year million regarding noncurrent other financial assets.  other nonfinancial assets other nonfinancial assets sept,,,,,,,,,,,0.510660337427855,0.36569227244663666,,,,,,,
4034,other nonfinancial assets other nonfinancial assets sept.  sept.  million current noncurrent current noncurrentadvance payments on intangible assets advance payments property plant equiment ppe advance payments right of use assets advance payments to suppliers of inventories an d to other current nonfinancial assets prepayments miscellaneous total thyssenkrupp annual report group financial statements thyssenkrupp group notes to the financial statements other nonfinancial assets in the amount of million prior year million have a remaining term of more than one year .  as of september cumulative impairments amount to million prior year million regarding current other nonfinancial assets and million prior year million regarding noncurrent other nonfinancial assets,,,,,,,,,,,,,,,,,,,0.4096358819455511
