2862,a rebudgeting was performed in respect of the costs of constructing the direct reduction plant this identified possible additional costs.  the risk management system that has been implemented identifies financial risks in a timely manner and continuously monitors the construction costs.  in parallel mitigation measures are identified and initiated.  to reduce business interruption risks and improve fire safety funds are made available for ongoing preventive maintenance and for modernization and investment,,,,0.3953126472404413,,0.4014952058194773,,,,,,,,,,,,,
2863,the risk management system that has been implemented identifies financial risks in a timely manner and continuously monitors the construction costs.  in parallel mitigation measures are identified and initiated.  to reduce business interruption risks and improve fire safety funds are made available for ongoing preventive maintenance and for modernization and investment.  there are business continuity plans and emergency and crisis plans to deal with possible business interr uptions,,,,,,0.5045148846962471,,,,,,0.33963923545568125,,,,,,,
2865,to reduce business interruption risks and improve fire safety funds are made available for ongoing preventive maintenance and for modernization and investment.  there are business continuity plans and emergency and crisis plans to deal with possible business interr uptions.  these set out measures to remedy the damage.  the segment has integrated a business and technical risk controlling system for property insurance into its risk management process,,,,0.40552290751572895,,,,,,,0.49764871596091004,0.3726828676805364,,,,,,,
2866,there are business continuity plans and emergency and crisis plans to deal with possible business interr uptions.  these set out measures to remedy the damage.  the segment has integrated a business and technical risk controlling system for property insurance into its risk management process.  the move towards an energy system dominated by renewables in germany is creating major additional challenges and costs for energyintensive industries in general and the steel sector in particular,,,,0.4340362199395039,,,,,,,,,,,,,,,
2867,these set out measures to remedy the damage.  the segment has integrated a business and technical risk controlling system for property insurance into its risk management process.  the move towards an energy system dominated by renewables in germany is creating major additional challenges and costs for energyintensive industries in general and the steel sector in particular.  for its green transformation the steel industry needs to be able to rely on the availability of sufficient quantities of electricity and hydrogen from renewable resources at competitive prices at all times,,,,0.4270341721631899,,,,,,,,,,,,,,,
2868,the segment has integrated a business and technical risk controlling system for property insurance into its risk management process.  the move towards an energy system dominated by renewables in germany is creating major additional challenges and costs for energyintensive industries in general and the steel sector in particular.  for its green transformation the steel industry needs to be able to rely on the availability of sufficient quantities of electricity and hydrogen from renewable resources at competitive prices at all times.  we are actively monitoring the current debate on budget regulatory and distribution policy by way of the federal network agency white paper on the development of industry network charges and the white paper formulated by the federal ministry for economic affairs and climate action on the electricity market of the future,,,,0.4929933595928327,,,,,,,,,,,,,,,
2869,the move towards an energy system dominated by renewables in germany is creating major additional challenges and costs for energyintensive industries in general and the steel sector in particular.  for its green transformation the steel industry needs to be able to rely on the availability of sufficient quantities of electricity and hydrogen from renewable resources at competitive prices at all times.  we are actively monitoring the current debate on budget regulatory and distribution policy by way of the federal network agency white paper on the development of industry network charges and the white paper formulated by the federal ministry for economic affairs and climate action on the electricity market of the future.  these are of central importance to our energyintensive industry and will substantially affect competitiveness plannability cost distribution the green transformation and the longterm reliability of energy supplies,,,,0.44596798528608084,,,,,,,,,,,,,,,
2870,for its green transformation the steel industry needs to be able to rely on the availability of sufficient quantities of electricity and hydrogen from renewable resources at competitive prices at all times.  we are actively monitoring the current debate on budget regulatory and distribution policy by way of the federal network agency white paper on the development of industry network charges and the white paper formulated by the federal ministry for economic affairs and climate action on the electricity market of the future.  these are of central importance to our energyintensive industry and will substantially affect competitiveness plannability cost distribution the green transformation and the longterm reliability of energy supplies.  on the polit ical front we are advocating for competitive electricity prices to safeguard the economic stab ility and future viability of the industry,,,,0.4364013302577405,,,,,,,,,,,,,,,
2871,we are actively monitoring the current debate on budget regulatory and distribution policy by way of the federal network agency white paper on the development of industry network charges and the white paper formulated by the federal ministry for economic affairs and climate action on the electricity market of the future.  these are of central importance to our energyintensive industry and will substantially affect competitiveness plannability cost distribution the green transformation and the longterm reliability of energy supplies.  on the polit ical front we are advocating for competitive electricity prices to safeguard the economic stab ility and future viability of the industry.  following the adoption of the german governments revised national hydrogen strategy there are plans to implement numerous initiatives,,,,0.4384393720964018,,,,,,,,,,,,,,,
2872,these are of central importance to our energyintensive industry and will substantially affect competitiveness plannability cost distribution the green transformation and the longterm reliability of energy supplies.  on the polit ical front we are advocating for competitive electricity prices to safeguard the economic stab ility and future viability of the industry.  following the adoption of the german governments revised national hydrogen strategy there are plans to implement numerous initiatives.  for the core h network it is important to realize all relevant connection and supply lines in due time,,,,0.4456725969336627,,,,,,,,,,,,,,,
2873,on the polit ical front we are advocating for competitive electricity prices to safeguard the economic stab ility and future viability of the industry.  following the adoption of the german governments revised national hydrogen strategy there are plans to implement numerous initiatives.  for the core h network it is important to realize all relevant connection and supply lines in due time.  a further risk exists in the delay in connecting neighboring european countries to germanys core h network such that international supplies can no longer be synchronized with the hydrogen rampup of the direct reduction plant,,,,0.40791796272265834,,,,,,,,,,,,,,,
2886,all measures have to be validated by an authorized external auditor.  for us this means adapting the processes of our energy management system.  to implement this we are consulting external advisors and working closely with the responsible certification bodies.  if our measures are not recognized by the relevant authorities there is a risk that we could lose any funding that we have already received,,,,0.4243430619520242,,,,,,,,,,,,,,,
2887,for us this means adapting the processes of our energy management system.  to implement this we are consulting external advisors and working closely with the responsible certification bodies.  if our measures are not recognized by the relevant authorities there is a risk that we could lose any funding that we have already received.  marine systems to limit technical and timing risks in the past fiscal year we initiated a project aimed at strengthening order execution by the individual business units,,,,0.4260654796775395,,,,,,,,,0.42215565940964983,,,,,,
2888,to implement this we are consulting external advisors and working closely with the responsible certification bodies.  if our measures are not recognized by the relevant authorities there is a risk that we could lose any funding that we have already received.  marine systems to limit technical and timing risks in the past fiscal year we initiated a project aimed at strengthening order execution by the individual business units.  in respect of risk management we placed the focus on the operating units in order to safeguard our production capability in the long term,,,,,,,,,,,,,0.4098560916099064,,,,,,
2908,amendments to the ar ticles of association are subject to the approval of the annual general meeting with a majority of at least three qu arters of the capital stock represented ff.  aktg apply.  under of the articles of association the supervisory board is authorized to resolve amendments to the articles of association which relate only to their wording.  the annual general meeting recently amended of the articl es of association and resolved to increase the compensation of supervisory board memb ers unchanged sinc e fiscal year to an appropriate level in line with market standards on the basis of an external benchmark comparison,,,,,,,,,,,,,,,0.39828098355575586,,,,
2913,the shareholders are in principle entitled to subscription rights.  however with the approval of the supervisory board the executive board is authorized to exclude shareholder subscription rights in certain circumstances and within defined limits for example in the event of capital increases in exchange for contributions in kind or cash if the issue price is not significantly lower than the stock market price of already listed shares.  the pro rata amount of the shares issued under this authorization with the exclusion of shareholders subscription rights may not exceed of the total capital stock.  if i use is made of other authorizations to issue or sell shares with the exc lusion of subscription rights during the term of this authorization or ii shares are issued or to be issued to service rights arising from other thyssenkrupp annual report combined management report takeoverrelated disclosures authorizations that confer a right or obligation to purchase shares these shares are counted towards this limit,,,,,,,,,,0.346013376155751,,,,,,,,,
2914,however with the approval of the supervisory board the executive board is authorized to exclude shareholder subscription rights in certain circumstances and within defined limits for example in the event of capital increases in exchange for contributions in kind or cash if the issue price is not significantly lower than the stock market price of already listed shares.  the pro rata amount of the shares issued under this authorization with the exclusion of shareholders subscription rights may not exceed of the total capital stock.  if i use is made of other authorizations to issue or sell shares with the exc lusion of subscription rights during the term of this authorization or ii shares are issued or to be issued to service rights arising from other thyssenkrupp annual report combined management report takeoverrelated disclosures authorizations that confer a right or obligation to purchase shares these shares are counted towards this limit.  with the approval of the supervisory board to issue once or several times in installments including simultaneously in different tranches bearer or registered warrant andor convertible bonds participation rights andor participating bonds and combinations of these instruments with a total par value of up to billion with or without limited terms and in the case of warrant andor convertible bonds to grant or impose on their holders or creditors option or conversion rights or option or conversion obligations for nopar bearer shar es of thyssenkrupp ag with a total share of the capital stock of up to million in accordance with the conditions of these bonds,,,,,,,,,,0.36313549958370195,,,,,,,,,
2915,the pro rata amount of the shares issued under this authorization with the exclusion of shareholders subscription rights may not exceed of the total capital stock.  if i use is made of other authorizations to issue or sell shares with the exc lusion of subscription rights during the term of this authorization or ii shares are issued or to be issued to service rights arising from other thyssenkrupp annual report combined management report takeoverrelated disclosures authorizations that confer a right or obligation to purchase shares these shares are counted towards this limit.  with the approval of the supervisory board to issue once or several times in installments including simultaneously in different tranches bearer or registered warrant andor convertible bonds participation rights andor participating bonds and combinations of these instruments with a total par value of up to billion with or without limited terms and in the case of warrant andor convertible bonds to grant or impose on their holders or creditors option or conversion rights or option or conversion obligations for nopar bearer shar es of thyssenkrupp ag with a total share of the capital stock of up to million in accordance with the conditions of these bonds.  the bonds can be issued in exchange for cash andor contributions in kind,,,,,,,,,,0.34548927078470015,,,,,,,,,
2916,if i use is made of other authorizations to issue or sell shares with the exc lusion of subscription rights during the term of this authorization or ii shares are issued or to be issued to service rights arising from other thyssenkrupp annual report combined management report takeoverrelated disclosures authorizations that confer a right or obligation to purchase shares these shares are counted towards this limit.  with the approval of the supervisory board to issue once or several times in installments including simultaneously in different tranches bearer or registered warrant andor convertible bonds participation rights andor participating bonds and combinations of these instruments with a total par value of up to billion with or without limited terms and in the case of warrant andor convertible bonds to grant or impose on their holders or creditors option or conversion rights or option or conversion obligations for nopar bearer shar es of thyssenkrupp ag with a total share of the capital stock of up to million in accordance with the conditions of these bonds.  the bonds can be issued in exchange for cash andor contributions in kind.  the executive board is authorized with the approval of the supervisory board to exclude shareholder subscription rights in certain circumstances and within defined limits for example if the bonds are issued in exchange for contributions in kind or cash if the issue price of the bonds is not significantly lower than their theoretical fair value,,,,,,,,,,0.3390951338510009,,,,,,,,,
2918,the bonds can be issued in exchange for cash andor contributions in kind.  the executive board is authorized with the approval of the supervisory board to exclude shareholder subscription rights in certain circumstances and within defined limits for example if the bonds are issued in exchange for contributions in kind or cash if the issue price of the bonds is not significantly lower than their theoretical fair value.  the pro rata amount of the shares to be issued in accordance with this authorization with the exclusion of shareholder subscription rights on the basis of option or conversions rights or option or conversion obligations may not exceed of the total capital stock.  if i use is made of other authorizations to issue or sell shares with the exc lusion of subscription rights during the term of this authorization or ii shares are issued or to be issued to service rights arising from other authorizations that confer a right or obligation to purchase shares these shares are counted towards this limit,,,,,,,,,,0.3633106172036926,,,,,,,,,
2919,the executive board is authorized with the approval of the supervisory board to exclude shareholder subscription rights in certain circumstances and within defined limits for example if the bonds are issued in exchange for contributions in kind or cash if the issue price of the bonds is not significantly lower than their theoretical fair value.  the pro rata amount of the shares to be issued in accordance with this authorization with the exclusion of shareholder subscription rights on the basis of option or conversions rights or option or conversion obligations may not exceed of the total capital stock.  if i use is made of other authorizations to issue or sell shares with the exc lusion of subscription rights during the term of this authorization or ii shares are issued or to be issued to service rights arising from other authorizations that confer a right or obligation to purchase shares these shares are counted towards this limit.  furthermore the executive board is authorized to conditionally increase the capital stock by up to million by issuing up to nopar bearer shares conditional capital,,,,,,,,,,0.38704699393310443,,,,,,,,,
2921,if i use is made of other authorizations to issue or sell shares with the exc lusion of subscription rights during the term of this authorization or ii shares are issued or to be issued to service rights arising from other authorizations that confer a right or obligation to purchase shares these shares are counted towards this limit.  furthermore the executive board is authorized to conditionally increase the capital stock by up to million by issuing up to nopar bearer shares conditional capital.  the conditional capital may only be used to the extent that the holders or creditors of warrant andor convertible bonds participation rights participat ing bonds and combinations of these instruments issued by thyssenkrupp ag or a group company up to february use their conversion a n d o r o p t i o n r i g h t s o r i f t h e c o m p a n y e x e r c i s e s a n o p t i o n t o g r a n t n o p a r s h a r e s o f thyssenkrupp ag in whole or in part instead of payment of the cash price.  to purchase and use treasury shares representing a pro rata amount of up of the total capital stock existing at the time of the resolution or if th is value is lower at the time the authorization is exercised for all purposes explicitly permitted by the resolution and all legally permitted purposes,,,,,,,,,,0.33892266937175203,,,,,,,,,
2924,to purchase and use treasury shares representing a pro rata amount of up of the total capital stock existing at the time of the resolution or if th is value is lower at the time the authorization is exercised for all purposes explicitly permitted by the resolution and all legally permitted purposes.  the executive board was authorized in certain cases to exclude tender rights when purchasing treasury shares and shareh older subscription rights in the use of treasury shares.  the resolution also includes an authorization to use derivatives put options call options forward purchase agreements or combinations thereof when undertakin g purchases of treasury shares and to exclude tender and subscription rights.  the executive board is authorized to use shares in the company for example to sell them with the approval of the supervisory board in exchange for cash if the selling price is not significantly lower than the stoc k market price for the shares at the time of sale and the arithmetic share of the capital stock of the shares used in this way does not exceed of the capital stock,,,,,,,,,,0.3449092897291127,,,,,,,,,
2952,the declarations of conformity are available on the subsidiaries websites.  compensation system and co mpensation of executive board members the compensation system for members of the executive board which was approved by the annual general meeting on february with a majority of .  of the capital represented and the compensation reports for the previous year s including in each case the associated audit opinion and the last resolutions of the annual general meeting on the compensation system and compensation report are available on our website.  the compensation report in accordance with aktg for fiscal year can be found in the corresponding section of this annual report,,,,,,,,,,0.3409696324578553,,,,,,0.33178802372560084,,,
2953,compensation system and co mpensation of executive board members the compensation system for members of the executive board which was approved by the annual general meeting on february with a majority of .  of the capital represented and the compensation reports for the previous year s including in each case the associated audit opinion and the last resolutions of the annual general meeting on the compensation system and compensation report are available on our website.  the compensation report in accordance with aktg for fiscal year can be found in the corresponding section of this annual report.  in light of the planned presentation of the execut ive board compensation system to the annual general meeting for resolution on its approval the supervisory board and its personnel committee reviewed the current executive board compensation system in respect of any necessary or meaningful amendments,,,,,,,,,,,,,,,,0.3379530233129134,,,
2954,of the capital represented and the compensation reports for the previous year s including in each case the associated audit opinion and the last resolutions of the annual general meeting on the compensation system and compensation report are available on our website.  the compensation report in accordance with aktg for fiscal year can be found in the corresponding section of this annual report.  in light of the planned presentation of the execut ive board compensation system to the annual general meeting for resolution on its approval the supervisory board and its personnel committee reviewed the current executive board compensation system in respect of any necessary or meaningful amendments.  at its meeting on september the supervisory board approved a reviewed and optimized executive board compensation system effective october and for firsttime application for fiscal year,,,,,,,,,,,,,,,,0.34712960007214105,,,
2955,the compensation report in accordance with aktg for fiscal year can be found in the corresponding section of this annual report.  in light of the planned presentation of the execut ive board compensation system to the annual general meeting for resolution on its approval the supervisory board and its personnel committee reviewed the current executive board compensation system in respect of any necessary or meaningful amendments.  at its meeting on september the supervisory board approved a reviewed and optimized executive board compensation system effective october and for firsttime application for fiscal year .  it is planned to present th is reviewed executive board compensation system to the annual general meeting for resolution on its approval,,,,,,,,,,,,,,,,0.3291022847569306,,,
2956,in light of the planned presentation of the execut ive board compensation system to the annual general meeting for resolution on its approval the supervisory board and its personnel committee reviewed the current executive board compensation system in respect of any necessary or meaningful amendments.  at its meeting on september the supervisory board approved a reviewed and optimized executive board compensation system effective october and for firsttime application for fiscal year .  it is planned to present th is reviewed executive board compensation system to the annual general meeting for resolution on its approval.  the revised executive board compensation system is also available on the companys website,,,,,,,,,,,,,,,,0.3520242554667859,,,
2963,however we also expect our business partners to act in the same way.  our code of conduct provides guidance to all employees of our company.  it applies worldwide at all our sites and summarizes the key principles and rules of our conduct as well as our behavior towards business partners and the public serving as the basis for the following topics in particular compliance with the law avoiding conflicts of interest ban on corruption and bribery fair competition antimoneylaundering trade compliance equal treatment and nondiscrimination human and workers rights co operation with employee representatives occupational health and safety sustainable environmental and climate protection donations political lobbying public appearances and communication reporting confidential company information insider information data protection and information security and protection of company property.  www,,,,,,,,,,,,,,,,,,0.23747652134521166,
